,title,subtitle,num_colors,url,price,description,details,colors,n_reviews,avg_stars,reduced_price
32,,,,/us/nmd_r1-shoes/HP3012.html,,"Limitations? Yeah, we don't believe in those. And in these adidas shoes, you don't need to either. They're made with energy-returning BOOST cushioning so you can walk all day, and the bright pops of color are here to step up your style.

Made with a series of recycled materials, this upper features at least 50% recycled content. This product represents just one of our solutions to help end plastic waste.",Lace closure; Textile upper; Textile lining; BOOST midsole; Rubber outsole; Upper contains a minimum of 50% recycled content; Imported; Product color: Cloud White / Cloud White / Bliss Orange; Product code: HP3012, Bright Orange / Bright Orange / Core Black,2374,4.5,
33,,,,/us/ozweego-celox-shoes/GV8890.html,,"Lace into these juniors' adidas OZWEEGO Celox shoes and feel limitless. Based on designs from the past and infused with modern tech to look like the future, they're comfortable enough to wear with sweat pants and bold enough to step things up a notch. Basically, whoever you decide to be today — these shoes enhance it.

Made in part with recycled content generated from production waste, e.g. cutting scraps, and post-consumer household waste to avoid the larger environmental impact of producing virgin content.","Regular fit; Lace closure; Mesh upper with molded polyurethane cage; Soft, snug and lightweight; EVA midsole with Adiprene and Adiprene+ cushioning; OrthoLite® sockliner; Rubber outsole; 25% of the components used to make the upper are made with a minimum of 50% recycled content; Imported; Product color: Aluminium / Aluminium / Core Black; Product code: GV8890",,2,5.0,
34,,,,/us/ultraboost-1.0-dna-shoes/GY9135.html,,"Why should runners get all the best shoes? These adidas running shoes work as well as an everyday pair as they do for short-distance jogs. They have all the techs that athletes love, like the incredible energy return of BOOST. The ""1.0"" in the name refers to the iteration of adidas PRIMEKNIT – it's the same pattern we used on the original Ultraboost from 2015.",Regular fit; Lace closure; adidas PRIMEKNIT upper; Fitcounter molded heel counter; BOOST midsole; Torsion System; Stretchweb outsole with Continental™ Rubber; Upper contains a minimum of 50% recycled content; Imported; Product color: Cloud White / Cloud White / Off White; Product code: GY9135, Cloud White / Team Maroon / Team Colleg Gold,330,4.7,
35,,,,/us/forum-low-cl-shoes/GW4374.html,,"Your style is ever-evolving. Choose shoes that can keep up. Like this fresh take on the adidas Forum shoes. Made with cool weather in mind, the upper mixes CORDURA® woven fabric with premium suede. The heel cord and lace toggle pop against the muted monochromatic design for an elevated look. This pair keeps the iconic details like the X-detail, hook-and-loop strap and rubber cupsole intact.

Made in part with recycled content generated from production waste, e.g. cutting scraps, and post-consumer household waste to avoid the larger environmental impact of producing virgin content.",Lace closure with adjustable hook-and-loop strap; CORDURA® fabric upper with suede overlays; Textile lining; Rubber outsole; 25% of the components used to make the upper are made with a minimum of 50% recycled content; Imported; Product color: Orbit Green / Core Black / Pulse Olive; Product code: GW4374, Orbit Green / Core Black / Pulse Olive,94,4.8,
36,,,,/us/eq21-run-2.0-sport-running-hook-and-loop-strap-shoes/GZ1801.html,,"Toddlers like to take the long route. When they stop to investigate, these infants' wide-fit shoes from adidas will help them keep their balance. They have a layered mesh upper for a breathable feel. A big hook-and-loop strap fastens in seconds, so you'll be out the door quickly. 

Made with a series of recycled materials, this upper features at least 50% recycled content. This product represents just one of our solutions to help end plastic waste.",Wide fit; Hook-and-loop closure; Sandwich mesh upper; Textile lining; Rubber outsole; Upper contains a minimum of 50% recycled content; Imported; Product color: Royal Blue / Cloud White / Blue Rush; Product code: GZ1801, Core Black / Cloud White / Core Black,5,5.0,
37,,,,/us/racer-tr21-shoes/GZ7219.html,,"These adidas shoes for kids combine a breathable mesh upper, springy Cloudfoam cushioning and a supportive heel piece for all-around comfort. Stylish details like tonal 3-Stripes and a flash of color at the outsole add the finishing touches to the running-inspired look.

Made with a series of recycled materials, this upper features at least 50% recycled content. This product represents just one of our solutions to help end plastic waste.",Regular fit; Lace closure; Mesh upper; TPU heel piece; Cloudfoam midsole; Rubber outsole; Upper contains a minimum of 50% recycled content; Imported; Product color: Carbon / Core Black / Semi Impact Orange; Product code: GZ7219,,10,4.4,
38,,,,/us/adilette-shower-slides/GZ5927.html,,"From the pool deck to the shower to the couch, these slides are made for the work-hard-rest-hard lifestyle. The slip-on construction gives you a snug fit that's easy to kick on and off as needed. Lightweight cushioning keeps your feet cradled in all-day comfort. The adidas script logo adds an extra touch of class to the iconic Adilette look.",Regular fit; Slip-on construction; Synthetic upper; Textile lining; Contoured footbed; Cloudfoam midsole; Synthetic outsole; Imported; Product color: Cloud White / Blue Rush Met / Sky Rush; Product code: GZ5927, Clear Pink / Clear Pink / Super Pop,590,4.7,
39,,,,/us/grand-court-2.0-shoes/GW9195.html,,,Imported; Product color: Cloud White / Core Black / Cloud White; Product code: GW9195, Cloud White / Cloud White / Shock Blue,23,4.8,
40,,,,/us/racer-tr21-shoes/GW4417.html,,"These adidas shoes bring the athletic style of running footwear to your everyday look. Move confidently through your day in a comfortably snug fit and a lightweight midsole that provides all-day cushioning underfoot.

This product is made with Primegreen, a series of high-performance recycled materials. 50% of the upper is recycled content. No virgin polyester.",Lace closure; Leather and textile upper; Soft feel; Cloudfoam midsole; Textile lining; Rubber outsole; Primegreen; Imported; Product color: Cloud White / Silver Metallic / Wonder White; Product code: GW4417, Core Black / Silver Metallic / Bliss Orange,620,4.6,
41,,,,/us/nizza-platform-shoes/FV5321.html,,"What do skinny jeans and flowy skirts have in common? Both look fantastic with a trendy platform like these adidas Nizza shoes. Step up, step out and give every outfit a little lift. Even if you're just knocking around town.",Lace closure; Textile upper; EVA sockliner; Vulcanized rubber platform outsole; Imported; Product color: Core Black / Cloud White / Cloud White; Product code: FV5321, Core Black / Cloud White / Cloud White,2893,4.7,
42,,,,/us/terrex-conrax-boa-rain.rdy-hiking-shoes/GY1156.html,,"Warm, dry feet make all the difference when the weather is cold and wet. Made for winter hikes, snowshoe adventures and long, cold days outdoors, these adidas Terrex winter boots are waterproof and fully insulated. COLD.RDY with PrimaLoft® wraps your foot in heat-sealing warmth, while RAIN.RDY seals out slush, snow and rain to keep feet dry all day long. A BOA® Fit System lets you dial in a precise fit for confident footing. A BOOST midsole cushions and brings energy to every step, on and off the snow and in all temperatures. The Stealth winter grip rubber provides high-friction traction for confident footing on slick, icy ground.",Micro-adjustable dial-based BOA® Fit System; Waterproof textile upper with molded toe cap and external heel clip; PrimaLoft® Parley insulation; Insulating COLD.RDY; BOOST midsole; Stealth winter grip rubber outsole; Yarn in upper contains at least 50% Parley Ocean Plastic and 50% recycled polyester; Imported; Product color: Focus Olive / Core Black / Pulse Olive; Product code: GY1156,,7,5.0,
43,,,,/us/adilette-comfort-slides/GV7085.html,,"Always be comfortable. These adidas slides keep your feet happy from the pool deck to the locker room to the couch and everywhere in-between. They slip on and off easily and deliver a relaxed fit whether you're wearing socks or going barefoot. A unique footbed design brings big beach vibes to any occasion.

Made with a series of recycled materials, this upper features at least 50% recycled content. These slides represent just one of our solutions to help end plastic waste.",Regular fit; Slip-on; Textile upper; Textile lining; Injected EVA outsole; Upper contains a minimum of 50% recycled content; Imported; Product color: Core Black / Off White / Core Black; Product code: GV7085, Signal Orange / Signal Orange / Vivid Berry,4947,4.8,
44,,,,/us/nmd_r1-tr-shoes/GX2096.html,,"The unofficial sneaker of city explorers, the adidas NMD shoes get a little update with this pair inspired by the trails. You can slip them on and off in seconds, thanks to a speed-lacing system. And you can cruise confidently through city streets with mud guards that help repel grit. Of course, it wouldn't be an NMD without technologies from the running world. BOOST cushioning and a stretchy knit upper wrap your feet in comfort. 

This shoe's upper is made with a high-performance yarn which contains at least 50% Parley Ocean Plastic — reimagined plastic waste, intercepted on remote islands, beaches, coastal communities and shorelines, preventing it from polluting our ocean. The other 50% of the yarn is recycled polyester.",Lace closure with bungee; Knit textile upper; Stretchy and snug; BOOST midsole; Mud guard; Rubber outsole; Yarn in upper contains at least 50% Parley Ocean Plastic and 50% recycled polyester; Imported; Product color: Impact Orange / Impact Orange / Metal Grey; Product code: GX2096, Metal Grey / Metal Grey / Impact Orange,9,3.1,
45,,,,/us/pureboost-22-shoes/HQ1459.html,,"You don't have to run far to feel the benefits of training. Slip on these adidas shoes, and you're only a few miles away from a good mood. They're designed for short runs, with a BOOST midsole that offers incredible energy return with every step. The Stretchweb outsole flexes naturally for an energized ride, and Continental™ Rubber gives you superior traction.",Regular fit; Lace closure; Engineered mesh upper; Adaptive feel; BOOST midsole; Textile lining; Midsole drop: 10 mm (heel: 20 mm / forefoot: 10 mm); Rubber outsole; Upper contains a minimum of 50% recycled content; Imported; Product color: Almost Blue / Core Black / Cloud White; Product code: HQ1459, Core Black / Core Black / Carbon,22,4.3,
46,,,,/us/adilette-comfort-sandals/GV9712.html,,"Slide feet first into comfort. With a classic design, these adidas slides are the epitome of versatility and laid-back vibes. A contoured footbed delivers plush cushioning. A stylish bandage upper features adidas branding.",Regular fit; Slip-on construction; Bandage upper; Contoured footbed; EVA outsole; Imported; Product color: Core Black / Cloud White / Cloud White; Product code: GV9712, Core Black / Cloud White / Cloud White,915,4.7,
47,,,,/us/adilette-comfort-sandals/GX4302.html,,Slide feet first into comfort. These adidas slides are the epitome of versatility and laid-back vibes. A contoured footbed delivers plush cushioning. The classic design features a bandage upper with 3-Stripes branding.,Regular fit; Slip-on construction; Bandage upper; Contoured footbed; EVA outsole; Imported; Product color: Bold Green / Signal Orange / Vivid Berry; Product code: GX4302, Signal Orange / Signal Orange / Vivid Berry,4947,4.8,
