,title,subtitle,num_colors,url,price,description,details,colors,n_reviews,avg_stars,reduced_price
0,FortaRun Shoes,Children Sportswear,2 colors,/us/fortarun-shoes/GV9473.html,$58,"For children who aren't tying bunny ears just yet, these kids' adidas running shoes have elastic laces that make them easy to pull on and off. A top strap ensures a snug, secure fit. On the outside, colorful details on the textile upper mean they're easy to spot on the playground. Inside, the soft Cloudfoam midsole supports all their jumps, leaps and skips. 

Made with a series of recycled materials, this upper features at least 50% recycled content. This product represents just one of our solutions to help end plastic waste.",Regular fit; Elastic laces with hook-and-loop top strap; Textile upper; Textile lining; OrthoLite® sockliner; Cloudfoam midsole; Non-marking rubber outsole; Upper contains a minimum of 50% recycled content; Imported; Product color: Core Black / Cloud White / Green Oxide; Product code: GV9473, Core Black / Cloud White / Green Oxide,39,4.7,
1,Nizza RF Shoes,Originals,2 colors,/us/nizza-rf-shoes/EF1883.html,$75,"Inspired by '80s B-ball high tops, these canvas streetwear shoes have an easygoing vibe. A versatile low-cut shape shows off a rubber toe cap and 3-Stripes. A clean-lined sole keeps the look fresh.",Regular fit; Lace closure; Canvas upper; Rubber outsole; Textile lining; Imported; Product color: Cloud White / Cloud White / Off White; Product code: EF1883, Core Black / Cloud White / Off White,173,4.4,$64
2,Ultraboost 22 Shoes,Running,26 colors,/us/ultraboost-22-shoes/GX6300.html,$190,"These Ultraboost running shoes serve up comfort and responsiveness. You'll be riding on a BOOST midsole for endless energy, with a Linear Energy Push system and a Continental™ Rubber outsole. This shoe's upper is made with a high-performance yarn which contains at least 50% Parley Ocean Plastic —  reimagined plastic waste, intercepted on remote islands, beaches, coastal communities and shorelines, preventing it from polluting our ocean.",Regular fit; Lace closure; adidas PRIMEKNIT textile upper; Soft heel fit; Linear Energy Push system; BOOST midsole; Weight: 11.7 ounces (size 9); Stretchweb outsole with Continental™ Better Rubber; Yarn in upper contains at least 50% Parley Ocean Plastic  and 50% recycled polyester; Imported; Product color: Core Black / Core Black / Almost Lime; Product code: GX6300, Cloud White / Cloud White / Vivid Red,2496,4.7,
3,Adifom SLTN Shoes,Youth Originals,4 colors,/us/adifom-sltn-shoes/FZ5636.html,$80,"Archival adidas style gets a modern update. Inspired by the original silhouette from 1998, this juniors' take on the Adifom shoes pumps up the comfort with a textile and foam lining. Recycled materials bring the shoe into the present day and beyond.

Made with a series of recycled materials, this upper features at least 50% recycled content. This product represents just one of our solutions to help end plastic waste.",Lace closure; Textile upper; Textile and foam lining; Rubber outsole; Upper contains a minimum of 50% recycled content; Imported; Product color: Grey Four / Grey Five / Carbon; Product code: FZ5636, Core Black / Core Black / Cloud White,3,5.0,
4,4DFWD Pulse 2 Shoes,Men's Running,5 colors,/us/4dfwd-pulse-2-shoes/GX9282.html,$160,"Run smooth with these adidas shoes, created using state-of-the-art 3D printing technology, with incredible smoothness, guiding your strides for a more fluid run. The 4DFWD heel is angled to increase impact absorption. Working together with the EVA midsole, this unique design translates into a smooth heel transition at the moment of touchdown while the 3 layered upper is engineered for seamless stretchable support for lateral and linear movements. AEROREADY manages moisture to keep feet feeling dry and comfortable. A rubber outsole provides superb traction for a confident stride. Made in part with recycled materials, this upper features at least 50% recycled content. This product represents just one of our solutions to help end plastic waste.",Lace closure; Engineered mesh upper; Textile lining; 3D-printed 4DFWD midsole; Midsole angled for a smooth run; Weight: 334 g (size UK 8.5); Midsole drop: 11 mm (heel: 23 mm / forefoot: 12 mm); Continental™ Rubber outsole; Upper contains a minimum of 50% recycled content; Imported; Product color: Core Black / Cloud White / Carbon; Product code: GX9282, Core Black / Solar Orange / Beam Orange,18,4.8,$144
5,S2G BOA Wide Spikeless Golf Shoes,Men's Golf,2 colors,https://www.adidas.com/us/s2g-boa-wide-spikeless-golf-shoes/GV9789.html,$110,"Bring confidence to your game in these adidas golf shoes designed for versatile performance. The Bounce midsole cushioning offers comfort and flexibility through 18 holes and beyond. The V-Traxion outsole delivers solid grip for enhanced stability on variable terrain. The waterproof upper keeps your feet dry on damp fairways, and the BOA® Fit System lets you dial in a precise fit. The spikeless design ensures an easy transition from course to clubhouse. 

Made with a series of recycled materials, this upper features at least 50% recycled content. This product represents just one of our solutions to help end plastic waste.",Wide fit; Micro-adjustable dial-based BOA® Fit System; Waterproof upper; Slow resilient sockliner; Bounce midsole; Adiwear outsole with V-Traxion; Upper contains a minimum of 50% recycled content; Imported; Product color: Core Black / Core Black / Grey Six; Product code: GV9789, Grey Two / Cloud White / Grey Three,157,4.6,
6,Superstar Shoes,Children Originals,4 colors,https://www.adidas.com/us/superstar-shoes/FU7715.html,$55,"From the basketball court to the classroom. Everyone deserves a pair of adidas Superstars Shoes. This kids' version celebrates 50 years of the classic shell-toe design. From the distinctive serrated 3-Stripes to the comfortable rubber cupsole, this anniversary edition honors an icon. Whether they sport all white, all black or something in between, these shoes keep little ones looking fresh.",Lace closure; Leather upper; Iconic leather sneakers for daily wear; Molded sockliner; Adifit length-measuring insole; Imported; Product color: Core Black / Core Black / Core Black; Product code: FU7715, Core Black / Cloud White / Core Black,440,4.8,$44
7,Superstar Shoes,Women's Originals,14 colors,https://www.adidas.com/us/superstar-shoes/HP2357.html,$100,"Debuted on the hardwood. Made famous in hip hop. Worn in every corner of the globe. The adidas Superstar shoes have truly earned the term ""iconic."" This modern pair has all the essential details, from the serrated 3-Stripes to that legendary rubber shell toe. Modern colors and a lace jewel keep the classic style fresh. 

Made in part with recycled content generated from production waste, e.g. cutting scraps, and post-consumer household waste to avoid the larger environmental impact of producing virgin content.",Lace closure; Synthetic upper; Synthetic lining; Rubber outsole; 25% of the components used to make the upper are made with a minimum of 50% recycled content; Imported; Product color: Collegiate Gold / Cloud White / Gold Metallic; Product code: HP2357, Cloud White / Ice Mint / Cloud White,10526,4.7,
8,,,,/us/adilette-boost-slides/GX4285.html,,"Transition from sandy beaches to busy streets in premium comfort all summer long. These slides feature a full-length, energy-returning midsole that cradles your foot with supreme cushioning. Classic 3-Stripes on the bandage-style upper show off your adidas style.",Regular fit; Slip-on construction; Synthetic upper; Slides with Boost cushioning; Responsive Boost midsole; Imported; Product color: Carbon / Core Black / Core Black; Product code: GX4285, Core Black / Cloud White / Core Black,2032,4.6,
9,,,,/us/adilette-slides/280647.html,,The Adilette debuted in 1970 as a shower slide for the German national football team during the world's biggest match in Mexico before being officially released back in '72. It's been a style mainstay of adidas ever since. These slides stay true to the original look with a contoured footbed and 3-Stripes across the bandage upper.,Regular fit; Slip-on design; PU-coated synthetic bandage upper; Quick-dry lining; Contoured footbed; Polyurethane outsole; Imported; Product color: Core Black / White / Core Black; Product code: 280647, Core Black / White / Core Black,5389,4.6,
10,,,,/us/hoops-3.0-mid-classic-world-friendship-day-shoes/GY4746.html,,"Lightweight and streamlined, adidas' iconic basketball designs first hit the hardwood in the '70s. Fast forward to today, and these shoes are crafted with everyday wear in mind. Of course all your buddies will want a pair too. And when you see them, you can swap heel tabs in honor of World Friendship Day.",Lace closure; Synthetic leather upper; Textile lining; Rubber cupsole; Removable hook-and-loop logo heel patch; Imported; Product color: Cloud White / Green / Royal Blue; Product code: GY4746, Core Black / Core Black / Cloud White,134,4.7,
11,,,,/us/ultraboost-22-shoes/HP2480.html,,"Every detail accounted for. The proven adidas Ultraboost running shoes are built for each run on your training plan. Hundreds of BOOST capsules are fused together for incredible energy return. An adidas PRIMEKNIT upper hugs the foot to enhance every move. The Linear Energy Push system integrates with the outsole to increase stability for a responsive feel.

This shoe's upper is made with a high-performance yarn which contains at least 50% Parley Ocean Plastic — reimagined plastic waste, intercepted on remote islands, beaches, coastal communities and shorelines, preventing it from polluting our ocean. The other 50% of the yarn is recycled polyester.",Regular fit; Lace closure; adidas PRIMEKNIT textile upper; Textile lining; Linear Energy Push system; BOOST midsole; Weight: 10.2 ounces (size 7); Continental™ Rubber outsole; Yarn in upper contains at least 50% Parley Ocean Plastic and 50% recycled polyester; Imported; Product color: Core Black / Bliss Lilac / Almost Pink; Product code: HP2480, Beam Pink / Core Black / Cloud White,937,4.7,
12,,,,/us/puffylette-shoes/HR1481.html,,"The Adilette like you've never seen it. Because while these adidas Puffylette shoes might be built on the foundation of the iconic slides, and have all their comfort, these evolve into a whole new world of 360-degree plush goodness. When you slip into them, you're slipping into more than comfort — you're slipping into warmth thanks to the PrimaLoft® insulation. A combined EVA midsole and outsole makes sure every step is cushioned. And rain is no problem here, since the water-repellent finish blocks it out. With these shoes, you're winter ready. 

Made in part with recycled content generated from production waste, e.g. cutting scraps, and post-consumer household waste to avoid the larger environmental impact of producing virgin content.",Regular fit; Slip-on; Ripstop textile upper; Water-repellent; PrimaLoft® insulation; EVA midsole and outsole; 25% of the components used to make the upper are made with a minimum of 50% recycled content; Imported; Product color: Aluminium / Off White / Charcoal Solid Grey; Product code: HR1481, Charcoal Solid Grey / Linen Green / Magic Lime,27,4.4,
13,,,,/us/five-ten-trailcross-lt-mountain-bike-shoes/EE8889.html,,"The bike is your tool for escape. The adidas Five Ten Trailcross LT bike shoes let you pedal, push and hike in any terrain with a breathable, quick-drying design for taking on adventure. Pedal-gripping treads give you full control of the pedals and sure-footed confidence off the bike.","Regular fit; Lace closure; Breathable mesh upper; Raised ankle collar height for protection; Lightweight, durable EVA midsole; Non-marking Stealth® Phantom rubber outsole; Imported; Product color: Core Black / Grey Two / Solar Red; Product code: EE8889", Core Black / Grey Two / Solar Red,361,4.6,
14,,,,/us/superstar-360-twist-shoes/GW4719.html,,"These kids' slip-on adidas Superstar shoes are made to do whatever it is they have in mind for the day. Down to play, down to chill — the stretchy, breathable design is ready for it all. The flexible, lightweight EVA cushioning keeps them comfortable no matter the pace.

Made with a series of recycled materials, this upper features at least 50% recycled content. This product represents just one of our solutions to help end plastic waste.",Slip-on; Stretch open mesh upper with synthetic suede; Snug feel; OrthoLite® sockliner; Adifit length-measuring insole; One-piece EVA outsole with deep flex grooves; Upper contains a minimum of 50% recycled content; Imported; Product color: Grey Two / Cloud White / Beam Green; Product code: GW4719,,,,
15,,,,/us/adilette-comfort-adjustable-slides/GZ5329.html,,"They'll go from their swim lesson to hanging at the beach with friends in adidas style. These kids' slides will hug your little one's feet in long-lasting, all-day cushioned comfort. An adjustable upper lets them customize their fit with ease.",Regular fit; Hook-and-loop closure; Synthetic upper; Comfortable slides with adjustable fit; Contoured footbed; Imported; Product color: Royal Blue / Cloud White / Royal Blue; Product code: GZ5329, Core Black / Cloud White / Core Black,350,4.9,
16,,,,/us/terrex-trailmaker-hiking-shoes/FW9324.html,,"Get them outside and exploring. The adidas Terrex Trailmaker Hiking Shoes let kids roam with confidence. Durable, lightweight and with a grippy outsole, they provide comfort and support on the trail. Small hands can manage the hook-and-loop strap. Traditional laces allow for a snug fit.",Lace closure with hook-and-loop strap; Textile upper with welded TPU mudguard; Lightweight and comfortable; EVA midsole; Traxion outsole; Continental™ Rubber outsole; Imported; Product color: Grey Five / Core Black / Aluminium; Product code: FW9324, Grey Five / Core Black / Aluminium,89,4.4,
17,,,,/us/x-speedportal.1-artificial-grass-soccer-cleats/GW8424.html,,"Good players create time and space. Great ones leave them both behind. Unlock multidimensional speed in adidas X Speedportal. Sleek and super-comfortable, these soccer cleats support instant reactions with a springy, full-length Carbitex carbon plate on their artificial grass outsole. Part of their foot-hugging Speedskin upper, an adaptive adidas PRIMEKNIT collar and lightweight carbon heel lock team up to keep you strapped in for light-speed sprints and physics-defying sidesteps.",Regular fit; Lace closure; Speedskin upper; adidas PRIMEKNIT collar; Carbon heel lock; Midfoot support cage; Speedframe outsole; Upper contains a minimum of 50% recycled content; Imported; Product color: Clear Aqua / Solar Red / Power Blue; Product code: GW8424,,,,
18,,,,/us/d.o.n.-issue-4-basketball-shoes/GZ2570.html,,"The future of basketball is all about speed, and Donovan Mitchell is as fast as they come. These signature shoes from Mitchell and adidas Basketball are built specifically to elevate the movements of one of the game's fastest, most dynamic scorers. Ultralight Lightstrike teams up with a LIGHTLOCK upper for a snug fit and a propulsion system that won't weigh you down. A totally unique rubber outsole is designed to generate traction where you need it most, so every hard-charging cut and head fake has total support. Mitchell's Spida logo and signature graphics provide the finishing touch.

Made in part with recycled content generated from production waste, e.g. cutting scraps, and post-consumer household waste to avoid the larger environmental impact of producing virgin content.",Regular fit; Lace closure; LIGHTLOCK upper; Lightweight feel; Textile lining; Lightstrike cushioning; Rubber outsole; 25% of the components used to make the upper are made with a minimum of 50% recycled content; Imported; Product color: Impact Orange / Collegiate Gold / Core Black; Product code: GZ2570, Vivid Red / Core Black / Team Victory Red,29,4.4,
19,,,,/us/nizza-hi-rf-x-andré-saraiva-shoes/GZ2204.html,,"Feel the love. A collaboration with graffiti icon André Saraiva, these adidas Nizza sneakers transform a classic look into a message of affection for the Earth. See the stick-figure Mr. A smiling off the side? That's exactly what he stands for.

Made with a series of recycled materials, this upper features at least 50% recycled content. This product represents just one of our solutions to help end plastic waste.",Lace closure; Textile upper; Textile lining; Rubber outsole; Upper contains a minimum of 50% recycled content; Imported; Product color: Cream White / Core Black / Pantone; Product code: GZ2204, Crew Red / Wonder White / Wonder White,397,4.6,
20,,,,/us/adilette-comfort-slides/GZ5895.html,,"Whether you're heading to the locker room after an intense gym session or at home recovering on the couch, these slides keep your feet wrapped in lightweight comfort. Pair them with socks and shorts for your post-workout look or with your favorite swimwear for the ultimate beach vibe. The adidas 3-Stripes design completes your sport style.",Regular fit; Slip-on construction; Synthetic upper; Textile lining; Lightweight cushioning; Contoured footbed; EVA outsole; Imported; Product color: Cloud White / Core Black / Grey Three; Product code: GZ5895, Core Black / Core White / Grey Six,9747,4.7,
21,,,,/us/retropy-f2-shoes/GX9237.html,,"Past, meet present. '80s inspiration pulses through these adidas Retropy F2 Shoes, bringing a little retro nostalgia to toddlers' feet They take their cues from archival running styles, which means they know a thing or two about comfort. No matter what that looks like for your little one, they're set up for success with a lightweight EVA cushioning and a durable textile upper with suede and mesh overlays.

Made in part with recycled content generated from production waste, e.g. cutting scraps, and post-consumer household waste to avoid the larger environmental impact of producing virgin content.",Elastic Lace closure; Textile upper with stitched suede and mesh overlays; OrthoLite® sockliner; Adifit length-measuring insole; One-piece EVA outsole; 25% of the components used to make the upper are made with a minimum of 50% recycled content; Imported; Product color: Team Mid Grey / Blue Rush / Cloud White; Product code: GX9237, Team Mid Grey / Blue Rush / Cloud White,,,
22,,,,/us/daily-3.0-shoes/FW3270.html,,"A fresh take on a classic, these adidas shoes blend a heritage feel with modern materials and design. Your walk across campus has never looked or felt this good.",Regular fit; Lace closure; Washed canvas upper; Breathable feel; Everyday skate trainer; OrthoLite® sockliner; Rubber outsole with vulcanized look; Imported; Product color: Dove Grey / Core Black / Cloud White; Product code: FW3270, Dove Grey / Core Black / Cloud White,1898,4.7,
23,,,,/us/adilette-shower-slides/GZ5921.html,,"From the pool deck to the shower to the couch, these slides are made for the work-hard-rest-hard lifestyle. The slip-on construction gives you a snug fit that's easy to kick on and off as needed. Lightweight cushioning keeps your feet cradled in all-day comfort. The adidas logo and 3-Stripes design complete the iconic Adilette style.",Regular fit; Slip-on construction; Synthetic upper; Textile lining; Contoured footbed; Cloudfoam midsole; Synthetic outsole; Imported; Product color: Cloud White / Core Black / Cloud White; Product code: GZ5921, Royal Blue / Cloud White / Royal Blue,55,4.4,
24,,,,/us/predator-edge.3-laceless-firm-ground-soccer-cleats/GW0999.html,,"Swerve. Control. Power. adidas Predator has all angles covered. Hit the pitch and find your edge in these firm ground soccer cleats. Deployed across their laceless coated textile upper, grippy Control Zone print assists you with every touch of the ball. Underneath, an eye-catching, angular TPU outsole ensures you stay in charge on dry natural grass.",Regular fit; Laceless construction; Control Zone textured upper; Stretchy mid-cut collar; Textile lining; TPU firm ground outsole; Imported; Product color: Cloud White / Solar Yellow / Power Blue; Product code: GW0999, Cloud White / Solar Yellow / Power Blue,128,4.4,
25,,,,/us/ultraboost-5.0-dna-shoes/GV8737.html,,"What do you get when you take a beloved running shoe and tweak it for everyday wear? The Ultraboost DNA. This iteration lives up to its namesake with BOOST for energy return and all-day comfort. The foot-hugging adidas PRIMEKNIT shows off contrasting weave details, making it a legend on its own.

This shoe's upper is made with a high-performance yarn which contains at least 50% Parley Ocean Plastic — reimagined plastic waste, intercepted on remote islands, beaches, coastal communities and shorelines, preventing it from polluting our ocean. The other 50% of the yarn is recycled polyester.",Regular fit; Lace closure; adidas PRIMEKNIT upper; Fitcounter molded heel counter; BOOST midsole; Torsion System; Stretchweb outsole with Continental™ Rubber; Yarn in upper contains at least 50% Parley Ocean Plastic and 50% recycled polyester; Imported; Product color: Bliss Lilac / Bliss Lilac / Beam Orange; Product code: GV8737, Magic Mauve / Magic Mauve / Ecru Tint,1397,4.7,
26,,,,/us/retropy-e5-shoes/GX1812.html,,"Retro vibes meets modern proportions. With the adidas Retropy E5 Shoes, we used the famed Racing 1 as the design foundation to craft a silhouette filled with equal parts nostalgia, modernity and comfort. Plush BOOST cushioning returns energy with every step that you take.

Made in part with recycled content generated from production waste, e.g. cutting scraps, and post-consumer household waste to avoid the larger environmental impact of producing virgin content.",Lace closure; Perforated leather upper with stitched suede overlays; BOOST midsole; Textile lining; Rubber outsole; 25% of the components used to make the upper are made with a minimum of 50% recycled content; Imported; Product color: Off White / Off White / Grey One; Product code: GX1812, Frost Pink / Almost Pink / Ecru Tint,48,4.8,
27,,,,/us/geodiver-primeblue-shoes/FX5079.html,,"Style or planet? No need to pick sides. Lace into the streamlined design of these sporty shoes and join in adidas' commitment to help end plastic waste. Their minimalist upper is made with recycled materials and a partially recycled EVA midsole that keeps you walking on clouds. Sometimes, less is more.

This product is made with Primeblue, a high-performance recycled material made in part with Parley Ocean Plastic. 50% of the upper is textile, 75% of the textile is Primeblue yarn. No virgin polyester.",Lace closure; Textile upper; Comfortable and lightweight; EVA midsole and outsole; Textile lining; Rubber insert on the outsole; Primeblue; Imported; Product color: Cloud White / Cloud White / Core Black; Product code: FX5079,,782,4.6,
28,,,,/us/nmd_v3-shoes/GY4134.html,,"Go ahead and check all the boxes with these adidas NMD_V3 Shoes. Breathable. Comfortable. Made with recycled materials. That's a yes to all three. Plus there's the style, like the perforated details, which is also where that breathability comes in. Playing with transparency, the 3-Stripes layer over the perforations, giving a glimpse at them underneath the monochrome signoff.

This shoe's upper is made with a high-performance yarn which contains at least 50% Parley Ocean Plastic — reimagined plastic waste, intercepted on remote islands, beaches, coastal communities and shorelines, preventing it from polluting our ocean. The other 50% of the yarn is recycled polyester.",Lace closure; Textile upper; Textile lining; BOOST midsole; Rubber outsole; Yarn in upper contains at least 50% Parley Ocean Plastic and 50% recycled polyester; Imported; Product color: Royal Blue / Crystal White / Core Black; Product code: GY4134, Grey One / Off White / Halo Silver,38,4.5,
29,,,,/us/lite-racer-adapt-4.0-slip-on-shoes/GW7150.html,,"Let your little one slide into these toddlers' adidas shoes. No laces means less time tying their shoes. They're made with a breathable mesh upper that contours around their little feet and an elastic strap to add stability. A pull tab at the heel makes it easy to put them on or take them off. The Cloudfoam midsole is soft and cushy to keep them comfortable throughout the day. 

Made with a series of recycled materials, this upper features at least 50% recycled content. This product represents just one of our solutions to help end plastic waste.",Regular fit; Pull-on construction; Mesh upper; Breathable feel; Textile lining; Cloudfoam midsole; EVA outsole; Upper contains a minimum of 50% recycled content; Imported; Product color: Core Black / Core Black / Beam Pink; Product code: GW7150,,30,4.6,
30,,,,/us/matchcourse-spikeless-golf-shoes/GV9775.html,,"When your day includes a casual round plus a whole lot more, these adidas slip-on golf shoes see you through. The water-resistant vegan upper keeps your feet dry on damp fairways, and fish-scale Traxion provides grip. The spikeless Adiwear outsole lets you transition from the last green to your postgame plans without missing a beat.",Regular fit; Slip-on; Water-resistant vegan upper; Slow resilient sockliner; Fish-scale Traxion; Spikeless Adiwear outsole; Vegan alternative: At least 25% recycled content; Imported; Product color: Cloud White / Pulse Amber / Chalk White; Product code: GV9775, Cloud White / Pulse Amber / Chalk White,53,4.7,
