,title,subtitle,num_colors,url,price,description,details,colors,n_reviews,avg_stars,reduced_price
33,,,,/us/oznova-w/HP3371.html,,,Imported; Product color: Core Black / Matte Silver / Purple Tint; Product code: HP3371, Cloud White / Ecru Tint / Wonder White,13,4.5,
34,,,,/us/the-road-cycling-shoes/GX1661.html,,"Long climb or winding descent, the adidas Road Cycling Shoes ensure a stiff, responsive feel and extended comfort. The seamless, breathable Primeweave upper and adaptive tongue conform to the foot for a supportive, sock-like fit. A stiff platform transfers energy from every pedal stroke for efficient pedaling. The shoes are three-bolt cleat compatible for use with most road pedal systems.",Regular fit; Lace closure and adaptive tongue construction; Seamless Primeweave upper with TPU overlays; Breathable and stable feel; Internal heel counter cups; Fiberglass-reinforced nylon midsole plate; Three-bolt cleat compatibility; Upper contains a minimum of 50% recycled content; Imported; Product color: Cloud White / Core Black / Beam Green; Product code: GX1661, Core Black / Cloud White / Core Black,303,4.6,
35,,,,/us/adizero-afterburner-nwv-turf-shoes/GZ4584.html,,"Turn on the jets and don't look back. These adidas baseball shoes are designed to let you tear up the turf the way you know how. The LIGHTLOCK upper gives you a lockdown feel without weighing you down. A Lightstrike midsole cushions that explosive first step so you can turn on a dime and make throws with confidence.

Made in part with recycled content generated from production waste, e.g. cutting scraps, and post-consumer household waste to avoid the larger environmental impact of producing virgin content.",Lace closure; LIGHTLOCK upper; Lightstrike midsole; Textile lining; Rubber outsole; 25% of the components used to make the upper are made with a minimum of 50% recycled content; Imported; Product color: Cloud White / Gold Metallic / Cloud White; Product code: GZ4584, Cloud White / Gold Metallic / Cloud White,2,5.0,
36,,,,/us/five-ten-freerider-pro-mountain-bike-shoes/FX4454.html,,"The adidas Five Ten Freerider Pro Mountain Bike Shoes match proven flat pedal control with enhanced impact coverage and a quick-drying synthetic upper. Cushioned and water-resistant, they offer comfort for full days on and off the bike. Stealth® S1™ rubber and a Dotty tread offer the legendary pedal control you expect from the Freerider.

This product is made with recycled content as part of our ambition to end plastic waste. 20% of pieces used to make the upper are made with minimum 50% recycled content.",Lace closure; Fast-drying synthetic upper; OrthoLite® sockliner; Molded EVA midsole; Impact-resistant toe box; Stealth® S1™ Dotty rubber outsole; Imported; Product color: Hazy Emerald / Hazy Emerald / Sand; Product code: FX4454, Core Black / Crystal White / Acid Mint,28,4.5,
37,,,,/us/crazyflight-volleyball-shoes/FY1638.html,,"Controlling the court isn't always enough in indoor sports. So when you need to dominate the air too, pull on these adidas Crazyflight shoes. Sitting within a stabilizing EVA frame, their Boost midsole provides ignition for big jumps and cushioning for graceful landings. Lightweight and foot-hugging, the mesh upper has a TPU-reinforced midfoot so you stay supported when you're back on the ground.",Regular fit; Lace closure; Durable lightweight stretch mesh upper; Molded sockliner with suede-lined heel; TPU yarn midfoot reinforcements; Boost midsole; Top Grip rubber outsole; Primegreen; Imported; Product color: Core Black / Cloud White / Core Black; Product code: FY1638, Cloud White / Team Navy / Team Navy,113,4.4,
38,,,,/us/the-road-cycling-shoes/GY6829.html,,"Long climb or winding descent, the adidas Road Cycling Shoes ensure a stiff, responsive feel and extended comfort. The seamless, breathable Primeweave upper and adaptive tongue conform to the foot for a supportive, sock-like fit. A stiff platform transfers energy from every pedal stroke for efficient pedaling. The shoes are three-bolt cleat compatible for use with most road pedal systems.",Regular fit; Lace closure and adaptive tongue construction; Seamless Primeweave upper with TPU overlays; Breathable and stable feel; Internal heel counter cups; Fiberglass-reinforced nylon midsole plate; Three-bolt cleat compatibility; Upper contains a minimum of 50% recycled content; Imported; Product color: Blue Rush / Bliss Blue / Royal Blue; Product code: GY6829, Core Black / Cloud White / Core Black,303,4.6,
39,,,,/us/gamemode-firm-ground-soccer-cleats/GV6869.html,,"Let your feet do the talking on the pitch. Express your beautiful game in adidas Gamemode with a choice of styles and designs. Created with a comfortable fit for a wide range of foot shapes, these juniors' soccer cleats offer a cushioned touch thanks to their soft HybridTouch upper. The versatile outsole will help you show your skills on both firm ground and artificial grass. The graphics take their eye-catching inspiration from LEGO® bricks.",Regular fit; Lace closure; HybridTouch synthetic upper; TPU heel clip; Hybrid outsole for firm and artificial surfaces; Imported; Product color: Carbon / Red / Bright Blue; Product code: GV6869, Carbon / Red / Bright Blue,49,4.7,
40,,,,/us/copa-nationale-shoes/GY6917.html,,"Inspired by adidas' bold indoor football heritage, the Copa Nationale is a tech-forward shoe that pushes design and performance for skateboarding. An advanced shoe with modern design, the Copa Nationale offers a flexible cupsole construction for grip and boardfeel, a high-grade EVA midsole, and molded Adiprene sockliner offers stability and a responsive fit. The abrasion-resistant Adituff toe reinforcement offers durability with a sleek, football-inspired design aesthetic.",Regular fit; Lace closure; Abrasion-resistant Adituff toe; Adiprene cushioning; High-grade EVA midsole; Low-profile flexible cupsole; Imported; Product color: Cloud White / Blue Bird / Scarlet; Product code: GY6917, Core Black / Cloud White / Gold Metallic,244,4.6,
41,,,,/us/web-boost-running-shoes/GZ6447.html,,"Getting in a few miles or running to the store. These adidas shoes have all the techs to make short-distance training a breeze, and you'll want to wear them on rest days too. The upper has cutouts for airflow, acting like a harness for the stretchy inner bootie. The BOOST midsole is wrapped in 3D Stretchweb to enhance the feeling of energy return.",Regular fit; Lace closure; Textile upper; BOOST midsole; Textile lining; Rubber outsole; Upper contains a minimum of 50% recycled content; Imported; Product color: Chalk White / Impact Orange / Legend Ink; Product code: GZ6447, Cloud White / Grey Two / Crystal White,7,4.7,
42,,,,/us/flopshot-spikeless-golf-shoes/GV9670.html,,"When you want casual style without sacrificing performance on the course, these adidas golf leather shoes have you covered. BOOST cushioning delivers energy return while a soft heel pad offers comfort with each step to keep you feeling comfortable through your round and beyond. The spikeless flexible outsole provides flexibility and grip on any terrain and transitions easily from course to clubhouse.",Regular fit; Lace closure; Waterproof leather upper; Slow resilient sockliner; BOOST midsole; Spikeless flexible outsole; 25% of the components used to make the upper are made with a minimum of 50% recycled content; Imported; Product color: Core Black / Grey Six / Legacy Burgundy; Product code: GV9670, Cloud White / Gold Metallic / Blue Rush,94,4.4,
43,,,,/us/tennis-hu-shoes/GZ9531.html,,"Pharrell Williams is an anomaly. There isn't one singular path he follows, though he does lead with confidence into unknown territories. There are many reasons for our ongoing collaboration, and these adidas Tennis Hu shoes showcase one of them — his perspective. The streamlined look stays true to its sporty roots with a flexible adidas PRIMEKNIT upper.",Lace closure; adidas PRIMEKNIT textile upper; Textile lining; Rubber outsole; Imported; Product color: Night Marine / Clear Blue / Chalk White; Product code: GZ9531, Cinder / Cinder / Light Brown,139,4.6,
44,,,,/us/y-3-makura/HQ5974.html,,,Imported; Product color: Core White / Cream White / Orange; Product code: HQ5974, Core White / Cream White / Orange,,,
45,,,,/us/adidas-by-stella-mccartney-solarglide-running-shoes/GY6095.html,,"If you're looking for a running shoe that can elevate any outfit, the adidas by Stella McCartney Solarglide Running Shoes might just be it.

The lightweight Primeknit upper made in part with recycled materials will keep your feet snug on any run around 10k. The striking speed-inspired cage is made from bio-based EVA. The cage is built to give you extra support with every step, and it gives the shoes their characteristic Stella McCartney look. 

Whether you wear these shoes when you go for a run or throughout your day, you'll feel energized with every step thanks to the flexible outsole and BOOST midsole. They complete any outfit as a statement piece.",Regular fit; Lace closure; adidas PRIMEKNIT textile upper; Hugs the foot; BOOST midsole; Rubber outsole; adidas by Stella McCartney logo; Vegan alternative: At least 25% recycled content; Imported; Product color: Cloud White / Active Orange / White Vapour; Product code: GY6095, Core Black / Active Purple / Shock Yellow,65,4.4,
46,,,,/us/exhibit-b-mid-basketball-shoes/GY8978.html,,"Built for the positionless basketball player, these adidas shoes suit the athlete that wants to do it all on the court. The upper has prototype design lines to give it a unique, factory-like design. Lightstrike cushioning reacts to every move you make on the court without weighing you down. The tread pattern on the outsole gives you traction when you change directions or stop on a dime for that pull-up jumper.

Made in part with recycled content generated from production waste, e.g. cutting scraps, and post-consumer household waste to avoid the larger environmental impact of producing virgin content.",Regular fit; Lace closure; Mesh upper with leather eyestay overlay; Textile lining; Chunky sculpted midsole; Lightstrike cushioning; 25% of the components used to make the upper are made with a minimum of 50% recycled content; Imported; Product color: Grey Two / Cloud White / Core Black; Product code: GY8978, Grey Two / Cloud White / Core Black,,,
47,,,,/us/gazelle-indoor-shoes/H06272.html,,"Created for indoor sports back in the '70s, the adidas Gazelle Indoor Shoes have spent many years floating through different subcultures. From music to fashion, their mark is clear. The iconic low-profile sneakers get a slight update here with a premium nylon upper detailed with luxe suede overlays. All of it rides on semi-translucent tooling.",Regular fit; Lace closure; Nylon upper with suede overlays; Leather lining; Leather sockliner; Gum rubber outsole; Imported; Product color: Shadow Green / Shadow Green / Shadow Green; Product code: H06272, Mesa / Mesa / Mesa,25,5.0,
