,title,subtitle,num_colors,url,price,reduced_price,description,details,colors,n_reviews,avg_stars
0,Atlanta United FC Ultraboost DNA x Copa Shoes,Sportswear,7 colors,/us/atlanta-united-fc-ultraboost-dna-x-copa-shoes/HQ5903.html,$200,$120,"Celebrate your favorite major league club every time you lace up. The Ultraboost x Copa collaboration brings a classic soccer shoe look to comfortable, everyday running shoes. The responsive midsole fuses hundreds of adidas BOOST capsules for incredible energy return to power your daily adventures.

Made with a series of recycled materials, this upper features at least 50% recycled content. This product represents just one of our solutions to help end plastic waste.",Regular fit; Lace closure; Textile upper; BOOST midsole; Textile lining; Rubber outsole; Upper contains a minimum of 50% recycled content; Imported; Product color: Core Black / Team Victory Red / Cloud White; Product code: HQ5903, Core Black / Team Victory Red / Cloud White,21,4.8
1,Superstar 360 Shoes,Children Originals,2 colors,/us/superstar-360-shoes/GX1869.html,$60,$36,"Help them shake up their sneaker game with this fun take on the adidas Superstar 360 shoes. Kids will delight in the colorful allover print of Trefoil logos. Lightweight EVA cushioning and deep flex grooves ensure maximum comfort and movement.

Made with a series of recycled materials, this upper features at least 50% recycled content. This product represents just one of our solutions to help end plastic waste.",Regular fit; Slip-on; Two-layer mesh upper; Stretchy and snug; OrthoLite® sockliner; Adifit length-measuring insole; One-piece EVA outsole with deep flex grooves; Upper contains a minimum of 50% recycled content; Imported; Product color: Almost Blue / Core Black / Cloud White; Product code: GX1869, Core Black / Cloud White / Semi Impact Orange,5,5.0
2,Stan Smith Shoes,Infant & Toddler Originals,,/us/stan-smith-shoes/HP9762.html,$60,$36,"The adidas Stan Smith shoes of today wouldn't be what they are without their past, and every part of that past is what helps inform our future. This infants' version of the legendary icon rides on that DNA, showcasing the same look that started it all, but does it up in recycled materials as part of our commitment to change for the future. All the signature details still remain though — like the perforated 3-Stripes — but this upper showcases a subtle snakeskin print and a sequined Trefoil patch.

Made with a series of recycled materials, this upper features at least 50% recycled content. This product represents just one of our solutions to help end plastic waste.",Regular fit; Hook-and-loop straps; Synthetic leather upper; OrthoLite® sockliner; Adifit length-measuring insole; Recycled rubber outsole made with 10% recycled material derived from production waste; Upper contains a minimum of 50% recycled content; Imported; Product color: Core White / Core White / Beam Orange; Product code: HP9762,,,
3,ULTRABOOST 22 BCA RUNNING SHOES,Women's Running,23 colors,/us/ultraboost-22-bca-running-shoes/HP9553.html,$190,$143,"The adidas Breast Cancer Awareness Collection is a limited edition product range featuring the Five Ten Freerider, Terrex Agravic, Terrex Free Hiker and adidas UltraBoost, accompanied by an exclusive apparel collection.
The collection brings together pink color detailing with graphic illustrations from athlete Veronique Sandler that unites the mountains, bikes and the great outdoors together in this playful yet powerful collection.",Regular fit; Lace closure; adidas PRIMEKNIT textile upper; Linear Energy Push system; BOOST midsole; Weight: 10.2 ounces (size 7); Midsole drop: 10 mm; Stretchweb outsole with Continental™ Better Rubber; Yarn in upper contains at least 50% Parley Ocean Plastic and 50% recycled polyester; Imported; Product color: Bliss Lilac / Beam Orange / Pulse Magenta; Product code: HP9553, Beam Pink / Core Black / Cloud White,933,4.7
4,Adilette Slides,Women's Originals,11 colors,/us/adilette-slides/GX9484.html,$50,$20,"There is simply no wrong way (or place) to wear the adidas Adilette slides. That's the beauty of them. They're the epitome of comfort, which is why we don't just suggest starting the day in them, we highly recommended ending the night in them too. Especially with the graphic pops on the synthetic upper, which add a colorful, carefree edge to any look — dressed up or played down.",Slip-on; Synthetic upper; Textile lining; Cork footbed; Rubber outsole; Imported; Product color: Glory Mint / Cloud White / Gum; Product code: GX9484, Beam Orange / Cloud White / Gum,34,4.3
5,Ubersonic 4 Kids Shoes,Children Tennis,2 colors,https://www.adidas.com/us/ubersonic-4-kids-shoes/GY4020.html,$55,$33,"Speed buys time. Time earns points. That's why these adidas Ubersonic 4 Kids Shoes tennis shoes were created to get you to the ball faster. Their comfortable mesh upper includes heel padding to lock you in for lightning sprints. EVA midsole cushioning makes for soft landings and a grippy Adiwear outsole keeps you quick on multiple surfaces.

Made with a series of recycled materials, this upper features at least 50% recycled content. This product represents just one of our solutions to help end plastic waste.",Sock-like fit; Lace closure; Mesh upper; Reinforced toe area; Textile lining; EVA midsole; Rubber outsole; Upper contains a minimum of 50% recycled content; Imported; Product color: Cloud White / Pulse Blue / Core Black; Product code: GY4020, Cloud White / Core Black / Solar Red,39,4.8
6,D.O.N. Issue #4 Basketball Shoes,Basketball,9 colors,https://www.adidas.com/us/d.o.n.-issue-4-basketball-shoes/GY6509.html,$120,,"The future of basketball is all about speed, and Donovan Mitchell is as fast as they come. The newest signature shoes from Mitchell and adidas Basketball are built specifically to elevate the on-court movements of one of the game's fastest, most dynamic scorers. Ultralight Lightstrike teams up with a LIGHTLOCK upper for a snug fit and a propulsion system that won't weigh you down. A totally unique rubber outsole is designed to generate traction where you need it most, so every hard-charging cut and head fake has total support. Mitchell's Spida logo and signature graphics provide the finishing touch.

Made in part with recycled content generated from production waste, e.g. cutting scraps, and post-consumer household waste to avoid the larger environmental impact of producing virgin content.","Regular fit; Lace closure; LIGHTLOCK upper; Lightweight, cushioned feel; Textile lining; Lightstrike cushioning; Rubber outsole; 25% of the components used to make the upper are made with a minimum of 50% recycled content; Imported; Product color: Cloud White / Grey One / Grey Two; Product code: GY6509", Vivid Red / Core Black / Team Victory Red,29,4.4
7,NMD_R1 Shoes,Youth Originals,2 colors,https://www.adidas.com/us/nmd_r1-shoes/HQ6183.html,$130,$78,"Don't shy away from making a statement. These juniors' adidas NMD_R1 Shoes stay true to the original '80s-inspired silhouette that's become iconic across the globe while introducing two fun patterns to play with. The stretchy mesh upper hugs your feet for comfort on the go. Long commutes and slick city sidewalks are no problem, thanks to energy-returning BOOST midsole cushioning and the grippy rubber outsole beneath your feet.

This shoe's upper is made with a high-performance yarn which contains at least 50% Parley Ocean Plastic — reimagined plastic waste, intercepted on remote islands, beaches, coastal communities and shorelines, preventing it from polluting our ocean. The other 50% of the yarn is recycled polyester.",Regular fit; Lace closure; Mesh upper; Textile lining; BOOST midsole; Rubber outsole; Yarn in upper contains at least 50% Parley Ocean Plastic and 50% recycled polyester; Imported; Product color: Core Black / Cloud White / Core Black; Product code: HQ6183, Core Black / Cloud White / Core Black,1,5.0
8,,,,/us/response-shoes/GX2005.html,,,"These shoes are designed to give you that cushioning and responsiveness that you need when you're hitting the track or trail. Whether you're going on your daily walk or fitting in a quick run, the Bounce midsole is flexible and responsive in every step. Made with a series of recycled materials, this upper features at least 50% recycled content. This product represents just one of our solutions to help end plastic waste.",Regular fit; Lace closure; Sandwich mesh upper with padded collar; Textile lining; Fitcounter molded heel counter; Bounce midsole; Synthetic outsole; Upper contains a minimum of 50% recycled content; Imported; Product color: Cloud White / Altered Blue / Beam Pink; Product code: GX2005, Bliss Lilac / Silver Metallic / Wonder Steel,9,4.3
9,,,,/us/exhibit-b-mid-basketball-shoes/HQ1121.html,,,"Built for the positionless basketball player, these adidas shoes suit the athlete who wants to do it all on the hardwood. Metallic-gold hits throughout the upper and a speckled midsole meet the prototype design lines for a unique look. Lightstrike cushioning reacts to every move you make on the hardwood without weighing you down. The tread pattern on the outsole gives you traction when you change directions or stop on a dime for that pull-up jumper.

Made in part with recycled content generated from production waste, e.g. cutting scraps, and post-consumer household waste to avoid the larger environmental impact of producing virgin content.",Regular fit; Lace closure; Textile upper; Lightstrike cushioning; Tongue and heel pulls; Rubber outsole; 25% of the components used to make the upper are made with a minimum of 50% recycled content; Imported; Product color: Core White / Gold Metallic / Cloud White; Product code: HQ1121, Grey Two / Cloud White / Core Black,,
10,,,,/us/ultraboost-1.0-georgia-tech/HQ5882.html,,,"Bring your Yellow Jackets spirit along for the ride every time you lace up in these Ultraboost running shoes. Comfy BOOST cushioning keeps you energized from start to finish, and adidas PRIMEKNIT flexes and supports the foot with every step. Attach the webbing strips to your laces and show your team pride.

This shoe's upper is made with a high-performance yarn which contains at least 50% Parley Ocean Plastic — reimagined plastic waste, intercepted on remote islands, beaches, coastal communities and shorelines, preventing it from polluting our ocean. The other 50% of the yarn is recycled polyester.

Featured above and throughout the campaign is Erin Moss, a senior on the Georgia Tech volleyball team. She started playing in seventh grade at Valwood School in her hometown of Valdosta, GA. When she reached her freshman year in high school, she was already being recruited by Georgia Tech. It was her dream school, and she excels there on and off the court. Erin is studying chemical engineering and has made the academic honor roll multiple times.

Featured above and throughout the campaign is Erin Moss, a senior on the Georgia Tech volleyball team. She started playing in seventh grade at Valwood School in her hometown of Valdosta, GA. When she reached her freshman year in high school, she was already being recruited by Georgia Tech. It was her dream school, and she excels there on and off the court. Erin is studying chemical engineering and has made the academic honor roll multiple times.",Regular fit; Lace closure; adidas PRIMEKNIT upper; Interchangeable webbing strips; BOOST midsole; Torsion System; Rubber outsole; Yarn in upper contains at least 50% Parley Ocean Plastic and 50% recycled polyester; Imported; Product color: Cloud White / Team Sand / Collegiate Navy; Product code: HQ5882, Cloud White / Team Maroon / Team Colleg Gold,330,4.7
11,,,,/us/superstar-shoes/GX9876.html,,,"Game day or any day. Your love for your national team never fades. And with these adidas Superstar shoes, you can rep it everywhere you go. At the grocery store, in the stands or on city streets, your country's colors stand out bright from the smooth leather upper. And because we like to keep things iconic, the rubber shell toe is here in true form — a classic detail that's been famous for over 50 years.

Made in part with recycled content generated from production waste, e.g. cutting scraps, and post-consumer household waste to avoid the larger environmental impact of producing virgin content.",Regular fit; Lace closure; Leather upper; Molded sockliner; Synthetic lining; Rubber outsole; 25% of the components used to make the upper are made with a minimum of 50% recycled content; Imported; Product color: Cloud White / Off White / Light Blue; Product code: GX9876, Core Black / Core Black / Core Black,2591,4.7
12,,,,/us/adilette-tnd-slides/GX9705.html,,,"Inspired by the beloved adidas classic, these Adilette slides bring versatile comfort and sporty style to any occasion. The hook-and-loop top strap adjusts easily for a snug fit, while the quick-dry footbed is right at home from the pool deck to the locker room to the beach. A unique design shows some love for the Argentine Football Association.",Regular fit; Hook-and-loop strap; EVA upper; Cloudfoam footbed; Textile lining; EVA outsole; Imported; Product color: Core Black / Cloud White / Light Blue; Product code: GX9705, Core Black / Cloud White / Light Blue,269,4.7
13,,,,/us/pureboost-22-shoes/HQ1450.html,,,"You don't need a lot to go running. A snack, a playlist and these adidas running shoes will keep you going for the next few miles. Cushioned and responsive, Pureboost is an ultra-comfortable training shoe for short daily runs. adidas BOOST delivers incredible energy return with each step, and the Stretchweb rubber outsole flexes underfoot for an energized ride.","Regular fit; Lace closure; Engineered mesh upper; Cushioned, responsive feel; Textile lining; BOOST midsole; Midsole drop: 10 mm (heel: 20 mm / forefoot: 10 mm); Stretchweb rubber outsole; Upper contains a minimum of 50% recycled content; Imported; Product color: Solar Yellow / Core Black / Cloud White; Product code: HQ1450", Core Black / Core Black / Core Black,44,4.6
14,,,,/us/forum-84-low-aec-shoes/HR0557.html,,,"These adidas Forum shoes look like they're straight from 1984. Not just because they have the same details, patterns and materials as the '84 OG, but because they're purposefully made to look like they've been worn for decades (with care, of course). The premium leather upper is hand-treated and detailed with nylon and synthetic leather accents.

Made in part with recycled content generated from production waste, e.g. cutting scraps, and post-consumer household waste to avoid the larger environmental impact of producing virgin content.",Regular fit; Lace closure with adjustable strap; Leather and nylon upper; Synthetic leather lining; Mesh sockliner; Rubber outsole; 25% of the components used to make the upper are made with a minimum of 50% recycled content; Imported; Product color: Cloud White / Red / Cloud White; Product code: HR0557, Cloud White / Red / Cloud White,3,5.0
15,,,,/us/superstar-shoes/GY9328.html,,,"Throw it back to '70s Southern California skateboard culture in these juniors' adidas Superstar shoes. You can almost see the ollies and half pipes, and hear the growl of wheels on concrete. Originally made for B-ballers in 1970, this sneaker was embraced by skaters early on. In this version, the classic 3-Stripes get doused in three tonal colors for a fresh update. But the traditional signature rubber shell toe and cupsole keep the look legit.

Made with a series of recycled materials, this upper features at least 50% recycled content. This product represents just one of our solutions to help end plastic waste.",Lace closure; Synthetic upper; Textile lining; Molded sockliner; Rubber outsole; Upper contains a minimum of 50% recycled content; Imported; Product color: Cloud White / Clear Pink / Bliss Pink; Product code: GY9328, Cloud White / Bliss Blue / Pulse Blue,9,4.9
16,,,,/us/mundial-team-soccer-shoes/019228.html,,,"Crafted to deliver a world-class fit and touch, the Mundial continues its domination of courts across the globe. The suede and leather upper on these soccer shoes provides step-in comfort and assured control. A rubber outsole improves stability on turf and hard ground, while a foam midsole cushions every step.",Lace closure; Suede and leather upper; Soft synthetic lining; Traxion outsole; Die-cut EVA insole; Molded EVA midsole; Imported; Product color: Black / Cloud White / Red; Product code: 019228,,551,4.6
17,,,,/us/adifom-sltn-shoes/HP6490.html,,,"Archival adidas style gets a modern update. Inspired by the original silhouette from 1998, this take on the Adifom shoes pumps up the comfort with a textile and foam lining. Recycled materials bring the shoe into the present day and beyond. 

Made with a series of recycled materials, this upper features at least 50% recycled content. This product represents just one of our solutions to help end plastic waste.",Lace closure; Synthetic upper; Textile and foam lining; Rubber outsole; Upper contains a minimum of 50% recycled content; Imported; Product color: Magic Mauve / Burgundy / Shadow Maroon; Product code: HP6490, Ecru Tint / Bliss Orange / Cloud White,4,4.8
18,,,,/us/mickey-mid-hoops-shoes/GY6634.html,,,Young Disney fans will love these high tops featuring Mickey Mouse. The kids' B-ball-style adidas shoes have a grippy rubber cupsole that's great for bouncing between activities. They lace up for a fit that can be tightened if needed.,Regular fit; Lace closure; Synthetic leather upper; Textile lining; Rubber outsole; ©Disney; Imported; Product color: Cloud White / Core Black / Pulse Blue; Product code: GY6634,,,
19,,,,/us/cloudfoam-pure-2.0-shoes/GY6588.html,,,"Doesn't matter what they've got scheduled today, they'll get there in total comfort. These kids' adidas running-inspired shoes ride on a Cloudfoam midsole and have a textile sockliner to cushion their every stride. Graphic pops and bold 3-Stripes provide added style.

Made with a series of recycled materials, and at least 50% recycled content, this product represents just one of our solutions to help end plastic waste.",Regular fit; Slip-on construction; Knit upper; Girl's-specific design; Textile lining; Cloudfoam midsole; Synthetic outsole; Upper contains a minimum of 50% recycled content; Imported; Product color: Cloud White / Cloud White / Clear Pink; Product code: GY6588, Almost Blue / Clear Pink / Bliss Blue,61,4.4
20,,,,/us/retropy-f90-shoes/HQ1929.html,,,"We went all out with the comfort for these adidas Retropy F90 shoes. That's in large part to the super soft EVA midsole, plus let's not forget the Torsion System for stability. Both come together to set you up to feel good day in and day out. A trifecta of nubuck, suede and recycled mesh take over the mesh upper — giving a nod to their vintage roots.",Lace closure; Textile upper; EVA midsole; Torsion System; Rubber outsole; Gel pocket; Imported; Product color: Dash Grey / Core Black / Halo Silver; Product code: HQ1929, Off White / Aluminium / Sonic Fuchsia,5,3.8
21,,,,/us/terrex-free-hiker-2-hiking-shoe/GZ0687.html,,,"Take on the outdoors with ease. The adidas TERREX Free Hiker 2 brings comfort and confidence to your everyday adventure. It's time to enjoy your outdoor experience. 

Find confidence in the great outdoors with the new adidas TERREX Free Hiker 2. Its Continental™ rubber grip provides reliable traction on your hikes. BOOST delivers incredible energy return and instant comfort with each step. The shoe's upper is made with a high performance yarn containing at least 50% Parley Ocean Plastic and 50% recycled polyester.",Regular fit; Lace closure; Abrasion-resistant mesh upper with molded toe cap and external heel clip; adidas PRIMEKNIT collar; EVA stabilization frame; BOOST midsole; Continental™ Rubber outsole; Yarn in upper contains at least 50% Parley Ocean Plastic and 50% recycled polyester; Imported; Product color: Trace Grey / Crystal White / Impact Orange; Product code: GZ0687, Wonder Steel / Grey Three / Purple,1,5.0
22,,,,/us/ozelia-shoes/HP3254.html,,,"The '90s served up some serious looks, and we've infused some of the best of them into these adidas OZELIA Shoes for juniors. We've also added modern comforts, like Adiprene cushioning paired with a soft EVA outsole to make sure every step you take is greeted with plush goodness. The smooth, fluid lines sculpted into the shoes are complemented by flowing, contrast colors.",Regular fit; Lace closure; Textile upper with weldings; Snug feel; Adiprene cushioning; Textile lining and sockliner; Rubber outsole; Imported; Product color: Wonder White / Grey Five / Aluminium; Product code: HP3254, Wonder White / Grey Five / Aluminium,,
23,,,,/us/predator-edge.3-laceless-turf-soccer-shoes/GV8532.html,,,"Swerve ordinary to find your edge. Introduce a brand-new side to your game in these adidas Predator turf soccer shoes. Deployed across their laceless coated textile upper, grippy Control Zone print assists you with every touch of the ball. The combination of an adaptive collar and lug rubber outsole keeps you stable and in charge on artificial turf courts.",Regular fit; Laceless construction; Control Zone textured upper; Two-piece mid-cut collar; EVA midsole; Rubber outsole for artificial turf; Imported; Product color: Cloud White / Solar Yellow / Power Blue; Product code: GV8532,,53,4.4
24,,,,/us/supernova-shoes/S42722.html,,,Check your goals off your list one by one. These adidas running shoes are made for chasing down PRs one run at a time. Responsive Boost in the forefoot and heel combines with springy Bounce for a balanced and energized ride. It's time to exceed your own expectations.,Regular fit; Lace closure; Mesh upper; Bounce and Boost midsole; Textile lining; Weight: 11.3 ounces; Midsole drop: 10 mm (heel: 32 mm / forefoot: 22 mm); Rubber outsole; Primegreen; Imported; Product color: Core Black / Cloud White / Halo Silver; Product code: S42722,,1673,4.5
25,,,,/us/terrex-agravic-flow-2-trail-running-shoes/GZ1901.html,,,"This trail running shoe will elevate your mountain game to the next level with advanced technology built-in like solid rock protection and lightweight cushioning.

An athlete proven trail running shoe that will elevate your mountain game with advanced tech you feel in every step you take: newly engineered mesh upper for even more comfort and breathability. Rock protection and stability through a full length promoderation foil. Plus the Continental™ outsole brings the grip you need for different terrains. And the shoe delivers a lightweight cushioning with the new lightstrike EVA foam. It's truly made for new summits!",Lace closure; Abrasion-resistant engineered mesh upper; Perforated tongue; Pro-Moderator support; Lightstrike cushioning; Continental™ Rubber outsole; Yarn in upper contains at least 50% Parley Ocean Plastic and 50% recycled polyester; Imported; Product color: Wonder Steel / Magic Grey Met / Pulse Lilac; Product code: GZ1901, Wonder Steel / Magic Grey Met / Pulse Lilac,10,3.6
26,,,,/us/forcebounce-volleyball-shoes/GY9279.html,,,"Whatever your indoor sport, boss the court. These lightweight adidas Forcebounce shoes keep you stable and in control thanks to the internal supports and external overlays on their tough ripstop upper. A full-length Bounce midsole helps with launches and landings. Designed to excel in all directions, the rubber outsole helps you get to grips with the toughest challenges.",Lace closure; Woven ripstop upper; Textile lining; Bounce midsole; 360-degree grip pattern outsole; Upper contains a minimum of 50% recycled content; Imported; Product color: Grey One / Core Black / Cloud White; Product code: GY9279, Cloud White / Core Black / Pulse Blue,11,4.5
27,,,,/us/adidas-by-stella-mccartney-ultraboost-21-shoes/GZ4383.html,,,"Start the day with purpose. When you lace into these adidas by Stella McCartney Ultraboost 21 shoes, you're not just making a commitment to yourself, you're honoring your commitment to our planet. The cage adds extra support to the adaptable and flexible inner sock construction. Every step is fueled by the comfort of Boost cushioning, cheering you on as you push just a bit further.

This product is made with Primegreen, a series of high-performance recycled materials. 50% of upper is recycled content. No virgin polyester.",Regular fit; Lace closure; Textile upper with inner sock; Boost midsole; Synthetic outsole; adidas by Stella McCartney logo; Primegreen; Imported; Product color: Signal Orange / Cloud White / Core Black; Product code: GZ4383, Shift Purple / Shift Purple / Shift Purple,79,4.6
28,,,,/us/stan-smith-captain-hook-shoes/HP5581.html,,,"For over 50 years, the adidas Stan Smith sneaker has solidified its place as a style icon. Now the classic silhouette gets a magical update with these shoes inspired by Captain Hook, from Disney's ""Peter Pan."" Make a statement with the deep red synthetic suede upper that will add a pop to any outfit. The heel patches are a reminder that ""It's not easy being green,"" so it's important to do our best for the planet.

Made with a series of recycled materials, this upper features at least 50% recycled content. This product represents just one of our solutions to help end plastic waste.",Regular fit; Lace closure; Synthetic suede upper; Synthetic leather lining; Graphics on sockliner; Rubber outsole; ©Disney; Upper contains a minimum of 50% recycled content; Imported; Product color: Pantone / Pantone / Core Black; Product code: HP5581, Pantone / Cloud White / Core Black,13045,4.7
