,title,subtitle,num_colors,url,price,reduced_price,description,details,colors,n_reviews,avg_stars
0,Adilette Slides,Originals,7 colors,/us/adilette-slides/280648.html,$45,$23,The Adilette debuted in 1970 as a shower slide for the German national football team during the world's biggest match in Mexico before being officially released back in '72. It's been a style mainstay of adidas ever since. These slides stay true to the original look with a contoured footbed and 3-Stripes across the bandage upper.,Regular fit; Slip-on design; PU-coated synthetic bandage upper; Quick-dry lining; Contoured footbed; Polyurethane outsole; Imported; Product color: White / Core Black / White; Product code: 280648, Core Black / White / Core Black,5389,4.6
1,Ultraboost 5.0 DNA Shoes,Youth Sportswear,7 colors,/us/ultraboost-5.0-dna-shoes/GX9762.html,$160,,"Any time you're on your feet is a good time to wear the adidas Ultraboost. These juniors' shoes pack all the performance techs that runners love into a design you'll want to wear outside of gym class. Beyond looks, its superpower is comfort – from the soft feel of the adidas PRIMEKNIT upper to the incredible energy return of BOOST.

This shoe's upper is made with a high-performance yarn which contains at least 50% Parley Ocean Plastic — reimagined plastic waste, intercepted on remote islands, beaches, coastal communities and shorelines, preventing it from polluting our ocean. The other 50% of the yarn is recycled polyester.",Regular fit; Lace closure; adidas PRIMEKNIT upper; BOOST midsole; Torsion System; Rubber outsole; Yarn in upper contains at least 50% Parley Ocean Plastic and 50% recycled polyester; Imported; Product color: Cloud White / Cloud White / Beam Pink; Product code: GX9762, Cloud White / Cloud White / Beam Pink,12,4.6
2,Adilette Comfort Slides,Women's Yoga,18 colors,/us/adilette-comfort-slides/GW8741.html,$40,$34,"A modern take on an adidas classic. These slides keep your feet wrapped in comfort while adding a bold style statement to any outfit. Pair them with tights and a workout tank top, for a cozy fit on the way to the pool or yoga studio, or with your favorite denim and crop top for an athletic-casual vibe. A 3-Stripes graphic over the top strap keeps your look rooted in sport.",Regular fit; Slip-on construction; Synthetic upper; Textile lining; Lightweight cushioning; Contoured footbed; Synthetic outsole; Imported; Product color: Wonder Mauve / Magic Earth Met / Magic Earth Met; Product code: GW8741, Signal Orange / Signal Orange / Vivid Berry,4947,4.8
3,Ultraboost 22 Shoes,Men's Running,26 colors,/us/ultraboost-22-shoes/GX5459.html,$190,,"These Ultraboost running shoes serve up comfort and responsiveness. You'll be riding on a BOOST midsole for endless energy, with a Linear Energy Push system and a Continental™ Rubber outsole. This shoe's upper is made with a high-performance yarn which contains at least 50% Parley Ocean Plastic —  reimagined plastic waste, intercepted on remote islands, beaches, coastal communities and shorelines, preventing it from polluting our ocean.",Regular fit; Lace closure; adidas PRIMEKNIT textile upper; Soft heel fit; Linear Energy Push system; BOOST midsole; Weight: 11.7 ounces (size 9); Stretchweb outsole with Continental™ Better Rubber; Yarn in upper contains at least 50% Parley Ocean Plastic  and 50% recycled polyester; Imported; Product color: Cloud White / Cloud White / Crystal White; Product code: GX5459, Cloud White / Cloud White / Vivid Red,2496,4.7
4,Superstar 360 Shoes,Children Originals,40% off with code: cyber,/us/superstar-360-shoes/GX3231.html,$60,,"Who has time for lacing, anyway? Definitely not your style star. That's why these kids' shoes have a one-piece design that can be pulled onto feet fast, plus flexible EVA cushioning that keeps up with all their moves. Wherever they run off to, they'll be rocking iconic adidas style. 

Made with a series of recycled materials, this upper features at least 50% recycled content. This product represents just one of our solutions to help end plastic waste.",Slip-on; Two-layer stretch mesh upper; Snug feel; OrthoLite® sockliner; Adifit length-measuring insole; One-piece EVA outsole with deep flex grooves; Upper contains a minimum of 50% recycled content; Imported; Product color: Core Black / Cloud White / Gold Metallic; Product code: GX3231,,40,4.7
5,NMD_R1 Shoes,Women's Originals,20 colors,https://www.adidas.com/us/nmd_r1-shoes/GW9475.html,$150,,"Comfort isn't something we take lightly. Which is why we packed these adidas sneakers with innovations borrowed from running shoes. Responsive BOOST cushioning lets you walk all day in comfort, and the knit upper feels like a soft hug. Translation? Wherever you're going, you feel good. And with the signature NMD style, you look good too.

This shoe's upper is made with a high-performance yarn which contains at least 50% Parley Ocean Plastic — reimagined plastic waste, intercepted on remote islands, beaches, coastal communities and shorelines, preventing it from polluting our ocean. The other 50% of the yarn is recycled polyester.",Lace closure; Stretch knit upper; Hugs the foot; Textile lining; BOOST midsole; Rubber outsole; Yarn in upper contains at least 50% Parley Ocean Plastic and 50% recycled polyester; Imported; Product color: Shadow Maroon / Shadow Maroon / Cloud White; Product code: GW9475, Bright Orange / Bright Orange / Core Black,2374,4.5
6,Retropy F90 Shoes,Men's Originals,7 colors,https://www.adidas.com/us/retropy-f90-shoes/HP8022.html,$100,$85,"We went all out with the comfort for these adidas Retropy F90 shoes. That's in large part to the super soft EVA midsole, plus let's not forget the Torsion System for stability. Both come together to set you up to feel good day in and day out. A trifecta of nubuck, suede and recycled mesh take over the mesh upper — giving a nod to their vintage roots.",Lace closure; Textile upper; EVA midsole; Torsion System; Rubber outsole; Gel pocket; Imported; Product color: Wonder Steel / Cloud White / Shadow Navy; Product code: HP8022, Off White / Aluminium / Sonic Fuchsia,5,3.8
7,Racer TR21 Shoes,Women's Essentials,5 colors,https://www.adidas.com/us/racer-tr21-shoes/GX4207.html,$75,$64,"These adidas shoes bring the athletic style of running footwear to your everyday look. Move confidently through your day in a comfortably snug fit and a lightweight midsole that provides all-day cushioning underfoot.

This product is made with Primegreen, a series of high-performance recycled materials. 50% of the upper is recycled content. No virgin polyester.",Lace closure; Leather and textile upper; Soft feel; Cloudfoam midsole; Textile lining; Rubber outsole; Primegreen; Imported; Product color: Cloud White / Cloud White / Grey Two; Product code: GX4207, Core Black / Silver Metallic / Bliss Orange,620,4.6
8,,,,/us/adilette-slides/BA7130.html,,,"Scaled for juniors, these adilette sandals evoke sunny afternoons by the pool. At once simple and fashion-forward, the slides stylishly segue from poolside to a warm night out. The 3-Stripes upper looks as timeless now as when it debuted in '72. A contoured footbed keeps you comfy on the go.",Polyurethane bandage upper; Quick-dry bandage lining; Contoured footbed; Contrast 3-Stripes on bandage; Rubber outsole; Imported; Product color: Core Black / Cloud White / Core Black; Product code: BA7130, Legend Ink / Cloud White / Legend Ink,188,4.7
9,,,,/us/forum-low-shoes/GZ1674.html,,,"They're at the age when everything is fascinating. So they'll delight in the iridescent details of these toddlers' adidas Forum shoes. The iconic silhouette gets a fun update in muted rainbow colors along the underlay. Elastic laces with a hook-and-loop strap makes them easy to get on and off wiggly feet.

Made with a series of recycled materials, this upper features at least 50% recycled content. This product represents just one of our solutions to help end plastic waste.",Regular fit; Elastic laces with hook-and-loop strap; Synthetic upper; OrthoLite® sockliner; Adifit length-measuring insole; Rubber outsole; Upper contains a minimum of 50% recycled content; Imported; Product color: Cloud White / Cloud White / Core Black; Product code: GZ1674,,1,3.0
10,,,,/us/predator-edge.3-turf-soccer-shoes/GX2628.html,,,"Some walk into the cage and see limitations. You see possibilities. Because you've been doing the impossible all your life. Change the game in adidas Predator. A Control Zone upper with strategically placed areas of grippy print helps these soccer cleats dominate the ball. The supportive collar and lugged rubber outsole keep you in charge on turf.

Made in part with recycled content generated from production waste, e.g. cutting scraps, and post-consumer household waste to avoid the larger environmental impact of producing virgin content.",Regular fit; Lace closure; Coated textile upper; Stretch mid-cut collar; EVA midsole; Rubber outsole; 25% of the components used to make the upper are made with a minimum of 50% recycled content; Imported; Product color: Core Black / Cloud White / Vivid Red; Product code: GX2628, Solar Red / Team Solar Green / Core Black,70,4.2
11,,,,/us/zntasy-capsule-collection-shoes/GZ2299.html,,,"Only adidas could make futuristic sneakers that still feel timeless. These have all the tech you'd expect from sneakers designed for tomorrow. The Lightstrike midsole cushioning is responsive and lightweight, while the strong rubber cupsole works well in any weather. So you won't so much walk as float from street to spaceship. 
 
Made with a series of recycled materials, this upper features at least 50% recycled content. This product represents just one of our solutions to help end plastic waste.",Lace closure; Textile upper; Lightstrike cushioning; Textile lining; Rubber outsole; Upper contains a minimum of 50% recycled content; Imported; Product color: Cloud White / Cloud White / Bright Red; Product code: GZ2299, Cloud White / Cloud White / Bright Red,24,4.3
12,,,,/us/nmd_r1-shoes/GX9886.html,,,"We made the adidas NMD_R1 shoes to help you tackle your daily challenges and adventures. But this pair is also made to celebrate your love of sport. Bright colors are borrowed from soccer team colors — a celebration that you can wear on the sidelines or out in the city. BOOST cushioning keeps your feet comfortable, whether you're cheering your heart out or going about your day.

This shoe's upper is made with a high-performance yarn which contains at least 50% Parley Ocean Plastic — reimagined plastic waste, intercepted on remote islands, beaches, coastal communities and shorelines, preventing it from polluting our ocean. The other 50% of the yarn is recycled polyester.",Lace closure; Stretch knit upper; Hugs the foot; BOOST midsole; Rubber outsole; Yarn in upper contains at least 50% Parley Ocean Plastic and 50% recycled polyester; Imported; Product color: Red / Royal Blue / Off White; Product code: GX9886, Core Black / Core Black / Core Black,2570,4.6
13,,,,/us/superstar-360-shoes/GX3233.html,,,"Who has time for lacing, anyway? Definitely not your little style star. That's why these toddlers' shoes have a one-piece design that can be pulled onto squirmy little feet fast, plus flexible EVA cushioning that keeps up with all their bendy moves. Wherever they run off to, they'll be rocking iconic adidas style. 

Made with a series of recycled materials, this upper features at least 50% recycled content. This product represents just one of our solutions to help end plastic waste.",Slip-on; Two-layer stretch mesh upper; Snug feel; OrthoLite® and Fitfoam sockliners; Adifit length-measuring insole; One-piece EVA outsole with deep flex grooves; Upper contains a minimum of 50% recycled content; Imported; Product color: Core Black / Cloud White / Gold Metallic; Product code: GX3233,,23,4.9
14,,,,/us/astir-shoes/GY6849.html,,,"These adidas shoes pop with the fearless energy of the 2000s. Bold, bright and absolutely radiating positivity, they're here to spread the vibes. Good ones only. 

To reduce our reliance on virgin materials, we make sure that our vegan alternatives also contain a minimum of 25% recycled content.",Women's-specific fit; Lace closure; Textile upper with synthetic overlays; Textile lining; EVA midsole; Rubber outsole; Vegan alternative: At least 25% recycled content; Imported; Product color: Almost Yellow / Almost Yellow / Ecru Tint; Product code: GY6849, Purple / Purple / Bliss,613,4.8
15,,,,/us/stan-smith-shoes/FX7532.html,,,"It's never too early for that first pair of Stan Smiths. These toddlers' adidas shoes are a sized-down version of the same sneakers beloved by supermodels, grandpas, and teenagers around the world. Simple straps make them easy to cinch on wiggly little feet.

This product is made with Primegreen, a series of high-performance recycled materials. 50% of upper is recycled content. No virgin polyester.","Regular fit; Hook-and-loop closure (two straps for US sizes 3.5 - 5.5, three straps for US sizes 6.5 - 9.5); Synthetic upper; OrthoLite® sockliner; Rubber cupsole; Primegreen; Imported; Product color: Cloud White / Cloud White / Green; Product code: FX7532",,35,4.8
16,,,,/us/ozelia-shoes/GV8991.html,,,"The future awaits, but the past still leaves an impact. Both meet in this juniors' version of the classic adidas OZELIA Shoes. The silhouette stays true to the '90s origins while the dramatic weldings and 3D striping are fluid and forward-looking. Adiprene cushioning keeps you comfy all day.

Made in part with recycled content generated from production waste, e.g. cutting scraps, and post-consumer household waste to avoid the larger environmental impact of producing virgin content.",Regular fit; Lace closure; Textile upper; Textile lining; Adiprene cushioning; Rubber outsole; 25% of the components used to make the upper are made with a minimum of 50% recycled content; Imported; Product color: Carbon / Carbon / Core Black; Product code: GV8991,,15,4.7
17,,,,/us/retropy-f90-shoes/HP8030.html,,,"Whether you're running around town or taking it easy, these adidas shoes are ready to carry you through the day. Taking inspiration from the famed Racing 1 as a design base, they feature a modernized shape that still honors its roots. Nubuck, suede and recycled mesh lend a vintage feel to the upper. The bright colors ensure that you'll make a statement with any outfit. The EVA midsole provides a comfortable feeling for everyday activities.","Lace closure; Nubuck, suede and mesh upper; Textile lining; Torsion bar; EVA midsole; Rubber outsole; Imported; Product color: Magic Grey / Aluminium / Shadow Navy; Product code: HP8030", Off White / Aluminium / Sonic Fuchsia,5,3.8
18,,,,/us/eq21-run-shoes/GX9810.html,,,"City streets or grassy hills? Wherever you wear them, these adidas running sneakers are engineered to withstand all kinds of terrains. They have a Bounce midsole for a cushioned, springy feel, combined with a specially molded heel for stability at the back of the feet. Whatever your pace, they're super comfy at every step.

Made with a series of recycled materials, this upper features at least 50% recycled content. This product represents just one of our solutions to help end plastic waste.",Regular fit; Lace closure; Mesh upper with TPU overlays; Geofit padded collar; Bounce midsole; Textile lining; Rubber outsole; Upper contains a minimum of 50% recycled content; Imported; Product color: Pulse Blue / Cloud White / Aluminium; Product code: GX9810, Core Black / Bliss Orange / Bliss Pink,710,4.5
19,,,,/us/adidas-adilette-comfort-x-lego-slides/GW0822.html,,,"Whether you're heading to the locker room after an intense gym session or at home recovering on the couch, these slides keep your feet wrapped in lightweight comfort. The adidas 3-Stripes design keeps your sports-inspired look on point, while the LEGO® logo and LEGO® blocks-inspired features help you stay in touch with your playful side.

Made with a series of recycled materials, this upper features at least 50% recycled content.",Regular fit; Slip-on construction; Single-bandage textile upper; Textile lining; LEGO® graphics; Contoured footbed; Synthetic outsole; Upper contains a minimum of 50% recycled content; Imported; Product color: Core Black / Core White / Grey Six; Product code: GW0822, Core Black / Core White / Grey Six,9740,4.7
20,,,,/us/adistar-shoes/GY3446.html,,,"The distance running shoe inspired by the idea of perpetual motion and tested over 4,500 km. Adistar combines a soft, lightweight REPETITOR foam platform with REPETITOR +, a firmer foam, to create a dual density midsole. The firmer 15% recycled EVA in the heel protects and helps stabilize any heel strike. Forward propulsion is enhanced by the rocker geometry as well as an overall 6mm drop heel to toe. Strike soft and push forward with a shoe designed to go the distance.",Regular fit; Lace closure; Engineered mesh upper with internal support cage; Lockdown feel; Rocker geometry; REPETITOR+ midsole; Weight: 11.3 ounces; Midsole drop: 6 mm (heel: 37.5 mm / forefoot: 31.5 mm); Continental™ Rubber outsole; Yarn in upper contains at least 50% Parley Ocean Plastic  and 50% recycled polyester; Imported; Product color: Chalk White / Core Black / Solar Green; Product code: GY3446, Almost Blue / Altered Blue / Almost Pink,370,4.6
21,,,,/us/adilette-slides/H06452.html,,,"The famed Adilette with a cozy twist. Known for comfort, style and (above all) ease, the iconic slides are designed for all moments of the day — and all outfits. Slip them on whenever and with whatever and you'll find the vibe always hits just right.",Slip on; Textile upper; Textile lining; Rubber outsole; Imported; Product color: Core Black / Grey Six / Core Black; Product code: H06452, Mesa / Chalk White / Mesa,3,4.7
22,,,,/us/runfalcon-2.0-shoes/HR1413.html,,,"Shoes for everyday wear, from the halls at school to gym class to running errands with you on the weekend. Whether your kid is new to the track team or just needs to move through the day with confidence, these adidas sneakers deliver. A lightweight feel provides comfort even on the longest days.",Regular fit; Lace closure; Textile upper; Lightweight feel; Textile lining; EVA midsole; Rubber outsole; Imported; Product color: Dark Blue / Matt Purple Met. / Pulse Lilac; Product code: HR1413, Carbon / Cloud White / Impact Orange,1281,4.7
23,,,,/us/puremotion-super-shoes/GZ6777.html,,,"These comfy adidas shoes balance a running-inspired shape with a fit that's snug from every angle. There's Geofit padding to support the ankles, and the Cloudfoam Super midsole has a light, springy feel. So the whole foot feels cushioned, whether or not you're running around in them. 

Made with a series of recycled materials, this upper features at least 50% recycled content. This product represents just one of our solutions to help end plastic waste.",Regular fit; Lace closure; Textile upper; Geofit padded collar; Cloudfoam midsole; Textile lining; Rubber outsole; Upper contains a minimum of 50% recycled content; Imported; Product color: Shadow Green / Green Oxide / Pulse Lilac; Product code: GZ6777, Core Black / Core Black / Carbon,7,4.7
24,,,,/us/superstar-shoes/GZ3742.html,,,"Originally made for basketball courts in the '70s. Celebrated by hip hop royalty in the '80s. The adidas Superstar shoe is now a lifestyle staple for streetwear enthusiasts. The world-famous shell toe feature remains, providing style and protection. Just like it did on the B-ball courts back in the day.

Now, whether at a festival or walking in the street you can enjoy yourself without the fear of being stepped on.

The serrated 3-Stripes detail and adidas Superstar box logo adds OG authenticity to your look.",Lace closure; Leather upper; Iconic leather shoes; Rubber outsole; Imported; Product color: Cloud White / Collegiate Green / Cloud White; Product code: GZ3742, Core Black / Core Black / Core Black,2606,4.7
25,,,,/us/courtjam-control-tennis-shoes/GY1334.html,,,"Don't just compete. Dominate. The mesh upper and flexible Bounce midsole on these adidas Courtjam Control Tennis Shoes team up to keep you comfortable as you build pressure on your opponent. Underneath, a TPU midfoot shank and grippy Adiwear hard court outsole ensure you're stable through every slide and sidestep. On the medial side, a combination of hidden lacing and abrasion zones specifically configured for the women's game help these shoes tough out every challenge.",Regular fit; Hybrid U-throat with hidden lace protection; Engineered mesh upper with medial TPU abrasion resistance; Textile lining; Torsion System; Bounce midsole; Adiwear outsole; Upper contains a minimum of 50% recycled content; Imported; Product color: Cloud White / Silver Metallic / Cloud White; Product code: GY1334, Core Black / Cloud White / Silver Metallic,37,4.6
26,,,,/us/puremotion-shoes/GY2279.html,,,"Elevate a casual look, quite literally, with these adidas shoes. Slightly pumped-up outsoles add a little height while the soft textile upper gives them a textured look that pairs well with jeans, skirts or sporty shorts. Cloudfoam cushioning keeps your feet comfortable when you're on the move.",Regular fit; Lace closure; Textile upper; Textile lining; Cloudfoam midsole; Cloudfoam sockliner; Synthetic outsole; Imported; Product color: Core Black / Green Oxide / Pulse Lilac; Product code: GY2279, Cloud White / Semi Turbo / Pulse Amber,1243,4.6
27,,,,/us/duramo-10-wide-shoes/GY3855.html,,,"Whether you're headed out for a morning run or meeting up with friends for an evening out, keep your feet comfortable and your style on point in these adidas wide-fit shoes. A mesh upper helps you stay cool, while superlight cushioning cradles every step you take.

Made with a series of recycled materials, this upper features at least 50% recycled content. This product represents just one of our solutions to help end plastic waste.",Wide fit; Lace closure; Sandwich mesh upper; Supportive no-sew overlays; Soft heel; LIGHTMOTION cushioning; Rubber outsole; Upper contains a minimum of 50% recycled content; Imported; Product color: Core Black / Cloud White / Core Black; Product code: GY3855, Grey Four / Vivid Red / Iron Metallic,65,4.4
28,,,,/us/swift-run-22-shoes/GW8187.html,,,"Slow them down? Not a chance. Set your little one up to zoom around in comfort in these toddlers' adidas shoes. Rooted in running but designed for all-day play, they keep squirmy little feet comfortable with a supportive knit mesh upper and a cushioned EVA midsole. Oh, and they look good too. Win. 

Made with a series of recycled materials, this upper features at least 50% recycled content. This product represents just one of our solutions to help end plastic waste.",Snug fit; Elastic laces with standard laces included; Knit mesh upper; Hugs the foot; EVA midsole; OrthoLite® sockliner and Adifit length-measuring insole; Rubber outsole; Upper contains a minimum of 50% recycled content; Imported; Product color: Cloud White / Core Black / Grey Two; Product code: GW8187, Core Black / Grey Five / Cloud White,111,4.8
29,,,,/us/adilette-slides/GY9482.html,,,"Wear them with socks. Wear them with shorts. Wear them whenever, wherever. A pair of adidas Adilette slides is always a good idea when you're aiming for comfort. Even if it's dreary out, a tie-dye print on the bandage upper keeps the good vibes going strong. Because it's never a bad time to dream of sunny days.",Slip-on; Synthetic upper; Textile lining; Synthetic outsole; 25% of the components used to make the upper are made with a minimum of 50% recycled content; Imported; Product color: Almost Blue / Cloud White / Core Black; Product code: GY9482, Beam Orange / Cloud White / Gum,34,4.3
30,,,,/us/nmd_v3-shoes/GZ2133.html,,,"The future is now. The original running-inspired style that made you love the adidas NMD_V3 shoes get a new look by combining tactical technology with elevated style. Metallic overlays and semi-translucent TPU add a glossy, futuristic finish. Long commutes and slick city sidewalks are no problem, thanks to the BOOST cushioning and grippy rubber outsole beneath your feet.

This shoe's upper is made with a high-performance yarn which contains at least 50% Parley Ocean Plastic — reimagined plastic waste, intercepted on remote islands, beaches, coastal communities and shorelines, preventing it from polluting our ocean. The other 50% of the yarn is recycled polyester.",Lace closure; Textile upper; Textile lining; BOOST midsole; Rubber outsole; Yarn in upper contains at least 50% Parley Ocean Plastic and 50% recycled polyester; Imported; Product color: Cloud White / Grey One / Silver Metallic; Product code: GZ2133, Purple / Purple / Grey Two,59,4.0
31,,,,/us/top-ten-rb-shoes/GV6629.html,,,"Do you like your style with a heavy dose of winning attitude? The adidas Top Ten RB shoes have it. Back in the day, they were reserved for only the very best players in basketball. Now you can wear the bold stance, smooth leather and sharp contrast colors out onto city streets.

Made in part with recycled content generated from production waste, e.g. cutting scraps, and post-consumer household waste to avoid the larger environmental impact of producing virgin content.",Lace closure; Leather upper; Textile lining; Rubber outsole; 25% of the components used to make the upper are made with a minimum of 50% recycled content; Imported; Product color: Cloud White / Almost Blue / Altered Blue; Product code: GV6629, Cloud White / Dark Blue / Night Marine,20,5.0
