,title,subtitle,num_colors,url,price,reduced_price,description,details,colors,n_reviews,avg_stars
32,,,,/us/cloudfoam-pure-2.0-shoes/GV8958.html,,,"Streamlined and sporty shoes for the win. These adidas running-style shoes have been designed with comfort in mind. The Cloudfoam midsole and memory foam sockliner combine to wrap the foot in soft cushioning and make every step feel light and springy. Pair them with everything from dresses to jeans to tailored pants. 

Made with a series of recycled materials, this upper features at least 50% recycled content. This product represents just one of our solutions to help end plastic waste.",Regular fit; Lace closure; Textile upper; Cloudfoam midsole; Memory foam sockliner; Synthetic outsole; Upper contains a minimum of 50% recycled content; Imported; Product color: Legend Ink / Gold Metallic / Wonder Steel; Product code: GV8958, Core Black / Cloud White / Carbon,1631,4.5
33,,,,/us/stan-smith-shoes/GY4254.html,,,"Happy Stan, happy you. For over 50 years, the adidas Stan Smith shoes have solidified their place as an icon. Now the timeless white silhouette gets reimagined for juniors. The coordinating heel tab and a dedicated signoff add bright updates.

Made with a series of recycled materials, this upper features at least 50% recycled content. This product represents just one of our solutions to help end plastic waste.",Regular fit; Lace closure; Synthetic leather upper; OrthoLite® sockliner; Textile lining; Recycled rubber outsole made with 10% recycled material derived from production waste; Upper contains a minimum of 50% recycled content; Imported; Product color: Core Black / Cloud White / Gold Metallic; Product code: GY4254, Cloud White / Almost Blue / Core Black,13,4.5
34,,,,/us/eq21-run-shoes/H00521.html,,,"When running is your sport, there's nothing you love more than that daily run. Log miles in ultimate comfort when you lace up in these adidas shoes. A breathable upper keeps feet feeling cool and fresh on warm days. Lightweight cushioning makes each step more enjoyable.",Regular fit; Lace closure; Engineered mesh upper; Padded collar; TPU quarter and heel stabilizers; Bounce midsole; Weight: 584 g (size UK 8.5); Midsole drop: 10.5 mm; Rubber outsole; 25% of the components used to make the upper are made with a minimum of 50% recycled content; Imported; Product color: Core Black / Core Black / Core Black; Product code: H00521, Cloud White / Core Black / Beam Yellow,1003,4.5
35,,,,/us/forum-low-shoes/GY6783.html,,,"What's better than chocolate-dipped strawberries? Not much, except maybe these adidas Forum shoes. A celebration of perfect pairings, they bring chocolate- and strawberry-inspired colors to your shoes, plus a hidden message under the strap that reads ""be the chocolate to my strawberry."" Every time you lace into these luxurious leather shoes, you might just fall in love.

Made in part with recycled content generated from production waste, e.g. cutting scraps, and post-consumer household waste to avoid the larger environmental impact of producing virgin content.",Regular fit; Lace closure with hook-and-loop strap; Leather upper; Textile lining; Rubber outsole; 25% of the components used to make the upper are made with a minimum of 50% recycled content; Imported; Product color: Cloud White / Pantone / Cream White; Product code: GY6783, Cloud White / Cloud White / Shock Pink,441,4.7
36,,,,/us/courtjam-control-tennis-shoes/GW2554.html,,,"Don't just compete. Dominate. The mesh upper and flexible Bounce midsole on these adidas Courtjam Control Tennis Shoes team up to keep you comfortable as you build pressure on your opponent. Underneath, a TPU midfoot shank and grippy Adiwear hard court outsole ensure you're stable through every slide and sidestep. On the medial side, a combination of hidden lacing and abrasion zones specifically configured for the men's game help these shoes tough out every challenge.",Regular fit; Hybrid U-throat with hidden lace protection; Engineered mesh upper with medial TPU abrasion resistance; Textile lining; Torsion System; Bounce midsole; Adiwear outsole; Upper contains a minimum of 50% recycled content; Imported; Product color: Core Black / Cloud White / Core Black; Product code: GW2554, Core Black / Cloud White / Core Black,50,4.4
37,,,,/us/solarglide-5-shoes/GX5494.html,,,"Whether you're building consistency, upping your distance or training for a personal best, Solarglide 5 are the shoes you leave by the door to support your goals every single day. They're packed with performance technology, from the BOOST midsole to the knit upper and the adidas LEP 2.0. This shoe's upper is made with a high-performance yarn which contains at least 50% Parley Ocean Plastic — reimagined plastic waste, intercepted on remote islands, beaches, coastal communities and shorelines, preventing it from polluting our ocean.",Regular fit; Lace closure; Circular knit textile upper; BOOST midsole; Continental™ Rubber outsole; Weight: 9.9 ounces; Midsole drop: 10 mm (heel: 36 mm / forefoot: 26 mm); adidas LEP 2.0; Yarn in upper contains at least 50% Parley Ocean Plastic and 50% recycled polyester; Imported; Product color: Core Black / Grey Six / Carbon; Product code: GX5494, Grey Two / Silver Metallic / Wonder Mauve,136,4.5
38,,,,/us/nmd_v3-shoes/GX2089.html,,,"Go ahead and check all the boxes with these adidas NMD_V3 Shoes. Breathable. Comfortable. Made with recycled materials. That's a yes to all three. Plus there's the style, like the perforated details, which is also where that breathability comes in. Playing with transparency, the 3-Stripes layer over the perforations, giving a glimpse at them underneath the monochrome signoff.

This shoe's upper is made with a high-performance yarn which contains at least 50% Parley Ocean Plastic — reimagined plastic waste, intercepted on remote islands, beaches, coastal communities and shorelines, preventing it from polluting our ocean. The other 50% of the yarn is recycled polyester.",Lace closure; Textile upper; Textile lining; BOOST midsole; Rubber outsole; Yarn in upper contains at least 50% Parley Ocean Plastic and 50% recycled polyester; Imported; Product color: Cloud White / Core Black / Grey One; Product code: GX2089, Grey One / Off White / Halo Silver,38,4.5
39,,,,/us/campus-80s-shoes/GY4588.html,,,"Born on the basketball court, the adidas Campus shoes have long been a favorite of subcultures around the world. From skaters to scenesters, they're an underground icon. This pair keeps with that tradition, putting the spotlight on Tokyo. Embroidered details honor traditional sashiko stitching. A premium mix of textile and leather looks just as luxe as it feels.",Regular fit; Lace closure; Textile upper; Leather lining; Rubber outsole; Imported; Product color: Dark Blue / Cloud White / Off White; Product code: GY4588, Collegiate Green / Off White / Off White,49,4.7
40,,,,/us/supernova-2-tme-shoes/GX1674.html,,,"Better with every run. The adidas Supernova shoes are designed for the early days of running, when you build up ease and distance every time you head out the door. This version is created with running group Tinman Elite. It's made in part with recycled materials, with a soft synthetic upper on an energy-returning BOOST midsole.

Made with a series of recycled materials, this upper features at least 50% recycled content. This product represents just one of our solutions to help end plastic waste.",Lace closure; Soft synthetic upper; BOOST midsole; Upper contains a minimum of 50% recycled content; Imported; Product color: Non Dyed / Cloud White / Grey Four; Product code: GX1674,,,
41,,,,/us/terrex-free-hiker-2-gore-tex-hiking-shoe/GZ3310.html,,,"Take on the outdoors with ease. The adidas TERREX Free Hiker 2 GORE-TEX brings comfort and confidence to your everyday adventure. It's time to enjoy your outdoor experience. 

Take on the outdoors in style and comfort with the TERREX Free Hiker 2 GORE-TEX. Feel confident in most weather conditions thanks to the breathable GORE-TEX membrane and Continental™ rubber outsole. Enjoy your hikes with the updated design.",Regular fit; Lace closure; Abrasion-resistant mesh upper with molded toe cap and external heel clip; GORE-TEX lining; EVA stabilization frame; BOOST midsole; Continental™ Rubber outsole; Upper contains a minimum of 50% recycled content; Imported; Product color: Core Black / Grey Six / Grey Three; Product code: GZ3310, Core Black / Grey Six / Grey Three,2,3.5
42,,,,/us/superstar-bonega-shoes/GY1485.html,,,"From the hardwood to the hip hop stage, the adidas Superstar Shoes have solidified their place as an icon. This pair adds a touch of luxury with metallic gold-rimmed marble jewels on the laces and marble detailing on the heel. A memory foam sockliner keeps your feet comfortable.

Made in part with recycled content generated from production waste, e.g. cutting scraps, and post-consumer household waste to avoid the larger environmental impact of producing virgin content.",Regular fit; Lace closure; Leather upper; Textile lining; Rubber platform outsole; 25% of the components used to make the upper are made with a minimum of 50% recycled content; Imported; Product color: Cloud White / Cloud White / Gold Metallic; Product code: GY1485, Cloud White / Core Black / Gold Metallic,33,3.6
43,,,,/us/adilette-lite-slides/EG8271.html,,,Free your feet. These juniors' Adilette Lite Slides let your toes take in the sun. An extra-soft footbed cushions each step. An adidas Trefoil on top nods back to their sporty origins as a locker room slide for the '70s German soccer team.,Slip-on; Synthetic bandage upper; Extra-soft feel; Cushioned sporty slides; Synthetic outsole; Textile lining; Imported; Product color: Core Black / Cloud White / Core Black; Product code: EG8271, Core Black / Cloud White / Core Black,113,4.8
44,,,,/us/superstar-bonega-shoes/GX4352.html,,,"High-flying hardwood legend and hip hop icon, the adidas Superstar shoes just got lifted on a bold platform outsole. It's the same shell toe style you know and love, just taller. So step up, stand tall and walk with confidence. Chic pastel tones and premium leather are the ultimate recipe to keep your feet looking luxe. And did we mention the plush memory foam sockliner? It lands every single step in comfort.",Regular fit; Lace closure; Leather upper; Textile lining; Memory foam sockliner; Rubber outsole; 25% of the components used to make the upper are made with a minimum of 50% recycled content; Imported; Product color: Crystal White / Cloud White / Almost Blue; Product code: GX4352, Cloud White / Core Black / Gold Metallic,33,3.6
45,,,,/us/adilette-shower-slides/GZ5925.html,,,"From the pool deck to the shower to the couch, these slides are made for the work-hard-rest-hard lifestyle. The slip-on construction gives you a snug fit that's easy to kick on and off as needed. Lightweight cushioning keeps your feet cradled in all-day comfort. The adidas script logo adds an extra touch of class to the iconic Adilette look.",Regular fit; Slip-on construction; Synthetic upper; Textile lining; Contoured footbed; Cloudfoam midsole; Synthetic outsole; Imported; Product color: Almost Pink / Acid Red / Chalk White; Product code: GZ5925, Clear Pink / Clear Pink / Super Pop,590,4.7
46,,,,/us/retropy-e5-shoes/GW6783.html,,,"When the days are long, you need something that knows about going the distance. Which these adidas Retropy E5 Shoes do, since they used the famed '70s Racing 1 shoes as their foundation. Plush BOOST cushioning takes care of all things comfort and makes sure you feel good from morning to night. Really driving in their '70s inspiration, they have stitched nubuck overlays on the premium upper that nods to the shoes' origins.

Made in part with recycled content generated from production waste, e.g. cutting scraps, and post-consumer household waste to avoid the larger environmental impact of producing virgin content.",Lace closure; Nubuck upper with nubuck overlays; BOOST midsole; Leather lining; Rubber outsole; 25% of the components used to make the upper are made with a minimum of 50% recycled content; Imported; Product color: Carbon / Carbon / Core Black; Product code: GW6783, Focus Olive / Core White / Beam Orange,846,4.7
47,,,,/us/nizza-platform-mid-vegan-shoes/GY1897.html,,,"Sip on some healthy fruit juice. Lace on these adidas platform shoes. Stride out your front door feeling good. What better way is there to start a day? Not only do these shoes give your style a lift, they also celebrate a plant-based lifestyle with vivid colors and fruits illustrated on the sockliner. Your new daily motto — ""make it juicy"" — is right there on the tongue label.",Regular fit; Lace closure; Synthetic upper; Textile lining; Rubber platform outsole; Upper contains a minimum of 50% recycled content / Vegan alternative: At least 25% recycled content; Imported; Product color: Cloud White / Semi Impact Orange / Bliss Orange; Product code: GY1897,,2,5.0
