,title,subtitle,num_colors,url,price,reduced_price,description,details,colors,n_reviews,avg_stars
29,,,,/us/adilette-lite-slides/GZ6197.html,,,Keep things light. This applies to your life and to your footwear. These adidas Adilette slides make everything easy. All you have to do is slip them on. They work just as well when you're out running around as they do when you're in the house. You can thank the lightweight cushioning for that.,Slip-on; Synthetic upper; Synthetic outsole; Imported; Product color: Cloud White / Cloud White / Matte Silver; Product code: GZ6197, Cloud White / Cloud White / Matte Silver,800,4.7
30,,,,/us/gamemode-firm-ground-soccer-cleats/GV6875.html,,,"Let your feet do the talking on the pitch. Express your beautiful game in adidas Gamemode with a choice of styles and designs. Created with a comfortable fit for a wide range of foot shapes, these juniors' soccer cleats offer a cushioned touch thanks to their soft HybridTouch upper. The versatile outsole will help you show your skills on both firm ground and artificial grass. The eye-catching graphics borrow from the beautiful game.",Regular fit; Lace closure; HybridTouch synthetic upper; TPU heel clip; Hybrid outsole for firm and artificial surfaces; Imported; Product color: Cloud White / Gold Metallic / Core Black; Product code: GV6875, Carbon / Red / Bright Blue,49,4.7
31,,,,/us/racer-tr21-shoes/GZ8184.html,,,"Bring the comfort and athletic style of running footwear to your everyday look in these adidas shoes. Step through your day confidently with a snug fit and a lightweight midsole that cushions your feet with every step.

This product is made with Primegreen, a series of high-performance recycled materials. 50% of the upper is recycled content. No virgin polyester.",Lace closure; Textile upper; Soft feel; Cloudfoam midsole; Textile lining; Rubber outsole; Primegreen; Imported; Product color: Core Black / Cloud White / Core Black; Product code: GZ8184, Core Black / Core Black / Grey Four,1770,4.6
32,,,,/us/terrex-free-hiker-xpl-gore-tex-boots/GW7222.html,,,"Keep an eye on the environment and let adventure guide the way. These adidas hiking boots combine energy-returning BOOST and a supportive canvas upper with a focus on recycled materials for long-range comfort and durability. Weekend escape or extended overnight adventure, foot-hugging comfort lets you focus on the experience. GORE-TEX seals out water to keep your feet dry, and Continental™ Rubber offers extraordinary grip on any trail, wet or dry.",Regular fit; Lace closure; Canvas upper with molded toe cap; GORE-TEX membrane; EVA stabilization frame and external heel clip; BOOST midsole; Weight: 16.4 ounces (size 9); Midsole drop: 14 mm (heel: 36 mm / forefoot: 22 mm); Continental™ Rubber outsole; Yarn in upper contains at least 50% Parley Ocean Plastic and 50% recycled polyester; Imported; Product color: Shadow Maroon / Shadow Green / Core Black; Product code: GW7222, Shadow Maroon / Shadow Green / Core Black,14,4.4
33,,,,/us/adistar-cs-shoes/GY1698.html,,,"Inspired by the idea of perpetual motion, ADISTAR CS supports runners to reach their long-distance PB and beyond. Built for comfort and support, with a long curve shaped angle across the forefoot, it creates a smooth, consistent rocking motion that helps you onto the next step. Designed with heel strike protection and upper support in mind.",Regular fit; Lace closure; Engineered mesh upper; Internal support cage; Textile lining; REPETITOR+ SUPPORT FRAME; Weight: 11.3 ounces (size 9); Midsole drop: 6 mm (heel: 37 mm / forefoot: 31 mm); Continental rubber outsole; Yarn in upper contains at least 50% Parley Ocean Plastic and 50% recycled polyester; Imported; Product color: Impact Orange / Night Metallic / Beam Orange; Product code: GY1698, Cloud White / Carbon / Team Real Magenta,14,4.9
34,,,,/us/4dfwd-2-shoes/GX9249.html,,,"adidas 4DFWD 2 redefines forward motion combining the unique, groundbreaking innovation of a 3D printed midsole with a new upper construction and a Continental outsole for extra grip. With every stride, the adidas 4DFWD 2 midsole compresses forward, reducing braking forces and transforming the impact energy into forward motion. The result is a smooth ride with less stop-and-go pounding on pavement. The Continental outsole grippy rubber outsole provides traction on wet and dry surfaces to keep you going in all conditions, and the adidas PRIMEKNIT+ upper wraps the foot with a new fit that enhances movement.

Made with a series of recycled materials, this upper features at least 50% recycled content. This product represents just one of our solutions to help end plastic waste.","Lace closure; Combination of adidas PRIMEKNIT+ and engineered mesh; Sock-like fit; 3D-printed 4DFWD midsole; Textile lining
Weight: 345 g; Midsole drop: 11 mm
(heel: 32 mm / forefoot: 21 mm); Continental™ Rubber outsole; Imported; Product color: Core Black / Cloud White / Carbon; Product code: GX9249", Cloud White / Core Black / Cloud White,43,4.8
35,,,,/us/nmd_r1-shoes/GW5680.html,,,"Inspired by running silhouettes from the '80s archive, NMD was born in 2015 to merge sleek style with modern technologies and comfort. This pair of the iconic shoes brings easy energy to your everyday look. Energy-returning BOOST in the midsole provides comfort, and the signature NMD midsole plugs and heel pull ratchet up the futuristic look.",Lace closure; Textile upper; Textile lining; BOOST midsole; Rubber outsole; Yarn in upper contains at least 50% Parley Ocean Plastic and 50% recycled polyester; Imported; Product color: Bliss / Bliss / Tech Emerald; Product code: GW5680, Bright Orange / Bright Orange / Core Black,2371,4.5
36,,,,/us/zx-750-shoes/FZ5894.html,,,"Our ZX line launched in the '80s to help runners elevate their game, run faster and go farther. But there's no speed requirement for this pair. Whether you're walking fast or moving slow, the retro design of the adidas ZX 750 is all about looking and feeling good. Soft EVA cushioning supports every step.",Lace closure; Leather upper; EVA midsole; Textile lining and sockliner; Rubber outsole; Imported; Product color: Core Black / Cloud White / Power Red; Product code: FZ5894,,,
37,,,,/us/eastrail-2.0-mid-rain.rdy-hiking-shoes/GY4177.html,,,"With these adidas hiking shoes, you can skip the break-in period and get straight to the good stuff: weekend hikes and adventures with friends. Right out of the box, they hug your foot with a supportive fit and cushioned comfort. RAIN.RDY repels wet conditions, so you can cruise through puddles without risking soggy feet. The Traxion outsole grips in all directions.

Made with a series of recycled materials, this upper features at least 50% recycled content. This product represents just one of our solutions to help end plastic waste.",Lace closure; Abrasion-resistant mesh upper with synthetic overlays; Gusseted tongue; RAIN.RDY; Lightweight EVA midsole; Traxion outsole; Upper contains a minimum of 50% recycled content; Imported; Product color: Grey Five / Dash Grey / Core Black; Product code: GY4177,,,
38,,,,/us/five-ten-kestrel-lace-mountain-bike-shoes/GZ9252.html,,,"Transfer maximum power to the pedals. The Kestral Pro Lace matches our stiffest sole with clip-in compatibility for an efficient all-mountain ride. The traditional lace closure features a hook-and-loop strap for added security, while the wide Stealth® C4 rubber sole provides confident footing in all terrain. Mesh inserts enhance breathability, and the quick-drying synthetic upper maintains all-weather comfort.",Regular fit; Lace closure with hook-and-loop top strap; Synthetic weather-resistant micro-perforated upper; Durable lightweight EVA midsole; Stealth® C4 rubber outsole for unbeatable grip; Stiff carbon-infused nylon shank; Imported; Product color: Focus Olive / Sandy Beige / Orbit Green; Product code: GZ9252,,40,4.5
39,,,,/us/stan-smith-shoes/GY4263.html,,,"Happy Stan, happy kids. For over 50 years, the adidas Stan Smith shoes have solidified their place as an icon. Now the timeless white silhouette gets reimagined for kids. The coordinating heel tab and a dedicated signoff add bright updates.

Made with a series of recycled materials, this upper features at least 50% recycled content. This product represents just one of our solutions to help end plastic waste.",Regular fit; Lace closure; Synthetic leather upper; OrthoLite® sockliner; Textile lining; Recycled rubber outsole made with 10% recycled material derived from production waste; Upper contains a minimum of 50% recycled content; Imported; Product color: Cloud White / Grey Two / Silver Metallic; Product code: GY4263, Cloud White / Almost Blue / Core Black,2,4.5
40,,,,/us/disney-kaa-stan-smith-shoes/HP5599.html,,,"For over 50 years, the adidas Stan Smith sneaker has solidified its place as a style icon. Now the classic silhouette gets a magical update with these shoes inspired by Kaa, the python from Disney's ""The Jungle Book."" Matte dark brown makes this pair particularly versatile, and the pop of yellow on the heel is reminiscent of Kaa's eyes. The synthetic suede upper gives a luxe touch to any outfit. The heel patches are a reminder that ""It's not easy being green,"" so it's important to do our best for the planet.

Made with a series of recycled materials, this upper features at least 50% recycled content. This product represents just one of our solutions to help end plastic waste.",Regular fit; Lace closure; Synthetic suede upper; Graphics on sockliner; Rubber outsole; ©Disney; Upper contains a minimum of 50% recycled content; Imported; Product color: Brown / Off White / Cardboard; Product code: HP5599, Pantone / Cloud White / Core Black,13045,4.7
41,,,,/us/ligra-7-indoor-shoes/GY7648.html,,,"Created to perform on every kind of court, these adidas Ligra 7 shoes will help you improve your indoor game. When the action shifts up a gear, their breathable mesh upper will keep you comfortable and confident. The combination of a grippy multidirectional outsole and supportive overlays provide stability while you weave your magic. Synthetic leather on the toe means they'll keep coming back for more.",Regular fit; Lace closure; Mesh upper with supportive overlays; Breathable feel; Abrasion-resistant synthetic leather toe; EVA midsole cushioning; Non-marking Adiwear outsole with 360-degree grip pattern; Upper contains a minimum of 50% recycled content; Imported; Product color: Core Black / Cloud White / Core Black; Product code: GY7648, Cloud White / Core Black / Cloud White,33,4.8
42,,,,/us/y-3-slides/HR1940.html,,,"""Y-3 is a strong examination of the blend of sport and style and the tension caused by mixing tradition with all that is modern.""  — Yohji Yamamoto 

Y-3 adds dramatics to a celebrated adidas style with an exaggerated silhouette. The Y-3 Slides have a bulky, statement design crafted with a heavy tumbled leather upper. They offer enhanced cushioning for unparalleled comfort.",Slip-on; Heavy tumbled leather upper; PORON® cushioning; Mesh lining; Rubber outsole; Imported; Product color: Black / Black / Black; Product code: HR1940, Silver Metallic / Brown / Cream White,6,3.3
43,,,,/us/super-d.o.n.-issue-4-basketball-shoes/GY9795.html,,,"The future of basketball is all about speed, and Donovan Mitchell is as fast as they come. These kids' signature shoes from Mitchell and adidas Basketball are built specifically to elevate the movements of one of the game's fastest, most dynamic scorers. Ultralight Lightstrike teams up with a LIGHTLOCK upper for a snug fit and an explosive propulsion system that won't slow down your superstar in the making. A unique rubber outsole is designed to generate traction where they need it most for total support on every cut and head fake. Mitchell's Spida logo and signature graphics provide the finishing touches.

Made in part with recycled content generated from production waste, e.g. cutting scraps, and post-consumer household waste to avoid the larger environmental impact of producing virgin content.",Regular fit; Lace closure; LIGHTLOCK upper; Lightstrike cushioning; Textile lining; Rubber outsole; 25% of the components used to make the upper are made with a minimum of 50% recycled content; Imported; Product color: Red / Core Black / Red; Product code: GY9795, Dash Grey / Bliss Lilac / Grey Two,,
44,,,,/us/dropset-trainer-shoes/GW3904.html,,,"Tackle your strength training and gym workouts without hesitation. These adidas shoes help you level up your game. A low midsole drop gives you a feeling of ground contact to encourage proper form and increase your confidence in your movements. Two different types of EVA cushioning give you stability on your heels and comfort on the front of your foot.

Made with a series of recycled materials, this upper features at least 50% recycled content. This product represents just one of our solutions to help end plastic waste.","Regular fit; Lace closure; Textile upper with padded collar; Durable, stable feel; Textile lining; Dual-density midsole with softer forefoot and stiffer heel; Rubber outsole; Imported; Product color: Dash Grey / Grey Six / Core Black; Product code: GW3904", Shadow Green / Magic Grey / Cloud White,240,4.6
45,,,,/us/swift-run-22-shoes/GW8179.html,,,"Remember the first pair of sneakers you fell in love with? Relive the memory every day in these juniors' adidas Swift Run 22 Shoes. Rooted in running but designed for the daily grind, they keep you comfortable with a supportive knit mesh upper and a cushioned EVA midsole. Oh, and they look good too. Win win. 

Made with a series of recycled materials, this upper features at least 50% recycled content. This product represents just one of our solutions to help end plastic waste.",Snug fit; Lace closure; Knit mesh upper; Hugs the foot; EVA midsole; OrthoLite® sockliner; Rubber outsole; Upper contains a minimum of 50% recycled content; Imported; Product color: Cloud White / Core Black / Grey One; Product code: GW8179, Core Black / Grey Five / Cloud White,150,4.3
46,,,,/us/terrex-agravic-flow-primegreen-trail-running-shoes/GY7670.html,,,"When you're adventuring with your little wild child, versatility is key. These kids' adidas trail running shoes transition from backyard to trail with ease, thanks to lightweight cushioning and grippy traction underfoot. Head out the door and let little feet find a smooth groove over rocks, dirt and uneven sidewalks alike. Their hook-and-loop strap keeps laces tucked away and secure. 

This product is made with Primegreen, a series of high-performance recycled materials. 50% of the upper is recycled content.",Regular fit; Comfort closure straps for easy on and off; Breathable engineered mesh upper; Lightweight EVA midsole; Abrasion-resistant weldings; Traxion rubber outsole; Primegreen; Imported; Product color: Wonder Mauve / Turbo / Magic Mauve; Product code: GY7670,,57,4.8
47,,,,/us/superstar-shoes/GV8903.html,,,"They love that magical feeling of seeing a bright rainbow after a storm. So why not help them bring that magic into every step? This whimsical spin on the classic adidas Superstar shoes inspires kids to live colorfully. Faded iridescent underlays provide a playful pattern that catches the eye. A snug fit with an OrthoLite® sockliner ensures that comfort isn't sacrificed for style. 

Made with a series of recycled materials, this upper features at least 50% recycled content. This product represents just one of our solutions to help end plastic waste.",Regular fit; Hook-and-loop straps; Synthetic leather upper; OrthoLite® sockliner; Adifit length-measuring insole; Rubber outsole; Upper contains a minimum of 50% recycled content; Imported; Product color: Cloud White / Cloud White / Core Black; Product code: GV8903,,,
