,title,subtitle,num_colors,url,price,description,details,colors,n_reviews,avg_stars,reduced_price
0,NMD_V3 Shoes,Men's Originals,21 colors,/us/nmd_v3-shoes/GX2086.html,$160,"A play on transparency, these adidas NMD_R1 V3 Shoes continue to build on the NMD franchise's signature expression of tactical tech. Here's what you need to know about the BOOST cushioning: it makes every step feel supported. Which is great, since you take a lot of them throughout the day. The other thing to know is that it's partially encapsulated in TPU, met by TPU heel plugs that signal that these are in fact NMD sneakers. 

This shoe's upper is made with a high-performance yarn which contains at least 50% Parley Ocean Plastic — reimagined plastic waste, intercepted on remote islands, beaches, coastal communities and shorelines, preventing it from polluting our ocean. The other 50% of the yarn is recycled polyester.",Lace closure; Mesh and TPU upper; Textile lining; BOOST midsole; Rubber outsole; Yarn in upper contains at least 50% Parley Ocean Plastic and 50% recycled polyester; Imported; Product color: Crystal White / Cloud White / Blue Rush; Product code: GX2086, Grey One / Off White / Halo Silver,38,4.5,
1,Lite Racer Adapt 4.0 Shoes,Men's Essentials,7 colors,/us/lite-racer-adapt-4.0-shoes/GY8578.html,$70,"Slip on and go. These versatile running-inspired shoes are made to help you get out the door quickly. The elastic strap gives you a locked-down feel when you're moving at top speed. Soft Cloudfoam cushioning is for lasting comfort when you're on your feet for longer than expected. 

This product is made with Primegreen, a series of high-performance recycled materials. 50% of the upper is recycled content. No virgin polyester.",Regular fit; Slip-on design with elastic strap; Textile upper; Textile lining; TPU heel piece; Cloudfoam midsole; Synthetic outsole; Primegreen; Imported; Product color: Focus Olive / Core Black / Cloud White; Product code: GY8578, Carbon / Core Black / Chalk White,898,4.5,$60
2,Adilette Comfort Slides,Yoga,19 colors,/us/adilette-comfort-slides/GZ5891.html,$35,"Whether you're heading to the locker room after an intense gym session or at home recovering on the couch, these slides keep your feet wrapped in lightweight comfort. Pair them with socks and shorts for your post-workout look or with your favorite swimwear for the ultimate beach vibe. The adidas 3-Stripes design completes your sport style.",Regular fit; Slip-on construction; Synthetic upper; Textile lining; Lightweight cushioning; Contoured footbed; EVA outsole; Imported; Product color: Core Black / Cloud White / Core Black; Product code: GZ5891, Core Black / Core White / Grey Six,9748,4.7,$30
3,NMD_R1 Shoes,Women's Originals,3 colors,/us/nmd_r1-shoes/HQ7104.html,$150,"Adventure awaits around every corner. You don't even have to know where to find it. Stay open, and it finds you. These adidas NMD_R1 Shoes are ready for whatever the day throws your way, keeping you feeling good through it all with plush BOOST cushioning and a flexible, supportive knit upper. The signature midsole plugs get done up with a metallic finish, which matches the logos and lace jewel.

This shoe's upper is made with a high-performance yarn which contains at least 50% Parley Ocean Plastic — reimagined plastic waste, intercepted on remote islands, beaches, coastal communities and shorelines, preventing it from polluting our ocean. The other 50% of the yarn is recycled polyester.",Lace closure; Textile upper; Snug feel; BOOST midsole; Textile lining and sockliner; Rubber outsole; Yarn in upper contains at least 50% Parley Ocean Plastic and 50% recycled polyester; Imported; Product color: Core Black / Core Black / Rose Gold Metallic; Product code: HQ7104, Core Black / Core Black / Wild Brown,249,4.3,
4,Supernova 2 Running Shoes,Women's Running,5 colors,/us/supernova-2-running-shoes/GZ6939.html,$100,"Who says running needs to be uncomfortable? These shoes are designed to help you run comfortable every time, on any terrain. From a precisely balanced mix of Bounce and increased Boost in the midsole to a new padded tongue and heel patch construction, experience comfort with every step. 

Supernova 2 is now made with a lower carbon footprint of 12% compared to the 2020 Supernova. From raw material extraction, processing, packaging, all the way to the end of product's life, we calculate and communicate its carbon footprint, conforming to an internationally recognized standard: ISO 14067 

To reduce our footprint, we need to measure it. The concise footprint results made available to you, provide full transparency on the complete lifecycle of the product. This is just one of our initiatives to help reduce our footprint.",Regular fit; Lace closure; Boost and Bounce midsole; Reduced carbon footprint; Direct injected TPU outsole; Padded tongue and heel; Weight: 8 ounces (size 7); Midsole drop: 9mm (heel: 25mm / toe: 16mm); Imported; Product color: Cloud White / Silver Metallic / Cloud White; Product code: GZ6939, Ecru Tint / Night Metallic / Solar Green,33,4.7,
5,Superstar Shoes,Children Originals,4 colors,https://www.adidas.com/us/superstar-shoes/EF5394.html,$70,"From the basketball court to the classroom. Everyone deserves a pair of adidas Superstars Shoes. This kids' version celebrates 50 years of the classic shell-toe design. From the distinctive serrated 3-Stripes to the comfortable rubber cupsole, this anniversary edition honors an icon. Whether they sport all white, all black or something in between, these shoes keep little ones looking fresh.",Lace closure; Leather upper; Iconic leather sneakers for daily wear; Molded sockliner; Adifit length-measuring insole; Imported; Product color: Core Black / Cloud White / Core Black; Product code: EF5394, Core Black / Cloud White / Core Black,440,4.8,
6,ZNSORED HI Shoes,Essentials,3 colors,https://www.adidas.com/us/znsored-hi-shoes/GZ2291.html,$90,"Box-fresh or broken in. These adidas skate-style shoes look good either way. Resting on a durable rubber outsole, the mid-cut upper is crafted from canvas and suede. A padded collar combines with LIGHTMOTION+ cushioning to keep your feet wrapped in comfort. Simply team them with crop or tapered pants.

Our cotton products support more sustainable cotton farming.",Regular fit; Lace closure; Canvas upper; LIGHTMOTION+ cushioning; Textile lining; Rubber outsole; Supports the Better Cotton Initiative; Imported; Product color: Crystal White / Cloud White / Cloud White; Product code: GZ2291, Crystal White / Cloud White / Cloud White,42,4.9,
7,Adilette TND Slides,Sportswear,13 colors,https://www.adidas.com/us/adilette-tnd-slides/GX9710.html,$40,"Inspired by the beloved adidas classic, these Adilette slides bring versatile comfort and sporty style to any occasion. The hook-and-loop top strap adjusts easily for a snug fit, while the quick-dry footbed is right at home from the pool deck to the locker room to the beach. A unique design shows some love to the Mexican Football Federation.",Regular fit; Hook-and-loop strap; EVA upper; Cloudfoam footbed; Textile lining; EVA outsole; Imported; Product color: Vivid Green / Cloud White / Scarlet; Product code: GX9710, Core Black / Cloud White / Light Blue,271,4.7,$32
8,,,,/us/superstar-shoes/GX1934.html,,"Consider all the legends who've laced into the adidas Superstar shoes over the decades. B-ball pros. Hip hop icons. Trendsetters. You. The list goes on and on. Amped up with camo-print accents, this pair has more attitude than ever. It's a good thing the clean, vintage style pairs with everything from track suits to crisp slacks, because they're just asking to be worn on repeat. 

Made in part with recycled content generated from production waste, e.g. cutting scraps, and post-consumer household waste to avoid the larger environmental impact of producing virgin content.",Regular fit; Lace closure; Leather upper; Textile lining; Rubber outsole; 25% of the components used to make the upper are made with a minimum of 50% recycled content; Imported; Product color: Cloud White / Wonder Steel / Cloud White; Product code: GX1934, Core Black / Core Black / Core Black,2604,4.7,
9,,,,/us/lite-racer-3.0-shoes/GW7954.html,,"Walking is an essential part of daily life. Comfort should be too. Enjoy every step you take in these adidas shoes. Inspired by classic running shoes, they have plush Cloudfoam cushioning and a snug fit. Plus, 3-Stripes style. Do you even need any other shoes?",Lace closure; Textile upper; Cushioned feel; Textile lining; Cloudfoam midsole; Upper contains a minimum of 50% recycled content; Imported; Product color: Core Black / Core Black / Grey Six; Product code: GW7954, Core Black / Core Black / Grey Six,295,4.5,
10,,,,/us/supernova-2-running-shoes/GY1772.html,,"Who says running needs to be uncomfortable? These shoes are designed to help you run comfortable every time, on any terrain. From a precisely balanced mix of Bounce and increased Boost in the midsole to a new padded tongue and heel patch construction, experience comfort with every step. 

Supernova 2 is now made with a lower carbon footprint of 10% compared to the 2020 Supernova. From raw material extraction, processing, packaging, all the way to the end of product's life, we calculate and communicate its carbon footprint, conforming to an internationally recognized standard: ISO 14067 

To reduce our footprint, we need to measure it. The concise footprint results made available to you, provide full transparency on the complete lifecycle of the product. This is just one of our initiatives to help reduce our footprint.",Regular fit; Lace closure; Boost and Bounce midsole; Reduced carbon footprint; Direct injected TPU outsole; Padded tongue and heel; Weight: 275g; Midsole drop: 9mm (heel: 25mm / toe: 16mm); Imported; Product color: Impact Orange / Night Metallic / Vivid Red; Product code: GY1772, Grey Six / Silver Metallic / Beam Orange,145,4.5,
11,,,,/us/adidas-4dfwd-x-parley-shoes/GX6604.html,,"The adidas 4DFWD is a running shoe designed to move you forward. With every stride, the 3D-printed 4D midsole redirects impact energy into forward motion. The result? A smooth forward ride that feels more like gliding than stop-and-go pounding on pavement.

Educate and act. Head to Parley for the Oceans website to find out more, sign up and get involved at adidas.com/parley.",Lace closure; Textile upper; 3D-printed 4D midsole; Textile lining; Weight: 12.7 ounces; Midsole drop: 11 mm (heel: 32 mm / forefoot: 21 mm); Yarn in upper contains at least 50% Parley Ocean Plastic and 50% recycled polyester; Imported; Product color: Shadow Navy / Cloud White / Impact Orange; Product code: GX6604, Shadow Navy / Cloud White / Impact Orange,2,4.5,
12,,,,/us/the-velosamba-vegan-cycling-shoes/GX1671.html,,"Roll through the daily commute with the iconic style of the adidas Samba on your feet. Designed with city riding, commuting and indoor cycling in mind, the Velosamba is your incognito bike shoe. It's two-bolt cleat compatible with a full-length reinforced midsole for efficient pedaling that still flexes for comfortable walking. Its vegan upper is coated for water-resistance to help keep your feet dry.",Regular fit; Lace closure; Vegan upper; Textile lining; Stiff nylon insole board; Synthetic outsole with two-bolt cleat mount; Vegan alternative: At least 25% recycled content; Imported; Product color: Wonder Steel / Cloud White / Cloud White; Product code: GX1671, Wonder Steel / Cloud White / Cloud White,261,4.5,
13,,,,/us/vulc-raid3r-skateboarding-shoes/GX0872.html,,"Relive the days of kickflips and ollies. These adidas skateboarding-inspired sneakers pull from the best of skate culture to keep things chill, regardless of what you're doing. Wear an icon suited for all occasions.

Our cotton products support more sustainable cotton farming.",Regular fit; Lace closure; Eco-canvas upper; Light and breathable feel; Textile lining; Stitched 3-Stripes; Vulcanized rubber outsole; Supports the Better Cotton Initiative; Imported; Product color: Cloud White / Cloud White / Silver Metallic; Product code: GX0872, Mystery Blue / Hi-Res Yellow / Cloud White,6,5.0,
14,,,,/us/adidas-x-disney-racer-tr21-toy-story-woody-shoes/GY4451.html,,"Fans of Disney Pixar's Toy Story will love these kids' adidas sneakers with Sheriff Woody decorating the side. A supportive Cloudfoam midsole ensures all-day comfort, and elastic laces mean they're easy to get off and on. The additional hook-and-loop strap on top adjusts the fit when they're on the go.

Made with a series of recycled materials, this upper features at least 50% recycled content. This product represents just one of our solutions to help end plastic waste.",Regular fit; Elastic laces; Mesh upper; Textile lining; Cloudfoam midsole; Rubber outsole; ©Disney; Upper contains a minimum of 50% recycled content; Imported; Product color: Semi Solar Gold / Off White / Royal Blue; Product code: GY4451,,12,4.8,
15,,,,/us/campus-80s-pride-shoes/GX6390.html,,"Love makes anything possible. Slip on these adidas Campus 80s Pride Shoes and make sure the world knows it. Bold and bright ""Love Unites"" graphics flash across the smooth leather upper with every step you take. The off-white midsole pays tribute to the original 1980s Campus.",Lace closure; Leather upper; Leather lining; Rubber outsole; Imported; Product color: Off White / Core Black / Off White; Product code: GX6390,,93,4.8,
16,,,,/us/nmd_r1-v2-shoes/GX6367.html,,"Head into the future with confidence. Not to mention style. Inspired by running silhouettes from the '80s archive, NMD was born in 2015 to merge sleek style with modern technologies and comfort. These juniors' adidas NMD_R1 V2 shoes keep your feet cushioned with a responsive BOOST midsole. Chic transparent overlays add a cyberpunk vibe. The future is yours. Go and get it.

This shoe's upper is made with a high-performance yarn which contains at least 50% Parley Ocean Plastic — reimagined plastic waste, intercepted on remote islands, beaches, coastal communities and shorelines, preventing it from polluting our ocean. The other 50% of the yarn is recycled polyester.",Regular fit; Lace closure; Textile upper; Snug feel; BOOST midsole; Textile lining; Rubber outsole; Yarn in upper contains at least 50% Parley Ocean Plastic and 50% recycled polyester; Imported; Product color: Core Black / Cloud White / Cloud White; Product code: GX6367, Focus Olive / Core Black / Cloud White,731,4.6,
17,,,,/us/adistar-shoes/GY1692.html,,"The distance running shoe inspired by the idea of perpetual motion and tested over 4,500 km. Adistar combines a soft, lightweight REPETITOR foam platform with REPETITOR +, a firmer foam, to create a dual density midsole. The firmer 15% recycled EVA in the heel protects and helps stabilize any heel strike. Forward propulsion is enhanced by the rocker geometry as well as an overall 6mm drop heel to toe. Strike soft and push forward with a shoe designed to go the distance.",Regular fit; Lace closure; Engineered mesh upper with internal support cage; Women's-specific fit; Rocker geometry; REPETITOR+ midsole; Weight: 11.2 ounces; Midsole drop: 6 mm (heel: 37.5 mm / forefoot: 31.5 mm); Continental™ Rubber outsole; Yarn in upper contains at least 50% Parley Ocean Plastic  and 50% recycled polyester; Imported; Product color: Core Black / Grey Six / Cloud White; Product code: GY1692, Chalk White / Vivid Red / Bold Green,157,4.6,
18,,,,/us/terrex-free-hiker-2-gore-tex-hiking-shoe/GZ3287.html,,"TERREX Free Hiker 2 GORE-TEX brings comfort and confidence to your everyday adventure. It's time to enjoy your outdoor experience. 

Take on the outdoors in style and comfort with the TERREX Free Hiker 2 GORE-TEX. Feel confident in most weather conditions thanks to the breathable GORE-TEX membrane and Continental™ rubber outsole. Enjoy your hikes with the updated design.",Regular fit; Lace closure; Abrasion-resistant mesh upper with molded toe cap and external heel clip; GORE-TEX lining; EVA stabilization frame; BOOST midsole; Continental™ Rubber outsole; Upper contains a minimum of 50% recycled content; Imported; Product color: Linen Green / Grey Three / Impact Orange; Product code: GZ3287, Pulse Olive / Focus Olive / Impact Orange,24,4.5,
19,,,,/us/originals-flex-shoes/GZ3576.html,,"Whatever is on today's agenda, you can handle it in these juniors' adidas shoes. Even if the plans change, you're set — thanks to flexible cushioning and sleek, easy-to-pair-with-anything style. Plus, you can customize the look to go lace-free or laced-up. 

Made with a series of recycled materials, this upper features at least 50% recycled content. This product represents just one of our solutions to help end plastic waste.",Regular fit; Lace closure; Mesh upper with synthetic suede overlays; OrthoLite® sockliner; Textile lining; EVA outsole with deep flex grooves; Upper contains a minimum of 50% recycled content; Imported; Product color: Core Black / Core Black / Core Black; Product code: GZ3576,,104,4.3,
20,,,,/us/eq21-run-shoes/GY2209.html,,Log miles in confidence with these adidas running shoes. The breathable upper lets your feet stay fresh on long runs. Lightweight cushioning keeps a comfortable spring in your step from the first toe-off to the final heel strike.,Regular fit; Lace closure; Engineered mesh upper; Padded collar; TPU quarter and heel stabilizers; Bounce midsole; Weight: 540 g (size UK 5.5); Midsole drop: 10.5 mm; Rubber outsole; 25% of the components used to make the upper are made with a minimum of 50% recycled content; Imported; Product color: Wonder Steel / Pulse Blue / Matt Purple Met.; Product code: GY2209, Core Black / Bliss Orange / Bliss Pink,710,4.5,
21,,,,/us/adidas-x-lego-racer-tr-shoes/GX1997.html,,"As kids' LEGO® bricks creations get bigger, their play gets more adventurous. The good news is that these adidas shoes are there for the journey. They have a Cloudfoam midsole to help them run and climb in comfort. An eye-catching LEGO® tech print and a LEGO®-themed design on the 3-Stripes and heel complete the look.

Made with a series of recycled materials, this upper features at least 50% recycled content. This product represents just one of our solutions to help end plastic waste.",Regular fit; Lace closure; Textile upper; Textile lining; Cloudfoam midsole; LEGO® studs on heel counter; Rubber outsole; Upper contains a minimum of 50% recycled content; Imported; Product color: Core Black / Eqt Yellow / Grey Three; Product code: GX1997, Shock Blue / Off White / Core Black,4,5.0,
22,,,,/us/cloudfoam-pure-2.0-shoes/GY4502.html,,"Doesn't matter what they've got scheduled today, they'll get there in total comfort. These kids' adidas running-inspired shoes ride on a Cloudfoam midsole and have a textile sockliner to cushion their every stride. Graphic pops and bold 3-Stripes provide added style.

Made with a series of recycled materials, and at least 50% recycled content, this product represents just one of our solutions to help end plastic waste.",Regular fit; Slip-on construction; Knit upper; Girl's-specific design; Textile lining; Cloudfoam midsole; Synthetic outsole; Upper contains a minimum of 50% recycled content; Imported; Product color: Almost Blue / Clear Pink / Bliss Blue; Product code: GY4502, Almost Blue / Clear Pink / Bliss Blue,61,4.4,
23,,,,/us/samba-leather-shoes/019000.html,,"Developed in the '50s for soccer training on frozen ground, the Samba has become a stone-cold classic. Equally at home on the court or street, these shoes have a full grain leather upper with suede overlays to resist abrasion. Underneath, a foam midsole cushions every step.

Hard-wearing and supportive
Full grain leather upper with suede overlays offer support 

Signature Samba details
Suede T-toe, long tongue and serrated 3-Stripes

Traction on flat surfaces
Non-marking gum rubber outsole for excellent grip on all indoor surfaces",Lace closure; Full grain leather upper with suede overlays; Lined for comfort; Non-marking gum rubber outsole; Embossed EVA midsole; Imported; Product color: Core Black / Cloud White / Core Black; Product code: 019000,,147,4.3,
24,,,,/us/adidas-x-disney-advantage-muppets-hook-and-loop-shoes/GY6586.html,,"Now your little one will always have their favorite characters with them. These infants' adidas sneakers are decorated with Disney's Kermit the Frog and Elmo. With their colorful straps, perforated 3-Stripes and speckled outsole, the shoes are sporty and fun all the way around. 

Made with a series of recycled materials, this upper features at least 50% recycled content. This product represents just one of our solutions to help end plastic waste.",Regular fit; Hook-and-loop closure; Synthetic upper; Textile lining; Rubber outsole; ©Disney; Upper contains a minimum of 50% recycled content; Imported; Product color: Off White / Still Green / Cloud White; Product code: GY6586,,14,4.9,
25,,,,/us/ultraboost-5.0-dna-shoes/GV8724.html,,"Any time you're on your feet is a good time to wear these adidas Ultraboost shoes. Equipped with all the performance technology that runners love, they're updated with extra style points. Energy-returning BOOST in the midsole and a foot-hugging adidas PRIMEKNIT upper make sure of it.",Regular fit; Lace closure; adidas PRIMEKNIT upper; Fitcounter molded heel counter; BOOST midsole; Torsion System; Stretchweb outsole with Continental™ Rubber; Yarn in upper contains at least 50% Parley Ocean Plastic and 50% recycled polyester; Imported; Product color: Magic Mauve / Magic Mauve / Ecru Tint; Product code: GV8724, Magic Mauve / Magic Mauve / Ecru Tint,1395,4.7,
26,,,,/us/nmd-360-shoes/GY9161.html,,"The backyard. The park. The city. Kids find adventure everywhere. Set them up to explore in these kids' adidas shoes. The design is based on running shoes from the '80s, so it's definitely up to the task of zooming and playing through the day. Flexible EVA cushioning is all about comfort, while the midsole plugs have style on lock. 

Made with a series of recycled materials, this upper features at least 50% recycled content. This product represents just one of our solutions to help end plastic waste.",Snug fit; Slip-on; Stretch textile upper; OrthoLite® sockliner; Adifit length-measuring insole; EVA outsole with deep flex grooves; Upper contains a minimum of 50% recycled content; Imported; Product color: Bliss Blue / Almost Blue / Cloud White; Product code: GY9161,,,,
27,,,,/us/s2g-spikeless-golf-shoes/GV9792.html,,"When a morning round is just part of your busy day, these adidas golf shoes see you through. They're made for comfort on and off the course with a Bounce midsole that delivers cushioning and flexibility. The spikeless V-Traxion outsole provides enhanced grip on variable terrain. The waterproof upper keeps your feet dry on damp fairways so you leave the last green ready for your day.

Made with a series of recycled materials, this upper features at least 50% recycled content. This product represents just one of our solutions to help end plastic waste.",Regular fit; Lace closure; Waterproof printed textile upper with reflective details; Slow resilient sockliner; Bounce midsole; Adiwear outsole with V-Traxion; Upper contains a minimum of 50% recycled content; Imported; Product color: Cloud White / Grey Four / Grey Six; Product code: GV9792, Cloud White / Grey Four / Grey Six,382,4.6,
28,,,,/us/terrex-ax4-hiking-shoes/GY8621.html,,"Hello, day off. From forest trails to alpine adventures, the adidas TERREX AX4 hiking shoes are powered by a dual-density design that merges the comfort of a cushioned trail runner with the stability of a hiking shoe. Start wandering.",Regular fit; Lace closure; Mesh and synthetic upper; Lightweight feel; EVA midsole; Molded sockliner; Continental™ Rubber outsole; Upper contains a minimum of 50% recycled content; Imported; Product color: Wonder Red / Linen Green / Pulse Lilac; Product code: GY8621,,103,4.5,
29,,,,/us/nmd_r1-shoes/HP9857.html,,"The NMD_R1 shoes combine the best of adidas racing heritage with next-gen technologies to create a bold and modern classic. Playing off that running aesthetic, these '80s-inspired sneakers update the sleek look with a soft, premium synthetic upper and responsive BOOST cushioning. No sacrificing comfort here. Distinctive plugs stand out on the midsole — a visual hallmark of NMD style.",Lace closure; Synthetic upper; Textile lining; BOOST midsole; Rubber outsole; Imported; Product color: Shadow Navy / Cloud White / Collegiate Burgundy; Product code: HP9857, Core Black / Core Black / Core Black,2570,4.6,
30,,,,/us/racer-tr21-shoes/H04219.html,,"For kids who would always rather be in motion. Help them get ready for playtime at maximum speed with these adidas shoes. The shoes slip on easily and adjust quickly for a snug fit. Lightweight cushioning underfoot keeps them running and jumping comfortably all day long.

This product is made with Primegreen, a series of high-performance recycled materials. 50% of the upper is recycled content. No virgin polyester.",Regular fit; Elastic laces with top strap; Mesh upper; Textile lining; Cloudfoam cushioning; TPU heel piece; Synthetic outsole; Primegreen; Imported; Product color: Core Black / Cloud White / Sonic Ink; Product code: H04219, Core Black / Core Black / Carbon,39,4.5,
31,,,,/us/adilette-lite-slides/FU8297.html,,"Full-time vacation vibes. These Adilette Lite Slides free your feet. (Or wear them with socks, no judgment here.) This pair features a super-soft footbed for an instantly comfy feel. There's an adidas Trefoil on top so you can feel sporty, even when you're lounging.",Slip-on; Synthetic bandage upper; Super-soft feel; Cushioned sporty slides; Synthetic outsole; Imported; Product color: Cloud White / Core Black / Cloud White; Product code: FU8297, Grey Three / Cloud White / Grey Three,1912,4.7,
