,title,subtitle,num_colors,url,price,reduced_price,description,details,colors,n_reviews,avg_stars
44,,,,/us/fortarun-sport-running-lace-shoes/GV9465.html,,,"Children clock up the miles, whether they're running, practicing sports or just playing for hours. That's why these kids' adidas sneakers are designed to withstand a lot of scuffs and scrapes. Inside, the Cloudfoam cushioning and pillowy sockliner wrap feet in softness. Outside, the non-marking rubber outsole leaves no trace when the fun comes indoors.

Made with a series of recycled materials, this upper features at least 50% recycled content. This product represents just one of our solutions to help end plastic waste.",, Core Black / Cloud White / Green Oxide,38,4.8
45,,,,/us/adilette-shower-slides/GZ5928.html,,,"From the pool deck to the shower to the couch, these slides are made for the work-hard-rest-hard lifestyle. The slip-on construction gives you a snug fit that's easy to kick on and off as needed. Lightweight cushioning keeps your feet cradled in all-day comfort. The adidas script logo adds an extra touch of class to the iconic Adilette look.",, Clear Pink / Clear Pink / Super Pop,590,4.7
46,,,,/us/ozweego-shoes/GV8888.html,,,"Right in the sweet spot between '90s style and futuristic innovation come these juniors' adidas OZWEEGO Shoes. An evolution of the famed retro runners, they fit snug, feel comfortable and look bold. Very bold. But there's no need to save them for special occasions. Easy-to-wear colors mean you can reach for them on weekdays, weekends or whenever.

Made in part with recycled content generated from production waste, e.g. cutting scraps, and post-consumer household waste to avoid the larger environmental impact of producing virgin content.",, Core Black / Solar Red / Grey Six,63,4.9
47,,,,/us/forum-84-camp-low-shoes/GV6785.html,,,A staple of '80s basketball. A favorite on city streets around the world. The adidas Forum returns with a rugged update. Fresh colors and unexpected materials play up a whole new vibe. The leather upper and famous crisscross strap stay true to the shoes' origins.,, Dark Green / Night Cargo / Cargo Brown,4,5.0
