,label,title,subtitle,num_colors,price,reduced_price,url,description,colors,n_reviews,avg_stars
315,,Nike Air Force 1 '07,Women's Shoes,1 Color,$140,,https://www.nike.com/t/air-force-1-07-womens-shoes-42tbf5/DX2306-400,"The radiance lives on with the Nike Air Force 1 '07. Crossing hardwood comfort with off-court flair, this b-ball original puts a fresh spin on what you know best: era-echoing ‘80s construction, bold details and nothing-but-net style.",Shown: Racer Blue/White/University Blue,1.0,5.0
316,Just In,Nike Dynamo Go,Baby/Toddler Easy On/Off Shoes,7 Colors,$58,,https://www.nike.com/t/dynamo-go-baby-toddler-easy-on-off-shoes-LwLCdK/DH3438-003,"Easy, snug and built for anytime play—the Nike Dynamo Go will be your little one’s next fave. What we love most is that kiddos can stomp down on the collapsible heel and slip in quick and easy. And if they're not quite ready to do it themselves, you can show them how it works so they can be free and independent! It’s also soft and plush in the best places so the fun never stops.",Violet Frost/Midnight Navy/Vivid Purple/Metallic Silver; Aura/Light Orewood Brown/Worn Blue/White; Laser Blue/Midnight Navy/White/Safety Orange; Mystic Navy/Light Photo Blue/University Gold/White; Pink Foam/Sesame/Honeydew/Pink Gaze; Black/University Red/White; Black/Bright Spruce/Phantom/Volt,1.0,2.0
317,,Nike Air Presto Mid Utility,Men's Shoes,5 Colors,$150,$94.97,https://www.nike.com/t/air-presto-mid-utility-mens-shoes-5Q7PsF/DC8751-700,"Don't worry about the shift from sunny days to winter months in the Nike Air Presto Mid Utility. Crafted with stretchy fabric on the upper that's designed to help you stay dry, it delivers extra toughness. Its warm liner keeps that favorite T-shirt comfort you know.",Anthracite/Summit White/Particle Grey/University Blue; Black/Anthracite/Racer Blue/Team Red; Orange/Black/White/Orange; Bicycle Yellow/Wheat/Team Best Grey/Cinnabar; Baroque Brown/Sesame/Sequoia/Canyon Rust,61.0,4.7
318,,Nike SB Force 58,Skate Shoe,7 Colors,$80,$68.97,https://www.nike.com/t/sb-force-58-skate-shoe-Fslk1b/CZ2959-006,"The latest and greatest innovation to hit the streets, the Nike SB Force 58 gives you the durability of a cupsole with the flexibility of a vulcanized shoe. Made from canvas and suede and finished with perforations, the whole look is infused with heritage basketball DNA.",Concord/Black/Concord/Team Orange; Phantom/Phantom/White/Blue Jay; Ash Green/Ash Green/Sail/White; Black/Black/White; Wolf Grey/Black/Wolf Grey/Light Menta; Viotech/Viotech/White/Black; Summit White/Summit White/White/Summit White,0.0,0.0
319,,Nike Air Max Dawn,Women's Shoes,16 Colors,$115,$88.97,https://www.nike.com/t/air-max-dawn-womens-shoes-224mWf/DR2395-100,Root yourself to sporty track DNA with this throwback design. The Air Max Dawn is thoughtfully crafted with Air cushioning and era-echoing fabrics (like synthetic suede and synthetic leather) to deliver classic vibes. Modern design lines on the midsole and heel keep your look fresh. Lace up and give your day a look-good forecast.,White/Medium Soft Pink/Baltic Blue/White; Summit White/Pure Platinum/White/Medium Blue; Light Soft Pink/White/Sail/Shimmer; White/Light Orewood Brown/Black/Mantra Orange; Light Orewood Brown/Sanded Gold/Light Madder Root/Sail; Phantom/Light Bone/Atmosphere/Summit White; Atomic Green/Light Lemon Twist/Black; White/Mint Foam/Vivid Sulfur/Multi-Color; White/Light Liquid Lime/Light Thistle/Peach Cream; Phantom/Sanddrift/Black/Light Curry; Gym Red/White/Black/Vivid Sulfur; Summit White/Metallic Gold/Silver/Black; Black/Habanero Red/Electro Purple/White; White/Light Bone/Black/Lapis; White/Total Orange/Black; Black/Metallic Silver/Total Orange/Summit White,1.0,5.0
320,Sustainable Materials,Nike Free Run 5.0 Next Nature,Women's Road Running Shoes,8 Colors,$100,,https://www.nike.com/t/free-run-5-next-nature-womens-road-running-shoes-0PFsLM/CZ1891-101,"The sock-like fit and lightweight feel of this Nike Free was made to transition from running to training to your everyday routine. Made with at least 20% recycled content by weight, it combines the flexibility you love with a contained design that will help keep you close to the ground for that barefoot feeling. A new foam is lighter, softer and more responsive than previous versions so you can keep moving in comfort whether you’re on the pavement or track.",Platinum Violet/Champagne/White; Sail/Phantom/Light Iron Ore/Atmosphere; University Red/Gym Red/Off Noir/White; Pure Platinum/Ghost/Metallic Silver; White/Platinum Tint/Team Orange/Black; Black; Lilac/Black/Barely Grape/Racer Blue; Pure Platinum/Barely Green/Mint Foam/White,178.0,4.7
321,,Nike Renew Serenity Run 2,Women's Road Running Shoes,4 Colors,$85,,https://www.nike.com/t/renew-serenity-run-2-womens-road-running-shoes-rLtS4Z/DM0820-001,"Unwind and enjoy the journey ahead with neutral running shoes made for the moments when your steps speed up to help ease your mind. Plush, lightweight cushioning complement a fit that'll help you stayed focused on seeking the joy in the journey. Quiet the world around you while you run, putting today's troubles in the past while letting tomorrow worry about itself.",White/Black/Pure Platinum; Bicoastal/Enamel Green/Hemp/Light Soft Pink; Barely Rose/Black/White; Black/White,5.0,4.8
322,,Nike Downshifter 11,Women's Road Running Shoes,2 Colors,$60,$54.97,https://www.nike.com/t/downshifter-11-womens-road-running-shoes-TNTStc/CW3413-005,"The Nike Downshifter 11 gives you lightweight, flexible support to keep you going. It continues the same soft cushioning from the last version and adds more support around the midfoot to make it comfortable to wear long after your workout.",Black/Dark Beetroot/Archaeo Pink/Dark Pony; Black/Dark Smoke Grey/White,298.0,4.5
323,Member Access,Nike Air Max Motif Next Nature,Big Kids' Shoes,1 Color,$120,$114.97,https://www.nike.com/t/air-max-motif-next-nature-big-kids-shoes-S9h0lv/DZ5639-200,"Everything you need for all-day play with visible Max Air? Count us in! Inspired by the AM1, the Nike Air Max Motif honors a long-standing streetwear legend with a futuristic refresh. An olive green colorway roots these kicks to nature while redesigned Air units provide plush cushioning so you can soak up the fun as you explore and play.",Shown: Medium Olive/Black/Gum Light Brown/University Gold,0.0,0.0
324,,Nike Jr. Phantom GT2 Academy Dynamic Fit MG,Little/Big Kids' Multi-Ground Soccer Cleats,1 Color,$65,,https://www.nike.com/t/jr-phantom-gt2-academy-dynamic-fit-mg-little-big-kids-multi-ground-soccer-cleats-pVQvcM/DC0813-001,"Building on the Phantom GT, the Nike Jr. Phantom GT2 Dynamic Fit MG has an updated design and patterning that are engineered to help you place your shots with pinpoint accuracy. Off-center lacing provides a clean strike zone to help you dribble, pass and score with precision.",Shown: Black/Summit White/Bright Crimson/Dark Smoke Grey,36.0,4.9
325,,Nike Viale Space Dye,Big Kids' Shoes,1 Color,$60,$49.97,https://www.nike.com/t/viale-space-dye-big-kids-shoes-t15jJr/BQ7561-100,"The Nike Viale Space Dye celebrates the world's greatest runners who attempted a sub-2-hour marathon. With colorful mesh and soft foam, you're ready for a full day of having fun.",Shown: White/Laser Fuchsia/Blue Fury/Black,7.0,4.9
326,,PG 5 (Team),Basketball Shoes,4 Colors,$110,$76.97,https://www.nike.com/t/pg-5-team-basketball-shoes-pNPfKx/DA7758-401,"Paul George plays effortlessly. He takes his time but is always well-positioned to make the extra pass, cut through the lane or nail a pull-up jumper. Bring that level of precision to your game with the PG 5 (Team), an agile low-top profile with flexible Nike Air Dot Weld Strobel cushioning. The Air unit stretches from heel to toe and is right under your foot for a bouncy sensation that feels like you're moving on clouds.",Game Royal/White/Game Royal; University Red/White/University Red; College Navy/White/College Navy; Black/White,75.0,4.9
327,,Nike Air Max 97,Men's Shoes,6 Colors,$185,$157.97,https://www.nike.com/t/air-max-97-mens-shoes-6mZC1L/DQ8237-800,"The wavy, streamlined 97's, originally inspired by bullet trains, are back with fresh pops of color and a Nike Athletic Club insole for throwback vibes. The full-length Max Air unit puts a bouncy spring in every step.",Coconut Milk/Barely Volt/White/Neptune Green; Sail/Treeline/Wheat Grass/Sail; White/Laser Blue/Washed Teal/Siren Red; Rush Orange/Vivid Sulfur/Light Curry/White; Iron Grey/Particle Grey/Celery/Phantom; Black/Summit White/Sport Turquoise,6.0,5.0
328,Customize,Nike Air Zoom Pegasus 39 Shield By You,Custom Men's Weatherized Road Running Shoes,6 Colors,$165,,https://www.nike.com/u/custom-nike-pegasus-39-shield-by-you-10001377/8244258084,"Keep your toes toasty and your feet bone dry in the workhorse with wings that does all the dirty work to shield your runs from bad weather. It provides water protection and all-terrain tire-like traction for downpours, first, but with a cozy fleece feel on the inside, thanks to an unbeatable duo of Heathered lining and structured insulation inspired by our Aeroloft technology. Once you lock in your personal design, you can look forward to the shivery morning outings that bite and bark and tame those gloomy evening jaunts.",,,
329,Best Seller,Nike Court Borough Mid 2,Little Kids' Shoes,7 Colors,$60,,https://www.nike.com/t/court-borough-mid-2-little-kids-shoes-c6LRCk/CD7783-003,Your little one will feel like an all-star off the court with the Nike Court Borough Mid 2. The classic mid-top design features durable leather for a premium look and feel. A hook-and-loop strap makes it easy to take the shoe on and off.,Black/Game Royal/White/Game Royal; Black/Black/Black; Black/White/University Red; Black/White/Sunset Pulse; White/Pink Foam/Dark Beetroot; Wheat/Black/Gum Light Brown/Wheat; White/White/White; Pure Platinum/White/Mint Foam/Vivid Purple; Medium Ash/Light Silver/Siren Red/White,84.0,4.7
330,Sustainable Materials,Nike Air Max Dawn,Baby/Toddler Shoes,9 Colors,$70,$48.97,https://www.nike.com/t/air-max-dawn-baby-toddler-shoes-KZqx4T/DC9319-005,"In the Air Max world, it’s a new day with the Nike Air Max Dawn. We bring classic vibes with soft suede details and build a look for the future with at least 20% recycled materials by weight. Simple, versatile and cushioned with Air—kiddos can’t go wrong starting their day off with these kicks.",White/Light Madder Root; White/Photo Blue/Black/Red; Flat Pewter/Medium Ash/Black/Siren Red; Grey Fog/Flat Pewter/White/Photo Blue; Black/Metallic Silver/Total Orange/Summit White; White/Light Bone/Black; White/Light Bone/Barely Volt/Black; Particle Grey/Armory Navy/Light Bone/Dark Citron; Pure Platinum/Barely Grape/Midnight Navy/Metallic Copper,0.0,0.0
331,,Nike Blazer Low '77 Premium,Men's Shoes,1 Color,$100,$85.97,https://www.nike.com/t/blazer-low-77-premium-mens-shoes-6ZNq6W/DQ7671-001,"Bring the spook factor to the scariest night of the year. With shadowy branding and ghoulish green accents, your wardrobe staple goes all out this Halloween. With its plush collar and durable design you'll never want to take them off—don't say we didn't warn you.",Shown: Phantom/Ghost Green/Scream Green/Phantom,0.0,0.0
332,,Nike Roshe G,Women's Golf Shoes,5 Colors,$80,$62.97,https://www.nike.com/t/roshe-g-womens-golf-shoes-7dFSmR/CD6066-511,"Inspired by a Nike icon, the Nike Roshe G elevates your look with plush, breathable materials. Its integrated traction pattern means you won't lose time transitioning from the course to the concrete.",Pink Oxford/Hyper Pink/Desert Berry/Sail; Violet Frost/White/Particle Grey/Black; Anthracite/Particle Grey/Black; Black/White/Metallic White; Pure Platinum/White/Metallic White,64.0,4.7
333,,"Nike SFB Field 2 8"" GORE-TEX",Tactical Boot,1 Color,$190,,https://www.nike.com/t/sfb-field-2-8-gore-tex-tactical-boot-hk7SJs/AQ1199-001,"Made with waterproof fabric and durable leather, the Nike SFB Field 2 8"" GORE-TEX is a lightweight yet high-performance boot designed to support heavier loads in all theaters. The sole is equipped with an aggressive tread pattern that provides exceptional traction over challenging terrain, while an internal rock shield helps prevent punctures.",Shown: Black/Black,10.0,4.2
334,,Nike SB Chron 2,Skate Shoes,5 Colors,$75,$54.97,https://www.nike.com/t/sb-chron-2-skate-shoes-71Mh0H/DM3493-501,"Flexible and breathable, the Nike SB Chron 2 is a sequel worthy of its predecessor. The revamped design includes a reshaped collar and heel for an improved fit—all while maintaining the comfort and performance you expect from Nike SB.",Dynamic Berry/Dynamic Berry/White/Black; Honeydew/Honeydew/White/White; Enamel Green/Enamel Green/White/Black; Black/Black/Sail/White; Black/Black/Gum Light Brown/White,69.0,4.7
335,,Nike Joyride Dual Run,Big Kids' Running Shoes,1 Color,$110,,https://www.nike.com/t/joyride-dual-run-big-kids-running-shoes-1HDJF8/CN9600-401,"The Nike Joyride Dual Run blazes a new route with cushioning like never before. Tiny colorful beads mash with soft foam to conform to your foot with every move. With running kicks this squishy, comfy and fun, you may never take them off.",Shown: Glacier Ice/Black/Lava Glow/Light Zitron,32.0,4.7
336,Just In,The Nike Premier 3 FG,Firm-Ground Soccer Cleats,5 Colors,$110,,https://www.nike.com/t/premier-3-fg-firm-ground-soccer-cleats-SZHrPF/AT5889-003,The Nike Premier 3 gets back to the basics with a timeless silhouette wrapped in supple kangaroo leather—helping you to move confidently as an unstoppable force on the field.,Smoke Grey/Light Smoke Grey/Sail/Safety Orange; Obsidian/Sail/Rage Green; Vast Grey/Sail/Midnight Navy; University Red/University Red/Black; Black/White,18.0,4.6
337,,Nike Fontanka Waffle,Women's Shoes,6 Colors,$105,,https://www.nike.com/t/fontanka-waffle-womens-shoes-BxR6dQ/DC3579-006,"Let a new wave of style take hold in the Nike Fontanka Waffle. Crossing fashion with sport, the sleek track design nods to the iconic Daybreak and features classic suede details and a Waffle sole. Embroidered Swooshes, deco-stitching, and the soft collar merge craft with comfort.",Black/Dark Obsidian/Gum Light Brown/White; Sanddrift/White/Khaki/Blackened Blue; Barely Green/University Red/Barely Grey/Barely Green; Burnt Sunrise/Black/Gum Medium Brown/Pink Prime; Pure Platinum/Light Iron Ore/White/Light Soft Pink; Pink Oxford/Light Soft Pink/Ghost Green/Light Thistle,37.0,4.6
338,,Nike Flex Plus,Big Kids' Road Running Shoes,9 Colors,$65,$55.97,https://www.nike.com/t/flex-plus-big-kids-road-running-shoes-0LhR4b/CW7415-011,"On your marks! The Nike Flex Plus is built for runners of all levels and equipped for all-day play. With a flexible feel, supersoft cushioning and an easy slip-on design (no laces needed!), these are ready to zoom around the track and playground.",Black/Siren Red/Washed Teal; Canyon Purple/Amethyst Ash/Mint Foam/Metallic Red Bronze; Black/White; Black/Pink Foam/Metallic Silver; Black/Cool Grey/White/Metallic Gold; Violet Frost/Mint Foam/White/Metallic Copper; Game Royal/Black/White; Game Royal/Midnight Navy/White/Yellow Ochre; Light Smoke Grey/White/Black,51.0,4.8
339,,Nike Alpha Huarache Elite 4 Turf,Men's Baseball Shoes,6 Colors,$80,,https://www.nike.com/t/alpha-huarache-elite-4-turf-mens-baseball-shoes-kwxKzC/FD2743-161,"Let the baseball world know what kind of bat-wielding beast you are. The midsole has Nike Renew foam cushioning, perfect for sprinting around the bags or robbing your opponent of extra bases in the field. The plush, breathable upper helps keep you making plays for 9 innings and more. Plus, the grippy rubber peg traction is tailor-made for all-out effort plays.",Summit White/White/Bright Crimson; Hyper Royal/Deep Royal Blue/University Blue/White; White/Wolf Grey/Pure Platinum/Black; Wolf Grey/Cool Grey/Dark Grey/White; Black/Dark Smoke Grey/Light Smoke Grey/White; University Red/Team Red/Habanero Red/White,0.0,0.0
340,,NikeCourt Zoom Lite 3,Women's Tennis Shoes,7 Colors,$70,,https://www.nike.com/t/nikecourt-zoom-lite-3-womens-tennis-shoes-8gL3CB/DH1042-102,"At first glance, the NikeCourt Zoom Lite 3 looks like a classic tennis shoe. Look closer and you'll find that it's anything but. With a springy Zoom Air unit, grippy outsole and an incredibly comfortable, padded collar, it delivers the performance you need to play at your best.",White/Doll/Amethyst Wave; White/Phantom/Bright Crimson/Metallic Pewter; White/Mint Foam; White/Metallic Silver; Black/White/Metallic Red Bronze; Sail/Peach Cream/Sanddrift; White/Barely Green/Medium Blue/Black,21.0,4.4
341,Sustainable Materials,Nike Star Runner 3,Little Kids' Shoes,1 Color,$50,$47.97,https://www.nike.com/t/star-runner-3-little-kids-shoes-hMdc27/DA2777-004,"The Nike Star Runner 3 shoots for the sky with play-ready kicks made for every run and jump. We've added a strap for easy takeoff, plus supersoft foam and lots of flexibility rocket up the comfort. Designed with the Earth in mind, they're made with at least 20% recycled content.",Shown: Dark Smoke Grey/Black/Black,106.0,4.7
342,,Nike Air Zoom Vomero 16,Women's Road Running Shoes,6 Colors,$150,,https://www.nike.com/t/air-zoom-vomero-16-womens-road-running-shoes-ZqXmjz/DA7698-103,"The Vomero 16 adds responsive ZoomX foam cushioning, bringing an energetic pop to your stride that’s perfect for high mileage on the road. It’s super lightweight, with plenty of stretch and ventilation through the upper. Looking for the right amount of support? We’ve got you covered with an adjustable midfoot band and a stable clip at the heel.",Summit White/White/Rush Orange/Doll; Black/Canyon Rust/White/Mint Foam; Black/Off Noir/Neptune Green/Light Thistle; Summit White/Light Iron Ore/Off Noir/University Red; Atmosphere/Light Madder Root/Light Bone/Sail; Black/Anthracite/White,0.0,0.0
343,,Nike Zoom Victory Waffle 5,Track & Field Distance Spikes,2 Colors,$110,$87.97,https://www.nike.com/t/zoom-victory-waffle-5-track-field-distance-spikes-X6j0jx/AJ0846-801,"Built to navigate tough courses, the Nike Zoom Victory Waffle 5 uses a 3-layer upper to help you brave the elements. Its sock-like fit in a lightweight design makes it the ideal cross-country runner.",Total Orange/Bright Crimson/Black/Volt; Volt/Mint Foam/Coconut Milk/Cave Purple; Black/Black/Metallic Silver,7.0,4.6
344,,Nike Fly.By Mid 3,Basketball Shoes,8 Colors,$65,,https://www.nike.com/t/flyby-mid-3-basketball-shoes-sNRbLR/DD9311-102,"Cushioning, ankle support and traction are essential on the basketball court. The Nike Fly.By Mid 3 delivers exactly what's needed to help players excel on offense and defense. Designed to look as comfortable as it feels, the mid-top sneaker has plush, energy-returning foam to help keep you fresh through 4 quarters.",Light Orewood Brown/Orange Trance/Summit White/Hyper Pink; White/Green Glow/Game Royal; Black/Anthracite/Cool Grey; Black/White; White/Wolf Grey; Black/Anthracite/White/Metallic Gold Star; Black/Gym Red/White; Pearl White/Doll/University Red/Black,42.0,4.4
345,,Nike Omni Multi-Court,Big Kids' Indoor Court Shoes,7 Colors,$60,,https://www.nike.com/t/omni-multi-court-big-kids-indoor-court-shoes-xbrQcw/DM9027-002,"What’s Omni, you ask? It means universal, inclusive and all—like for all your indoor sport needs. Durable and lightweight, they help make moving fast feel easy. Choose their favorite indoor court activity—volleyball, basketball, tennis, handball, or gym class—and lace up!",Pure Platinum/Midnight Navy/Metallic Silver; Black/Bright Spruce/White/Barely Volt; Black/Anthracite; Midnight Navy/Game Royal/White/Safety Orange; White/Pure Platinum/White; Pink Foam/Hyper Pink/Medium Soft Pink/White; Black/White,1.0,4.0
346,Just In,Nike Force Zoom Trout 8 Pro,Men's Baseball Cleats,5 Colors,$85,,https://www.nike.com/t/force-zoom-trout-8-pro-mens-baseball-cleats-JFDR85/CZ5915-100,"When it’s game time, lace up in a design that helps optimize each tool you have in the toolbox, just like Mike Trout. A Zoom Air unit in the forefoot gives you an unreal amount of velocity to your game. The cushioning and comfort of the underfoot plate helps eliminate stud pressure and puts the spotlight on your skills, whether you’re a thief between the bags, a web-gem regular or a rebel who takes the extra base every time.",White/Wolf Grey/Pure Platinum/Black; University Red/Team Red/Habanero Red/White; Hyper Royal/Deep Royal Blue/University Blue/White; Summit White/White/Black/Bright Crimson; Black/Dark Smoke Grey/Light Smoke Grey/White,0.0,0.0
347,,Nike ZoomX SuperRep Surge,Women's Endurance Class Shoes,2 Colors,$140,,https://www.nike.com/t/zoomx-superrep-surge-womens-endurance-class-shoes-88S52W/CK9406-069,"The Nike ZoomX SuperRep Surge is built for classes and workouts that keep you moving. From the treadmill to the rowing machine to strength training, you get the amazing energy return of ultralight Nike ZoomX foam.",Black/Black/Light Soft Pink/Metallic Mahogany; Black/Black/White,70.0,4.8
348,,Nike Metcon 7,Training Shoes,5 Colors,$130,,https://www.nike.com/t/metcon-7-training-shoes-0l6Psg/CZ8281-234,"The Nike Metcon 7 is the gold standard for weight training—even tougher and more stable than previous versions. We've also added React foam that ups the comfort to keep you ready for high-intensity cardio. Plus, a tab locks down your laces so you can forget about them coming untied when you're focused on your next PR.",Pollen/Volt/Pale Coral/Black; Rattan/Sandalwood/Sail/Thunder Blue; White/Particle Grey/Pure Platinum/Black; Black/Particle Grey/White/Pure Platinum; Black/Volt/Iron Grey/White; Light Silver/Desert Ochre/Dusty Sage/Black,126.0,4.4
349,Customize,Nike Air Max 97 Unlocked By You,Custom Men's Shoe,6 Colors,$215,,https://www.nike.com/u/custom-nike-air-max-97-unlocked-by-you-10001289/7156556932,The Nike Air Max 97 Unlocked By You follows in the footsteps of its predecessors with a commitment to total creator control: you get to choose the execution for every feature and facet. Mixed natural materials contrast with a digitized font on the webbing at the heel—a subtle reminder that we have to go back to go forward.,,,
350,,Nike Air Max 90 Toggle,Baby/Toddler Shoes,4 Colors,$75,,https://www.nike.com/t/air-max-90-toggle-baby-toddler-shoes-LVcWx4/CV0065-124,"The Nike Air Max 90 Toggle sees the future join forces with an icon. We add the quick-and-easy toggle system that makes taking them on and off a breeze. With the same OG details and features, we turn up a classic for tomorrow.",Pure Platinum/Violet Frost/Thunder Blue/Metallic Silver; Black/White/Black/Black; White/Bright Spruce/Phantom/Barely Volt; White/University Gold/University Red/Photo Blue,10.0,4.5
351,,Nike Zoom Mercurial Superfly 9 Pro FG,Firm-Ground Soccer Cleats,2 Colors,$150,,https://www.nike.com/t/zoom-mercurial-superfly-9-pro-fg-firm-ground-soccer-cleats-lpGlgb/DJ5598-001,"Instantly tilt the field in the bold design of the Superfly 9 Pro FG. It's loaded with a Zoom Air unit, so you can dominate in the waning minutes of a match—when it matters most. Fast is in the Air.",Metallic Copper/Metallic Copper; Black/Summit White/Volt/Dark Smoke Grey,14.0,4.6
352,,Luka 1,Baby/Toddler Shoes,2 Colors,$50,,https://www.nike.com/t/luka-1-baby-toddler-shoes-PWNtb1/DR6085-104,"Even if baby can't sink a step-back jumper just yet, they can still have fun in comfort and style. Lightweight materials and plush foam keeps little feet happy as they learn to make their first moves.",White/Volt/Black; White/Neo Turquoise/Bright Crimson/Metallic Silver,1.0,5.0
353,,Nike Victori One,Women's Slides,6 Colors,$35,$33.97,https://www.nike.com/t/victori-one-womens-slides-dLThzx/CN9677-004,"From the beach to gardening to sitting on the couch, the Nike Victori One perfects a classic design. Delivering lightweight comfort that’s easy to wear, it features new softer, more responsive foam. The contoured grip pattern helps cradle and hold your foot in place.",Black/Pink Foam/White; White/Black/Black; Black/Black/Black; Black/Black/Metallic Red Bronze; Barely Rose/Barely Rose/Metallic Silver; Black/Black/Light Arctic Pink,243.0,4.7
354,,Nike Air Max Motion 2,Women's Shoes,1 Color,$85,,https://www.nike.com/t/air-max-motion-2-womens-shoes-C4l0jM/CW5602-300,"Taking inspiration from the Air Max 270, the Nike Air Max Motion 2 blends breathable mesh with no-sew overlays for heritage style. A large, U-shaped Max Air unit provides comfort that lasts all day while a heel clip delivers visual impact and extra cushioning.",Shown: Aurora Green/Volt/White/Laser Crimson,0.0,0.0
355,Launching in SNKRS,Air Jordan 5 x DJ Khaled,Men's Shoes,1 Color,$225,,https://www.nike.com/launch/r/DV4982-641,,,,
356,Just In,Nike Jr. Phantom GT2 Academy MG,Little/Big Kids' Multi-Ground Soccer Cleats,2 Colors,$60,,https://www.nike.com/t/jr-phantom-gt2-academy-mg-little-big-kids-multi-ground-soccer-cleats-tRJrn5/DR6056-810,"Celebrate the game’s biggest competition in a design ignited by the science of connectivity and gravity that the world stage inspires. Featuring a stunning futuristic look made for the globe's greatest players, these cleats have an updated design and patterning to help you place your shots with pinpoint accuracy. Off-center lacing provides a clean strike zone to help you dribble, pass and score with precision.",Metallic Copper/Metallic Copper; White/Volt/Bright Crimson,0.0,0.0
