,label,title,subtitle,num_colors,price,reduced_price,url,description,colors,n_reviews,avg_stars
943,,Nike Air Zoom Pegasus 37,Men's Road Running Shoes,4 Colors,$120,$79.97,https://www.nike.com/t/air-zoom-pegasus-37-mens-road-running-shoes-KLvDcj/BQ9646-002,"Take your training runs to the next level with the Nike Air Zoom Pegasus 37. With unbelievable React cushioning and a new forefoot Air unit, they’re like a bolt of caffeine for your legs. The lightweight upper breathes incredibly well. Pared-down, perfectly placed padding helps reduce hotspots. And the super grippy outsole? Well, let’s just say you gotta stay upright to run. Here’s to letting mud fly and streets vanish behind you.",White/Cyber/Black/Racer Blue; Iron Grey/Particle Grey/Photon Dust/Light Smoke Grey; Black/White; Black/Anthracite/White/Bright Mango,476.0,4.4
944,,Nike Court Borough Mid 2,Baby/Toddler Shoes,6 Colors,$55,,https://www.nike.com/t/court-borough-mid-2-baby-toddler-shoes-K2VTMK/DM8874-001,Your little athlete will look like an all-star off the court in the Nike Court Borough Mid 2. The classic mid-top design is made with durable leather and classic color-blocking. A hook-and-loop strap helps give your little one a secure fit and makes it easy to take the shoe on and off.,Black/White/University Red; Black/White/Sunset Pulse; Black/Game Royal/White/Game Royal; White/Black/University Red; Black/Black/Black; Black/Black/Black,9.0,4.8
945,,Jordan Series,Big Kids' Shoes,5 Colors,$75,,https://www.nike.com/t/jordan-series-big-kids-shoes-H99FWV/DN3205-621,"Inspired by Mike's backyard battles with his older brother Larry, the Jordan Series references their legendary sibling rivalry throughout the design. The rubber sole offers more than just impressive traction—it also tells the story of how MJ came to be #23. Look for the hidden reminder to ""Swing for the Fence,"" a direct quote from Larry to his little bro.",Cherrywood Red/White/Sail/Fossil Stone; Anthracite/White/Sail/University Red; Stealth/White/Black/University Red; Phantom/Black/Praline/University Red; Black/White/Summit White/University Red; Sail/White/University Red/Black,1.0,5.0
946,,Jordan 1 Mid,Little Kids' Shoes,1 Color,$70,,https://www.nike.com/t/jordan-1-mid-little-kids-shoes-MH3G8V/640734-201,"Inspired by the original Air Jordan, the Jordan 1 Mid Shoe gives little kids a piece of sneaker history with a fit and feel that's tuned for comfort and built to keep up with their fast-paced play.",Shown: White Onyx/White/Cardinal Red/Light Curry,602.0,4.9
947,,Nike React SFB Carbon Low,Men’s Elite Outdoor Shoes,4 Colors,$145,$119.97,https://www.nike.com/t/react-sfb-carbon-low-mens-elite-outdoor-shoes-3xfJmb/CZ7399-300,"Built for special operators and elite outdoor athletes, the Nike React SFB Carbon Low packs the durability, support and traction of a tactical boot into a rugged shoe. The full-length carbon plate helps optimize your stride, while responsive Nike React cushioning provides comfort for the long haul. Aggressive tread gives you excellent traction wherever your mission or adventure takes you.",Light Army/Light Bone/Cargo Khaki/Black; Cargo Khaki/Medium Olive/Black/Sequoia; Coyote; Black/Anthracite/White/Black,16.0,4.3
948,,Nike Alpha Huarache Elite 3 Low Premium,Baseball Cleats,2 Colors,$90,$76.97,https://www.nike.com/t/alpha-huarache-elite-3-low-premium-baseball-cleats-vX0MnF/CV3553-001,"Dominate any position on the field in the Nike Alpha Huarache Elite 3 Low Premium, with its sneaker-like feel and versatile performance. Soft and responsive Nike React foam gives you a smooth ride and helps minimize stud pressure underfoot. A lightweight and breathable upper helps lock your foot in with the support you need without adding extra bulk.",Black/Metallic Vivid Gold/White; White/Metallic Vivid Gold/Black,2.0,5.0
949,,LeBron 19 Low,Basketball Shoes,7 Colors,$160,$107.97,https://www.nike.com/t/lebron-19-low-basketball-shoes-jDSdw6/DO9829-600,"LeBron plays less in the paint and more at the point, so it makes sense that he wants to feel a little quicker. His 19th signature shoe gives you the feeling of containment but with a lower, lighter design that's ideal for fast, strong players like LeBron who stretch the court.",Lilac/Dark Smoke Grey/Pearl White/Pink Gaze; Light Crimson/Black/White; Black/Purple Pulse/Pink Foam/Ghost Green; Blue Chill/Light Crimson/Safety Orange/Black; White/Medium Blue/Siren Red/Black; Black/Smoke Grey/University Gold; Doll/Iris Whisper/Citron Tint/Light Bordeaux,8.0,5.0
950,,Nike React Infinity Run Flyknit 3,Men's Road Running Shoes,5 Colors,$160,,https://www.nike.com/t/react-infinity-run-flyknit-3-mens-road-running-shoes-1bRq75/DZ4845-001,"Engineered to help you pursue your running goals in comfort, the Nike React Infinity Run Flyknit 3 remains one of our most tested shoes. Its breathable upper helps your foot feel contained but flexible. Cushioning around the heel and ankle provide a supportive and comfortable sensation mile after mile. Plus, the unique rocker-shaped sole helps allow for a smooth and stable ride on both long and short routes. So keep running, we’ve got you.",White/Racer Blue/Bright Crimson/Black; Phantom/Ale Brown/Total Orange/Gorge Green; Dark Obsidian/Sail/Sanddrift/Light Curry; Sail/Sail/Hot Curry/Rift Blue; Pure Platinum/Psychic Purple/Iris Whisper/Black; Black/Hyper Royal/Thunder Blue/Citron Pulse,0.0,0.0
951,,Jordan 1 Mid SE,Little Kids' Shoes,1 Color,$80,,https://www.nike.com/t/jordan-1-mid-se-little-kids-shoes-Vsj4lt/DM9648-100,"This mini version of the Jordan 1 combines an iconic design with colors and patterns inspired by summertime fun. It's soft and flexible underfoot, easy to get on, and comfortable to wear all day.",Shown: White/Rush Pink/Rush Orange/Washed Teal,9.0,4.9
952,,Nike Zoom Victory 5 XC,Track & Field Distance Spikes,4 Colors,$110,,https://www.nike.com/t/zoom-victory-5-xc-track-field-distance-spikes-BbCbrq/AJ0847-002,"Built to tackle tough courses, the Nike Zoom Victory 5 XC features a translucent woven upper that’s incredibly lightweight and breathable. An updated outsole adds rubber heel pods and extra lugs for multi-surface durability and aggressive traction.",Total Orange/Bright Crimson/Black/Volt; Volt/Mint Foam/Coconut Milk/Cave Purple; White/Bright Crimson/Black; Black/Black/Metallic Silver,0.0,0.0
953,Member Access,Nike Blazer Mid Pro Club,Men's Shoes,3 Colors,$115,,https://www.nike.com/t/blazer-mid-pro-club-mens-shoes-Vgslvc/DQ7673-100,"Being rooted doesn't mean you can't step forward. Keeping the classic simplicity and comfort you love, your favorite wardrobe staple gets remastered for the modern era. Extra rubber extends from the midsole to the Swoosh for a bold twist (and a little nod to Nike innovation from the '70s). The patchwork upper adds the perfect amount of retro attitude.",White/Light Bone/Summit White/Black; White/Summit White/Sail/Habanero Red; Light Bone/Sesame/Pecan/Sail,0.0,0.0
954,,Converse Chuck Taylor All Star High Top,Infant/Toddler Shoe ,4 Colors,$35,,https://www.nike.com/t/converse-chuck-taylor-all-star-high-top-2c-10c-infant-toddler-shoe-N123eN/7J232-600,"Scaled back in size for the next generation of original thinkers, rockers and artists, this Converse Chuck Taylor All Star remains true to the iconic original with classic details on a comfortable canvas upper.",Red; Navy; Black; White,93.0,4.8
955,Sustainable Materials,Nike Air Max TW,Men's Shoes,3 Colors,$160,,https://www.nike.com/t/air-max-tw-mens-shoes-DLKBKm/DQ3984-100,"So you're in love with the classic look of the '90s, but you got a thing for today's fast-paced culture. Meet the Air Max TW. Inspired by the treasured franchise that brought Nike Air cushioning to the world and laid the foundation for the track-to-street aesthetic, its eye-catching design delivers a 1-2 punch of comfort and fashion. Ready to highlight any ‘fit, its lightweight upper pairs angular and organic lines to create an entrancing haptic effect. The contrasting colorways make it easy to style. And if you’re ready for the next step, the 5 windows underfoot deliver a modern edge to visible Air cushioning.",Light Bone/Olive Grey/Summit White/Red Clay; Black/Black/White/White; White/Racer Blue/Black/Speed Yellow,4.0,3.5
956,,Nike Air Winflo 9 Shield,Men's Weatherized Road Running Shoes,2 Colors,$110,$93.97,https://www.nike.com/t/air-wio-9-shield-mens-weatherized-road-running-shoes-bzxswh/DM1106-007,"Nasty weather doesn’t need to put an end to your run. Revel in the elements with these shoes designed to help you push through every puddle, pit stop, pothole and personal record. A water-repellent finish helps keep you dry while tire-like traction and a full-length Air unit provide grip and soft cushioning to help keep you running when conditions get slick.",Black/Off Noir/Dark Smoke Grey/Black; Medium Ash/Khaki/Black/Laser Blue,0.0,0.0
957,,Nike Air Tuned Max,Men's Shoes,2 Colors,$190,$93.97,https://www.nike.com/t/air-tuned-max-mens-shoes-3d1sKw/DH4793-700,"Just like the original design, the Nike Air Tuned Max brings you cutting-edge innovation and fine-tuned comfort. Born from Nike's clandestine and bygone Alpha Project, the sleek, track-inspired design nods to the fast-paced division that brought you the Presto and so much more. Shimmering finishes and visible Air cushioning underfoot make a seismic statement in fashion and luxury.",Midnight Navy/Grey Fog/Metallic Silver/Black; Volt/Black/Dark Smoke Grey/Total Orange,2.0,1.5
958,Just In,Air Jordan 1 Mid,Women's Shoes,1 Color,$120,,https://www.nike.com/t/air-jordan-1-mid-womens-shoes-JpPnt1/BQ6472-007,"The Air Jordan 1 Mid brings full-court style and premium comfort to an iconic look. Its Air-Sole unit cushions play on the hardwood, while the padded collar gives you a supportive feel.",Shown: Black/White/Particle Grey,422.0,4.9
959,,Nike Offline 2.0 PRM,Men's Mules,1 Color,$140,,https://www.nike.com/t/offline-2-prm-mens-mules-66x6WL/DN5079-300,"Ready to take your game off court and onto the card table, Giannis style? Slip on these comfy mules that are inspired by the Greek Freak’s favorite game-night activity: UNO. Bright primary colors and the game’s logo on the heel make these almost as fun as UNO itself.",Shown: Light Green Spark/University Red/Game Royal/Black,0.0,0.0
960,,Nike Zoom Hyperdiamond 3 Elite CS,Women's Softball Cleat,1 Color,$90,$40.97,https://www.nike.com/t/zoom-hyperdiamond-3-elite-cs-womens-softball-cleat-2vFmjg/CI2229-102,"Tailored for comfort, the Nike Zoom Hyperdiamond 3 Elite CS delivers lightweight responsiveness. Molded details add durability and support that stand up to intense play while Nike Air cushioning helps you be quick off the plate and toward the plate.",Shown: White/Hyper Violet/Hyper Jade/Flash Crimson,17.0,4.5
961,,Nike Blazer Low '77 Premium Vintage,Men's Shoes,1 Color,$90,$76.97,https://www.nike.com/t/blazer-low-77-premium-vintage-mens-shoes-rm9J5w/DX4433-200,"Styled for the '70s. Loved in the '80s. Classic in the '90s. Ready for the future. The Blazer delivers a timeless design that’s easy to wear. Its rich, pecan-colored leather smartens up your outfit and breaks in beautifully. And leaving no detail overlooked, we've added an exposed foam tongue and special midsole finish to make it look like you’ve just pulled them from the history books.",Shown: Pecan/Off Noir/Alpha Orange/Sail,3.0,3.0
962,Coming Soon,Nike Dunk High Retro,Men's Shoe,1 Color,$125,,https://www.nike.com/t/dunk-high-retro-mens-shoe-bCKqNT/DD1399-401,"Created for the hardwood but taken to the streets, the '80s b-ball icon returns with perfectly sheened overlays and original university colors. With its classic hoops design, the Nike Dunk High Retro channels '80s vintage back onto the streets while its padded, high-top collar adds an old-school look rooted in comfort.",Shown: Blue Chill/White/Amarillo/Blue Chill,,
963,Customize,Converse Custom Chuck Taylor All Star High Top,Unisex Shoe,1 Color,$85,,https://www.nike.com/u/custom-converse-chuck-taylor-all-star-high-top-10001123/7623600336,"The iconic Chuck Taylor All Star has been empowering fans to express their individuality for generations. Now you can make them truly your own with a range of customization options, from exclusive colors, a personal iD, midsole prints and embroidered letters on each foot.",Shown: Multi-Color/Multi-Color,,
964,Sustainable Materials,Nike Revolution 6 FlyEase Next Nature,Men's Easy On/Off Road Running Shoes (Extra Wide),3 Colors,$70,$39.97,https://www.nike.com/t/revolution-6-flyease-next-nature-mens-easy-on-off-road-running-shoes-extra-wide-SNbtsR/DD8476-001,"Made with at least 20% recycled material by weight, old materials find new beginnings. Now you can find yours. Set the pace at the start of your running journey with the plush feel of the Nike Revolution 6 Next Nature. We know comfort is key to a successful run, so we made sure your steps are cushioned and flexible for a soft ride. A strap at the top of the foot makes the shoe super easy to take on and off. It's an evolution of a favorite.",Pure Platinum/Dark Marina Blue/Worn Blue/Thunder Blue; Black/Dark Smoke Grey/Black,22.0,2.8
965,Best Seller,Air Jordan 1 Mid SE,Men's Shoes,1 Color,$135,,https://www.nike.com/t/air-jordan-1-mid-se-mens-shoes-4TbtGz/DZ5329-001,"Slap some holiday cheer on your feet with these AJ1 mids. Made with high quality leather, they'll break in beautifully and stick around for many seasons to come. To top 'em off, plaid accents give you an understated festive look so no one can accuse you of being a grinch.",Shown: Black/Sesame/Fire Red/Multi-Color,2.0,5.0
966,,Nike Court Legacy,Big Kids' Shoes,5 Colors,$55,$46.97,https://www.nike.com/t/court-legacy-big-kids-shoes-RppBqt/DA5380-117,"The Nike Court Legacy serves up style rooted in tennis culture. They are durable and comfy with heritage stitching and a retro Swoosh. When you pull these on—it’s game, set, match.",White/White; Black/Gum Light Brown/White; White/Desert Ochre/Gum Light Brown/Black; White/Mint Foam/Vivid Purple/Midnight Navy; White/Sesame/Honeydew/Pink Foam,90.0,4.8
967,,Nike Victori One,Men's Slides,5 Colors,$35,$29.97,https://www.nike.com/t/victori-one-mens-slides-l6rXGD/DR2018-400,"From the beach to the bleachers, the Nike Victori One is a must-have slide for sunny days. Lightweight and easy to wear (or pack for your vacay), it's soft, responsive foam makes lounging easy.",Team Red/Team Red/White; Anthracite/Anthracite/Black; Deep Royal Blue/Deep Royal Blue/White; Black/Black/Team Orange; Black/Black/White,4.0,4.8
968,,Jordan LS,Men's Slides,1 Color,$85,$50.97,https://www.nike.com/t/jordan-ls-mens-slides-MpNnhv/DO6379-061,"Courtside or beachside, these slides pair step-in comfort with functional design. The adjustable heel strap adds support when you need it and the classic foam footbed is molded for your comfort.",Shown: Black/White/University Red,0.0,0.0
969,,"Nike SFB 6"" Leather",Men's Boot,2 Colors,$155,,https://www.nike.com/t/sfb-6-leather-mens-boot-l3Ngv1/862507-201,"The Nike SFB 6"" Leather Men's Boot brings the Special Field Boot to Nike Sportswear for the first time as a SneakerBoot, complete with weather-resistant leather and a rugged traction pattern.",Dark Mushroom/Light Taupe/Dark Mushroom; Black/Light Taupe/Black,8.0,4.4
970,,Nike ZoomX Zegama,Women's Trail Running Shoes,3 Colors,$160,,https://www.nike.com/t/zoomx-zegama-womens-trail-running-shoes-FWN4lV/DH0625-001,"Navigate the up and downs of uncompromising terrain with the Nike ZoomX Zegama. Developed with great grip and stability, it has you covered so you can keep climbing and reach greater personal heights when the going gets grimy and gritty. Whether it's a challenging, rocky landscape going uphill or a steep, slick decline down a treacherous trail, feel confident when you decide to off-road it.",Black/White; Mantra Orange/Bright Crimson/Bicoastal/White; Mineral Slate/Black/Green Glow/Light Bone,1.0,4.0
971,Just In,Nike Air Max 90 Futura,Women's Shoes,7 Colors,$150,,https://www.nike.com/t/air-max-90-futura-womens-shoes-kvRZ4h/DM9922-200,"The Nike Air Max 90 Futura reimagines the icon of Air through your eyes—from design to testing to styling. Sawtooth edging around the toe and a partially floating Swoosh deliver skillfully crafted luxury. Plush padding around the ankle mixes with trusted Air cushioning to bring you first-class comfort. It's playful, comfortable, sporty and whatever else you want it to be.",Wolf Grey/Summit White/Light Orewood Brown/Medium Ash; White/White/White/White; Summit White/Light Bone/Phantom/Summit White; Medium Olive/Canyon Rust/Midnight Navy/Phantom; Summit White/Pure Platinum/Football Grey/Wolf Grey; Black/Iron Grey/Oil Grey/Black; Phantom/Hemp/Sanddrift/Black,42.0,4.6
972,Customize,Nike Air Huarache By You,Custom Men's Shoes,6 Colors,$150,,https://www.nike.com/u/custom-huarache-run-by-you-10001375/8552613439,"Have you hugged your foot today? Don't stop there. Bring your feel-good vibes to the world with a customizable twist on the ridiculously comfortable icon. Choose soft, supple suede for a throwback vibe, or give it a timeless finish with crisp leather. Select from an array of varsity-inspired colors for a classic look. Then, top it off with a piece of your story on the tongue patch. Whatever you choose, it's gonna feel good and look great. Your personalized Air Huarache—it's bragging rights for your feet. We recommend sizing up one half-size from your usual size for the best fit.",,,
973,,Nike Court Borough Low 2,Little Kids' Shoes,6 Colors,$50,,https://www.nike.com/t/court-borough-low-2-little-kids-shoes-8j4qrd/BQ5451-007,"Comfort and style come together in the Nike Court Borough Low 2. The structured, supportive fit has a retro basketball design so kids can look like an all-star on and off the court.",White/Pink Foam; White/Light Armory Blue/Pure Platinum/Arctic Punch; Midnight Navy/Black/Dark Purple Dust/White; White/Black; Sail/Hot Curry/Game Royal/University Red; Black/White; White/White/White; Black/Black/Black; Black/White/University Red; White/Dark Beetroot,202.0,4.9
974,Just In,Jordan Stay Loyal 2,Men's Shoes,1 Color,$115,,https://www.nike.com/t/jordan-stay-loyal-2-mens-shoes-dLTPQ2/DQ8401-016,"Inspired by generations of J's, these kicks are a collage of cool. Design details recall decades of legendary shoes while paying homage to MJ's storied career. Breathable mesh, sturdy leather and lightweight Air cushioning in the heel make it that much easier to walk in the footsteps of greatness.",Shown: Black/University Red/White,0.0,0.0
975,,Nike Force 1,Little Kids' Shoes,4 Colors,$62,,https://www.nike.com/t/force-1-little-kids-shoes-xrmQ0W/CZ1685-103,"Lace up little feet in the Nike Force 1 for the classic look and feel of the legendary AF1. Soft cushioning helps keep their steps feeling smooth, and leather is easy to clean.",White/Elemental Pink/Medium Soft Pink/Pink Foam; White/Black; Pure Platinum/Barely Grape/Midnight Navy/Metallic Silver; White/Pink Foam; White/Aura,33.0,4.7
976,,Nike Force Savage Elite 2,Men's Football Cleats,2 Colors,$140,,https://www.nike.com/t/force-savage-elite-2-mens-football-cleats-wqgvNJ/AH3999-100,Dig in with the Nike Force Savage Elite 2. Its durable exterior is detailed with molding at the toe. A Nike Fastflex outsole sets you up with an articulate design so you can freely move in every direction.,White/Wolf Grey/White/Black; Black/Anthracite/White/White,40.0,3.9
977,Available in SNKRS,Nike Air Max 1,Women's Shoes,1 Color,$160,,https://www.nike.com/launch/r/DX2954-001,,,,
979,,Nike Renew Serenity Run Premium,Women's Road Running Shoes,2 Colors,$80,$75.97,https://www.nike.com/t/renew-serenity-run-premium-womens-road-running-shoes-FsLNf4/DC9010-601,"Take your mental health on the road with a neutral running shoe made for the moments when your steps speed up to let your mind slow down. Plush, lightweight cushioning and a fit that's optimized for comfort help you stayed focused on the joy in every mile.",Phantom/Photon Dust/Metallic Luster/Amethyst Ash; Barely Rose/Pink Oxford/Metallic Pewter/Hydrogen Blue; Black/Dark Smoke Grey/White; Black/Hyper Pink/Dark Smoke Grey/Black; Pure Platinum/Wolf Grey/Metallic Silver/White,32.0,4.5
980,,Nike Asuna 2,Men's Slides,4 Colors,$50,$47.97,https://www.nike.com/t/asuna-2-mens-slides-8ZN47w/DJ3388-201,"Want to transition effortlessly between worlds? Built to feel good all day, this plush slide uses a rugged tread pattern for traction on a variety of surfaces. Step in, cinch it closed, and get going.",Velvet Brown/Medium Ash/Black; White/University Gold/Volt/University Blue; Midnight Navy/Grey Fog/Dark Grey/Mystic Navy; Black/Dark Grey/White/Black,39.0,4.5
981,,"Nike Air Deldon ""Together We Fly""",Basketball Shoes,3 Colors,$120,,https://www.nike.com/t/air-deldon-together-we-fly-basketball-shoes-mWJmPk/DM4094-100,"Elena Delle Donne's basketball shoe invites everyone to step in and take a shot at the game. Made for everyone, it has a collapsible heel and a large strap, so you can get in and lock in with 1 hand. Full-length Air cushioning and a forefoot Zoom Air unit give you an optimal blend of bounce and energy return to help you feel fresh all game long.",Summit White/Pale Ivory/Light Smoke Grey; Summit White/Summit White/Pure Platinum; Barely Green/Pale Ivory/Barely Green,0.0,0.0
982,,Nike Offcourt SE,Women's Slides,1 Color,$45,$31.97,https://www.nike.com/t/offcourt-se-womens-slides-Cqpfhg/DH4226-600,"Slip into comfort with the Nike OffCourt Slide SE. It's got a soft, padded strap that uses plush velour material for a little bit of luxury. The lightweight foam midsole adds cushioning.",Shown: Pearl White/Pearl White,26.0,4.7
983,Just In,Air Jordan 9 Retro NRG,Men's Boot,1 Color,$225,,https://www.nike.com/t/air-jordan-9-retro-nrg-mens-boot-v1Kvd7/AR4491-200,"Inspired by design elements from the Special Field Boot, the Air Jordan 9 NRG Men's Boot features a water-resistant coating and heavy tread, plus a durable leather and suede construction. Zoom Air units in the heel and forefoot provide plush, lightweight cushioning.",Shown: Military Brown/University Red/Black/Legion Green,97.0,4.8
984,,Nike Air VaporMax 2021 Flyknit Next Nature,Big Kids' Shoes,9 Colors,$190,,https://www.nike.com/t/air-vapormax-2021-flyknit-next-nature-big-kids-shoes-dWftsH/DZ5314-400,Put an extra bounce in your step. A super-stretchy Flyknit upper in bold blue feels like wearing a sock while heel-to-toe VaporMax Air cushioning gives you lightweight comfort that's perfect for playtime. Flex into the future with us and feel the good vibes.,Midnight Navy/Photo Blue/White/Black; Volt/Photo Blue/Metallic Silver/Black; Black/Photo Blue/Bright Crimson/University Gold; Pure Platinum/Mint Foam/White/Metallic Red Bronze; White/Midnight Navy/Violet Frost/Metallic Silver; Black/Black/Anthracite/Black; Dark Grey/Barely Volt/Phantom/Black; Sail/Honeydew/Pink Gaze/Pink Foam; White/Black/Anthracite/Kumquat; Game Royal/White/Anthracite/Black; White/Black/Metallic Silver/Photo Blue; White/Black/Metallic Silver/White,0.0,0.0
985,,Nike Air Zoom Victory Tour 2,Golf Shoes,1 Color,$180,$129.97,https://www.nike.com/t/air-zoom-victory-tour-2-golf-shoes-QNxK3G/CW8155-008,"Staying true to the sophistication of its predecessor, the Nike Air Zoom Victory Tour 2 brings cutting-edge innovation to a classic silhouette. The updated design pairs supple, sophisticated leather with hidden performance details, like Zoom Air and exceptional traction—so you can play at your best from teebox 1 to the 18th green.",Shown: Black/White/Racer Blue/Pure Platinum,33.0,4.4
986,Available in SNKRS,Nike Air Trainer 1,Men's Shoes,1 Color,$120,,https://www.nike.com/launch/r/DM0521-100,,,,
987,Customize,Nike Air Zoom Pegasus 39 Shield By You,Custom Women's Weatherized Road Running Shoes,6 Colors,$165,,https://www.nike.com/u/custom-nike-pegasus-39-shield-by-you-10001376/1842153818,"Keep your toes toasty and your feet bone dry in the workhorse with wings that does all the dirty work to shield your runs from bad weather. It provides water protection and all-terrain tire-like traction for downpours, first, but with a cozy fleece feel on the inside, thanks to an unbeatable duo of Heathered lining and structured insulation inspired by our Aeroloft technology. Once you lock in your personal design, you can look forward to the shivery morning outings that bite and bark and tame those gloomy evening jaunts.",,,
988,Customize,Nike Internationalist By You,Custom Men's Shoe,1 Color,$110,,https://www.nike.com/u/custom-nike-internationalist-low-by-you-10000614/3149430486,"The Nike Internationalist Low By You celebrates a 1980s icon originally designed for serious runners who knew no bounds. Now fashioned for streetwear, this Internationalist lets you choose the materials from a selection of low-key earth tones. Top it off with throwback Nike branding or personal details so you can stand out in your neighborhood or all over the world.",Shown: Multi-Color/Multi-Color/Multi-Color,,
989,Sustainable Materials,Nike Cosmic Unity 2,Basketball Shoes,5 Colors,$160,$144.97,https://www.nike.com/t/cosmic-unity-2-basketball-shoes-L53XJP/DH1537-003,"Celebrate the love and joy of the game with the Nike Cosmic Unity 2. Made with at least 20% recycled content by weight, it provides enhanced responsiveness and support. This shoe will help keep you fresh and secure without overloading it with extra ounces, so that you can focus on locking down the perimeter defensively or starting the fast break after a rebound.",Off White/Football Grey/Ghost Green/Multi-Color; Siren Red/Metallic Gold/Doll/Black; Black/Football Grey/Off Noir/Multi-Color; Coconut Milk/Atmosphere/Mint Foam/Black; Off Noir/Football Grey/Bright Crimson/Multi-Color,1.0,5.0
990,Launching in SNKRS,Jordan 5 x DJ Khaled,Little Kids' Shoes,1 Color,$95,,https://www.nike.com/launch/r/DV4980-641,,,,
