,label,title,subtitle,num_colors,price,reduced_price,url,description,colors,n_reviews,avg_stars
619,,Nike Huarache Run,Little Kids' Shoes,7 Colors,$73,$69.97,https://www.nike.com/t/huarache-run-little-kids-shoes-52sRmM/704949-608,"The Nike Huarache Run is unmistakable. It’s all about the famous heel strap that kids can grab and slide their foot right into. A snug bootie design helps keep everything secure and supported while little ones run, climb and play.",White/Pure Platinum/White; University Red/University Red/University Red; Black/Black/Black; White/Grey Fog/Off Noir/Pink Foam; White/Purple Punch/Black; Pure Platinum/Violet Frost/Vivid Purple/Metallic Copper; Pink Foam/White/Hyper Pink,572.0,4.8
620,,Nike Air Max AP,Men's Shoes,9 Colors,$105,,https://www.nike.com/t/air-max-ap-mens-shoes-scCr93/DQ3959-002,"Bridge past and present in first-class comfort with the Air Max AP. Flashes of heritage detailing nod to the Air Max 97, while the streamlined upper and soft midsole give it a modern edge. The sporty design with full-length Air (and comfort sockliner) begs to be worn with any outfit.",Black/Anthracite/Team Red/Summit White; Phantom/Photo Blue/Black/White; Black/Black/Volt/Black; Black/Black/Bright Crimson/White; White/Bright Crimson/Black; White/Black/University Red; Black/Wolf Grey/Gorge Green/White; Wolf Grey/Atlantic Blue Heather/Anthracite/Lemon Venom; Obsidian/White/Black,0.0,0.0
621,,Luka 1,Big Kids' Basketball Shoes,2 Colors,$80,,https://www.nike.com/t/luka-1-big-kids-basketball-shoes-3G3mZz/DQ6513-104,"Designed for #77 and made for every athlete craving speed and efficiency, Luka's debut delivers the goods. The first shoe with full-length Formula 23 foam, it has an ultra-supportive fit crafted with the step-back in mind. Meanwhile, strong and lightweight Flight Wire embroidery keeps you feeling contained on the court. This is the assist you've been waiting for—get out there and make your shot.",White/Volt/Black; White/Neo Turquoise/Bright Crimson/Metallic Silver,1.0,5.0
622,Best Seller,Nike Court Borough Mid 2,Big Kids' Shoes,11 Colors,$70,$59.97,https://www.nike.com/t/court-borough-mid-2-big-kids-shoes-3n7hz5/CD7782-104,Look like an all star off the court with the Nike Court Borough Mid 2. The classic mid-top design features durable leather for a premium look and feel. Padding around the tongue and ankle provide extra comfort.,Black/Black/Black; White/White/Black/University Red; Black/Game Royal/White; Pure Platinum/White/Mint Foam/Vivid Purple; Black/White/University Red; White/White/White; White/Pink Foam/Dark Beetroot; White/Black/University Red; Pure Platinum/White/Sangria/Pink Prime; Black/White/Sunset Pulse; Pure Platinum/White/Mint Foam; Black/Black/Black,191.0,4.8
623,,Nike Air Max Pre-Day SE,Women's Shoes,12 Colors,$140,$68.97,https://www.nike.com/t/air-max-pre-day-se-womens-shoes-TNgd9M/DH5111-100,"Your perfect mix: a splash of heritage Nike running, a dash of DIY flavor and a whole lot of comfort. With powerful animal prints and bold splashes of color, this shoe delivers an edge to your trusted sporty style.",Light Liquid Lime/Pistachio Frost/Lime Ice/Black; Sail/Arctic Orange/Sanded Gold/Amethyst Wave; Light Soft Pink/Pink Oxford/Metallic Silver/Black; Hemp/Sail/Velvet Brown/Light Soft Pink; Light Bone/Sanddrift/Iron Grey/White; White/Summit White/Metallic Silver/Phantom; Phantom/Light Bone/Gum Yellow/Summit White; Rattan/Rose Whisper/Seafoam/Sail; Pure Platinum/Metallic Gold/Metallic Silver/White; Venice/Plum Fog/White/Grey Fog; Purple Dawn/Space Purple/Metallic Silver/Black; Summit White/Habanero Red/Light Curry/Black,5.0,5.0
624,Customize,Nike Metcon 8 By André Houdet,Custom Men's Training Shoes,1 Color,$160,,https://www.nike.com/u/custom-nike-metcon-8-by-you-10001328/8164255504,"The Nike Metcon 8 NBY allows you to add a little bling to your everyday workout routines with chrome options on everything from the Swoosh to the heel plate to shoelaces. An updated sport-inspired color palette complements a head-turning marble option along the outsole and sidewalls. Go big and bling out a design for a show-stopping look in the gym, or deck this Metcon 8 out in colors that define your inner athlete- the choice is yours.",Shown: Multi-Color/Multi-Color/Multi-Color/Multi-Color,,
625,,Jordan Delta 2 SE,Men's Shoes,1 Color,$140,$103.97,https://www.nike.com/t/jordan-delta-2-se-mens-shoes-1G06SD/DH6937-001,"The Jordan Delta 2 offers a fresh, fearless take on the features you want: durability, comfort, and an attitude that's Jordan to the core. We updated design lines and upgraded some components, while keeping the fundamentals you love from the first Delta in place. Enjoy the same combination of supportive, innovative materials, with new textures and heavy stitching to create a look that's both adventurous and iconic.",Shown: Black/White/Gym Red/University Red,0.0,0.0
626,,Air Jordan 8 Retro,Women's Shoes,1 Color,$200,,https://www.nike.com/t/air-jordan-8-retro-womens-shoes-bfG9d2/CI1236-007,The Air Jordan 8 Retro recaptures the memorable look of the '93 release. It's made with real and synthetic leather and has the same distinct and daring design that made the original such a '90s favorite.,Shown: Black/Opti Yellow/Taxi,47.0,4.8
627,,Nike Air Force 1 High LV8 3,Big Kids' Shoes,1 Color,$105,$89.97,https://www.nike.com/t/air-force-1-high-lv8-3-big-kids-shoes-636scX/CK0262-700,The Nike Air Force 1 High LV8 3 brings back the iconic design of the '82 original with suede leather that's soft and fuzzy. An Air-Sole unit cushions your feet for all-day comfort. Adjust the ankle strap for a perfect fit.,Shown: Wheat/Gum Light Brown/Wheat,7.0,5.0
628,,Giannis Immortality 2,Basketball Shoes,8 Colors,$85,$80.97,https://www.nike.com/t/giannis-immortality-2-basketball-shoes-X7xj7b/DM0825-003,Morph into all-timer with the Giannis Immortality 2. A plush foam package combined with a more focused fit in the midfoot in a super lightweight design means you can maintain a high level of intensity and focus when victory hangs in the balance—just like Giannis in the clutch.,White/Deep Royal Blue/Hyper Pink/Metallic Silver; Light Menta/Lilac/Mint Foam/White; Black/University Blue/Smoke Grey/White; Black/Wolf Grey/White/Black; White/Barely Volt/Grey Fog/Black; Cobblestone/Ironstone/Magic Ember/Black; Dark Marina Blue/Pink Gaze/Midnight Navy/Celestine Blue; Sail/Rattan/Yellow Strike/Smoke Grey,40.0,4.9
629,,Nike Air Max SC SE,Big Kids' Shoes,1 Color,$70,$54.97,https://www.nike.com/t/air-max-sc-se-big-kids-shoes-7BpvSP/DB3087-001,Go! Team! Go! The Nike Air Max SC SE makes the cut with colors and letters inspired by going varsity level. Max Air cushioning designed with a feel that’s lightweight and durable will have you feeling like you made first team.,,6.0,5.0
630,,Nike Ryz 365 2,Women's Shoes,4 Colors,$85,$72.97,https://www.nike.com/t/ryz-365-2-womens-shoes-LkNlGp/CU4874-600,"The Nike RYZ 365 2 brings you a futuristic take to classic '90s sneakers. The eye-catching midsole with stylized cutouts modernizes the chunky style with an airy aesthetic. A rich mixture of materials on the upper adds texture and style versatility. To top it off, the DIY lacing lets you personalize your style—wrap under the midsole or through webbing on the side and heel for a delicate touch to your bold look.",Black/White; Pink Oxford/Gum Light Brown/White/Summit White; Barely Rose/Barely Rose/Barely Rose; White/Pure Platinum/Metallic Platinum,91.0,4.6
631,Sustainable Materials,Nike Air Max TW,Baby/Toddler Shoes,3 Colors,$90,,https://www.nike.com/t/air-max-tw-baby-toddler-shoes-156rtX/DQ0298-100,"What do you think your kiddo will notice first about the Nike Air Max TW? Will it be the cool bubble of Air in the heel? Or will it be the sweet boomerang design on the sides? Inspired by our iconic Tailwind, which introduced the running world to Air cushioning, these are the lightweight and breathable shoes your little one will want to crawl and play all day in.",White/Racer Blue/Black/Speed Yellow; Black/Black/White/White; White/Pure Platinum/Violet Frost/Vivid Purple,0.0,0.0
632,Sustainable Materials,Nike Crater Remixa,Men's Shoes,2 Colors,$70,,https://www.nike.com/t/crater-remixa-mens-shoes-N0rlZf/DC6916-003,"Today's world brings choices. That’s why we’ve decided to keep sustainability in mind to create this running staple. Bridging futuristic details with a fresh design, the Nike Crater Remixa is made with at least 20% recycled material by weight. The Crater Foam midsole feels like you're walking on clouds while the upper lets you dress for the occasion.",Black/Dark Smoke Grey/White; Grey Fog/Chambray Blue/Light Bone/Black,62.0,4.3
633,,Nike Flex Runner 2 Lil,Baby/Toddler Shoes,1 Color,$45,$38.97,https://www.nike.com/t/flex-runner-2-lil-baby-toddler-shoes-k3zSKh/DM4206-800,"Fresh, juicy colors and smoothie-inspired swirls bring a summery vibe to the Nike Flex Runner 2 Lil, which we've made durable and flexible for growing feet. The stretchy slip-on design is easy to take on and off, while the supersoft sole cushions little feet.",Shown: Kumquat/Atomic Green/University Gold/White,2.0,5.0
634,Sustainable Materials,Nike Air Max Pre-Day SE,Men's Shoes,19 Colors,$140,$119.97,https://www.nike.com/t/air-max-pre-day-se-mens-shoes-JBXGg7/DM0037-001,Strap a little sunshine to your feet with the Nike Air Max Pre-Day SE. Carefree details and fresh colors deliver a beach day forecast. Airy textiles like canvas let you channel your summertime style onto the streets while the revamped Air window energizes your step.,White/Obsidian/Sail/Light Bone; Light Orewood Brown/Wheat Grass/Sail/Burnt Sunrise; Black/Gum Light Brown/Black; White/Pure Platinum/Volt/Black; University Gold/Black/Cinnabar/Gorge Green; White/Photon Dust/Summit White/Black; Wolf Grey/Rift Blue/Wheat Grass/Sail; Summit White/Mint Foam/Black/University Red; Sail/Mint Foam/Light Madder Root/Black; Rattan/Matte Olive/Hazel Rush/Vivid Green; Kumquat/Photon Dust/White/Pomegranate; Hasta/Iron Grey/Cave Stone/Anthracite; Chlorophyll/Treeline/Phantom/Camellia; Summit White/Pure Platinum/Wolf Grey/White; Smoke Grey/Iron Grey/White/Moon Fossil; Black/Anthracite/Iron Grey/Fresh Water; Cedar/Brown Basalt/Dark Pony/Pollen; Black/Anthracite/White; Phantom/Rattan/Light Bone/Black,0.0,0.0
635,Launching in SNKRS,Nike Dunk High 85,Men's Shoes,1 Color,$140,,https://www.nike.com/launch/r/DQ8799-101,,,,
636,,Nike Force Savage Shark 2,Little/Big Kids' Football Cleat,4 Colors,$55,,https://www.nike.com/t/force-savage-shark-2-little-big-kids-football-cleat-n2JrJN/AQ7723-601,The Nike Force Savage Shark 2 is built for the trenches. Its durable design is secured with 3 hook-and-loop straps for stabiilty. A Nike Fastflex outsole keeps things going with an articulated design that helps you move freely.,White/Wolf Grey/Black; Black/Black/White; University Red/Black/White; Game Royal/Black/White,143.0,4.8
637,Customize,Nike Air Zoom Pegasus FlyEase By You,Custom Women's Easy On/Off Road Running Shoes,6 Colors,$150,,https://www.nike.com/u/custom-nike-air-zoom-pegasus-flyease-by-you-10001267/3647010304,"Running is your daily ritual, with every step taking you closer to your personal goal. Let the Nike Air Zoom Pegasus help you ascend with its comfortable, intuitive design. A supportive sensation helps keep your foot contained, while underfoot Air adds a pop to your step as you transition from heel to toe. Nike FlyEase technology acts as a strap, helping secure the fit. Once you customize your trusted workhorse with wings, it’s time to fly.",,,
638,Just In,Nike Jr. Zoom Mercurial Vapor 15 Academy MG,Little/Big Kids' Multi-Ground Soccer Cleats,3 Colors,$60,,https://www.nike.com/t/jr-zoom-mercurial-vapor-15-academy-mg-little-big-kids-multi-ground-soccer-cleats-jHklc1/DR6046-810,Celebrate the game’s biggest competition in a design ignited by the science of connectivity and gravity that the world stage inspires. A carbon fiber chrome plate goes with a stunning futuristic look made for the feet of the globe’s greatest players. The textured design helps with ball control while you shoot at the goal or pass to your teammates. The best part? Zoom Air cushioning under the heel gives you bouncy comfort that lasts the entire game—and then some—for various surfaces.,Metallic Copper/Metallic Copper; Black/Summit White/Volt/Dark Smoke Grey; Yellow Strike/Volt Ice/Coconut Milk/Sunset Glow,0.0,0.0
639,,Nike ZoomX Zegama,Men's Trail Running Shoes,4 Colors,$160,$152.97,https://www.nike.com/t/zoomx-zegama-mens-trail-running-shoes-1t400b/DH0623-400,"Navigate the up and downs of uncompromising terrain with the Nike ZoomX Zegama. Developed with great grip and stability, it has you covered so you can keep climbing and reach greater personal heights when the going gets grimy and gritty. Whether it's a challenging, rocky landscape going uphill or a steep, slick decline down a treacherous trail, feel confident when you decide to off-road it.",Mineral Slate/Black/Green Glow/Light Bone; Ironstone/Black/Vivid Purple/Laser Blue; Black/White; Deep Royal Blue/Yellow Strike/Coconut Milk/White,8.0,4.8
640,,Air Jordan 1 Low Flyease,Big Kids' Shoes,1 Color,$90,,https://www.nike.com/t/air-jordan-1-low-flyease-big-kids-shoes-fG4nvd/DN4639-107,The Air Jordan 1 Low Flyease combines the coveted look of Michael Jordan's first signature sneaker with a FlyEase entry system that gets you in quickly and easily. Crisp leather and signature branding deliver premium style.,Shown: White/Black/Taxi,2.0,5.0
641,,Air Jordan Legacy 312 Low,Big Kids' Shoes,3 Colors,$100,$85.97,https://www.nike.com/t/air-jordan-legacy-312-low-big-kids-shoes-RxRScn/CD9054-071,The Air Jordan Legacy 312 celebrates MJ's legacy with this shout-out to Chicago's 312 area code. The design creates a modern mash-up of iconic Jordan elements.,White/Gym Red/Black; White/Black/Wolf Grey/Fire Red; Black/White/Metallic Gold,45.0,4.7
642,,Nike Team Hustle D 10 SE,Little Kids' Shoes,1 Color,$55,,https://www.nike.com/t/team-hustle-d-10-se-little-kids-shoes-0lDphk/DQ8376-500,"For every hop, skip and jump, the Nike Team Hustle D 10 is an easy slam dunk. With a traction pattern tailored to kids, soft cushioning and a design that’s durable and supportive, these basketball-inspired shoes are a major score for future all-stars that want to crush it at playtime. This edition features large metallic Swoosh logos and other details inspired by the light that shines within us all.",Shown: Barely Grape/Thunder Blue/Vivid Purple/Metallic Silver,0.0,0.0
643,,Nike Air Max Bolt,Little Kids' Shoes,2 Colors,$70,$34.97,https://www.nike.com/t/air-max-bolt-little-kids-shoes-qL5cF1/CW1627-500,The Nike Air Max Bolt is all about the Air unit that’s hard to miss. They're supportive and cushy (with elastic laces!) so your kiddos can get after their everyday adventures.,Dark Purple Dust/Pure Platinum/Copa/Light Thistle; Blue Void/White/Black/Signal Blue,14.0,4.2
644,Sustainable Materials,Nike Force 1 Crater Next Nature,Little Kids' Shoes,2 Colors,$80,$51.97,https://www.nike.com/t/force-1-crater-next-nature-little-kids-shoes-k6NPZP/DM1087-101,"The sneakers that helped define street style have been reimagined with supersoft cushioning that puts a spring in every step and jump little feet take. Plus, the synthetic leather overlays are durable and easy to clean.",Bright Spruce/Volt/Barely Volt/Phantom; White/White/Volt/Habanero Red,0.0,0.0
645,Sustainable Materials,Nike Blazer Mid '77 Premium,Men's Shoes,1 Color,$120,$80.97,https://www.nike.com/t/blazer-mid-77-premium-mens-shoes-2vZx36/DD8024-300,"Like your favorite blanket specially made for your feet, this streetwear staple, now made with at least 20% recycled material by weight, is ready for winter. A quilted upper made of partially recycled polyester, pairs perfectly with your favorite puffy jacket. Felt Swoosh on the side and 'NIKE' on the heel add seasonal charm. Its incredibly warm, fuzzy liner feels soft and extends a bit over the collar for classic snow-day appeal. Go ahead, perfect your outfit.",,0.0,0.0
646,,Nike Infinity Pro 2,Men's Golf Shoes (Wide),2 Colors,$110,,https://www.nike.com/t/infinity-pro-2-mens-golf-shoes-wide-GgZxGQ/DM8449-115,"When you said you wanted a golf shoe that not only looks like a modern running shoe, but also performs like one, we listened. Introducing the Nike Infinity Pro 2. It pairs the incredible comfort and versatility of integrated traction with a sleek, breathable textile upper that's easy to clean. Plus, it has Nike React foam cushioning, so you'll be more than ready to go from the course to the concrete, and everywhere in between.",Dark Smoke Grey/Black/Igloo/White; White/Photon Dust/Igloo/Black,0.0,0.0
647,,Nike Air Kukini SE,Men's Shoes,7 Colors,$140,,https://www.nike.com/t/air-kukini-se-mens-shoes-R9cph5/DV1894-100,"Let opposites attract with the Nike Air Kukini. Bridging casual with technical, its stretchy neoprene-like fabric hugs your foot while the caged support system adds a sporty finish (inspired by '90s ski suits). Visible Air cushioning puts the cherry on the bottom for this boundary-pushing paradox of perfection.",Black/Dark Smoke Grey/Coconut Milk/Volt; Multi-Color/Off Noir/Glow/White; Black/Multi-Color/White/Kumquat; White/Lemon Venom/Aurora Green/Black; Summit White/Mystic Navy/White/Aviator Grey; Coast/Signal Blue/White/Black; Black/White/Phantom/Anthracite,0.0,0.0
648,,Nike Force 1 LV8,Little Kids' Shoes,2 Colors,$75,$47.97,https://www.nike.com/t/force-1-lv8-little-kids-shoes-c3ZHm1/DQ0301-001,"Celebrate your mini world champion with classic kicks inspired by the theater of wrestling. Gold embroidery will have your little one feeling like they’re on top of the world while cracked leather adds an edgy look. Made for everyday wear, these durable shoes will have kiddos looking like a champ from the opening bell to the finishing move.",Black/Iron Grey/White/Black; White/Pure Platinum/Black/Black,1.0,5.0
649,,Nike Court Borough Low 2 SE,Little Kids' Shoes,1 Color,$50,,https://www.nike.com/t/court-borough-low-2-se-little-kids-shoes-S8d22f/DQ5980-100,Follow the trail of pawprints left by your little critter when they rock the Nike Court Borough Low 2 SE. Furry details bring these shoes to life while elastic laces and a hook-and-loop strap help make them easy to take on and off. Slip them on and let your kiddo pretend to be their favorite animal when they go out and play. Our only question is: which animal will they be?,Shown: Summit White/Glacier Blue/White/Valerian Blue,0.0,0.0
650,,Nike Force Trout 7 Pro MCS,Men's Baseball Cleats,2 Colors,$70,,https://www.nike.com/t/force-trout-7-pro-mcs-mens-baseball-cleats-Thr1gM/CT0828-102,"The Nike Force Trout 7 Pro MCS is designed for tough and dirty baseball, whether you're playing outfield, infield or running the bases. A podular, studded traction design delivers grip that flexes with you. Plus, a midfoot strap over the laces helps lock you in for game time.",White/Dynamic Turquoise/Black; Black/Dynamic Turquoise/White,52.0,4.8
651,Just In,Nike React Pegasus Trail 4,Women's Running Shoes,6 Colors,$140,,https://www.nike.com/t/react-pegasus-trail-4-womens-running-shoes-CQT261/DZ2758-112,"Running is your daily ritual, taking you from road to trail as you seek out new adventures and goals. Let the Nike React Pegasus Trail 4 take you there and back again with its supportive and springy feel. Underfoot traction keeps you going over rocky terrain while still providing a smooth ride for the road. Your trusted workhorse with wings is back and ready for an off-road journey.",Sanddrift/Pearl White/Sail/Coconut Milk; Arctic Orange/Light Madder Root/Purple Pulse/Magic Ember; Purple Smoke/Total Orange/Peach Cream/Vivid Purple; Black/Canyon Rust/Mint Foam/Alligator; Mantra Orange/Enamel Green/Bicoastal/Ghost Green; Black/Dark Grey/Wolf Grey/Aura,0.0,0.0
652,,Nike Blazer Mid '77 EMB,Shoes,1 Color,$100,,https://www.nike.com/t/blazer-mid-77-emb-shoes-pPDnQn/DN1718-300,"Praised for its classic simplicity and comfort, your tried-and-true wardrobe staple gets an NBA/WNBA spin. Basketball-like material on the upper adds a bold look, while the shoe's plush collar details and a durable design make it wearable every day.",,5.0,5.0
653,Customize,Nike Air Force 1 Low By You,Custom Women's Shoes,6 Colors,$130,,https://www.nike.com/u/custom-nike-air-force-1-low-by-you-10001370/5041974702,"Shine in satin, stay classic in canvas or get luxe with leather. No matter what you choose, these AF1s are all about you. 12 color choices and an additional gum rubber option for the sole mean your design is destined to be one of a kind—just like you.",,,
654,,Nike Air Max 90,Men's Shoes,1 Color,$130,$110.97,https://www.nike.com/t/air-max-90-mens-shoes-TlwKlZ/DJ9250-001,"Nothing as fly, nothing as comfortable, nothing as proven—the Nike Air Max 90 stays true to its roots with the iconic Waffle sole, stitched overlays and classic TPU accents. Fresh colors update the design while Max Air cushioning adds comfort to your journey.",,21.0,4.9
655,,Nike ZoomX Vaporfly Next% 2,Women's Road Racing Shoes,9 Colors,$250,,https://www.nike.com/t/zoomx-vaporfly-next-2-womens-road-racing-shoes-Dbqd8h/CU4123-800,"Continue the next evolution of speed with a racing shoe made to you help chase new goals and records. It helps improve comfort and breathability with a redesigned upper. From a 10K to a marathon, this model, like the previous version, has the responsive cushioning and secure support to push you towards your personal best.",University Blue/Light Crimson/Orange Trance/Light Orewood Brown; White/Volt/Racer Blue/Black; Magic Ember/University Red/Off Noir/Bright Crimson; Peach Cream/Green Shock/Barely Green/Black; White/Rush Orange/Doll/Laser Blue; Hyper Violet/Flash Crimson/Football Grey/Black; Black/Metallic Gold Coin/White; Barely Volt/Dynamic Turquoise/Volt/Black; Coconut Milk/Ghost Green/Mint Foam/Cave Purple,0.0,0.0
656,,Nike Jr. Tiempo Legend 9 Academy IC,Little/Big Kids' Indoor/Court Soccer Shoes,2 Colors,$55,,https://www.nike.com/t/jr-tiempo-legend-9-academy-ic-little-big-kids-indoor-court-soccer-shoes-GBBBLx/DA1329-002,"1 of our lightest Tiempos to date, the Nike Jr. Tiempo Legend 9 Academy IC lets you go on the offensive with a low-profile design that's reinvented for attackers. The upper has raised textures backed by soft foam pods for precise dribbling, passing and shooting, while a rubber sole helps supercharge traction during small-sided games.",Black/Summit White/Light Photo Blue/Dark Smoke Grey; Phantom/Sunset Glow/Yellow Strike; Black/Iron Grey/Black,3.0,4.7
657,,Nike Team Hustle D 10 FlyEase,Big Kids' Easy On/Off Basketball Shoes,2 Colors,$60,$46.97,https://www.nike.com/t/team-hustle-d-10-flyease-big-kids-easy-on-off-basketball-shoes-KcDjNW/DD7303-103,"From playtime to post-up, the Nike Team Hustle D 10 FlyEase is a slam dunk for players of all levels. With optimized traction on the sole, a super easy entry system, plus a design that’s durable and supportive—these are a major score whether you're shooting hoops or climbing on the playground.",Summit White/Game Royal/Bright Crimson/Midnight Navy; Black/White/Photon Dust/Metallic Gold; Black/Volt/White/Metallic Silver; Smoke Grey/Dark Smoke Grey/Washed Teal/Siren Red,43.0,4.4
658,Available in SNKRS,Nike Air Max Penny,Men's Shoes,1 Color,$170,,https://www.nike.com/launch/r/DV7442-200,,,,
659,Sustainable Materials,Nike Downshifter 12,Little Kids' Shoes,3 Colors,$60,,https://www.nike.com/t/downshifter-12-little-kids-shoes-FJwvzq/DM4193-500,"Whether your kiddo is playing a game of tag or taking up a new sport, they can feel confident pulling on the Nike Downshifter 12. Breathable support up top makes it lightweight and versatile for lots of activities. Plus, full-length rubber on the sole means durability to go the extra mile.",Violet Frost/Pure Platinum/Vivid Purple/Metallic Silver; Midnight Navy/Game Royal/Game Royal; Volt/Barely Volt/Black/Bright Spruce,6.0,4.2
660,,Nike Air Max 2021 SE,Big Kids' Shoes,5 Colors,$150,$99.97,https://www.nike.com/t/air-max-2021-se-big-kids-shoes-FfD2HL/DJ0449-001,"We’ve gone into the lab to rethink everything in the Nike Air Max 2021. We put our best people on it, testing out a new Air unit with a collapsible cage that makes your feet bounce like never before. Mixing our most important features—lightweight, durable and revolutionary—we've designed these kicks with the planet in mind, too. It’s the definition of innovation for the next generation of Air Max.",Pink Glaze/White/Black/Pink Glaze; Wolf Grey/Black/White/Clear Jade; Summit White/Photon Dust/Black/Volt; Summit White/Off Noir/Amethyst Ash/Metallic Red Bronze; Flat Pewter/Medium Ash/White/Siren Red; Grey Fog/Flat Pewter/White/Photo Blue; Black/Mystic Red/Cosmic Clay/White,0.0,0.0
661,,Nike Manoa,Men's Boot,1 Color,$95,$90.97,https://www.nike.com/t/manoa-mens-boot-2KT2nJNR/456975-001,"Durable leather, breathable mesh and rugged lugs combine to create the mid-height Nike Manoa Boot. Trail-inspired details include webbing pull tab, metal eyelets and round laces that are easy to grab with gloved hands.",Shown: Black/Black/Black,35.0,4.3
662,,Nike Air Zoom Infinity Tour NEXT%,Men's Golf Shoes (Wide),4 Colors,$160,,https://www.nike.com/t/air-zoom-infinity-tour-next-mens-golf-shoes-wide-ZQmgJ0/DM8446-015,"We listened to the feedback you had on the Infinity Tour, refined it and brought it to life on the Nike Air Zoom Infinity Tour NEXT%. We increased the overall volume to give your foot more room, put an extra Zoom Air unit in the forefoot for even more energy transfer through your swing, and added more traction in key areas to help reduce slipping. The result is an incredibly responsive, comfortable shoe that we know you're going to love.",Sail/Coconut Milk/Ghost Green/Barely Green; White/Copa/Light Smoke Grey/Black; White/Grey Fog/Dynamic Turquoise/Black; Black/Iron Grey/Dynamic Turquoise/White,20.0,4.5
